,Index_Link,Legal_Name,Town/Suburb,State,Status,Size,ABN,Website,Revenue,Expenses,Cause/s,Last_report_date,ref_religion,website,revenue,expenses,causes,lastreport,religious_ref
1724,https://www.acnc.gov.au/charity/charities/86fd9aad-3aaf-e811-a962-000d3ad24a0d/profile,Perth United Malayalee Association Inc.,Harrisdale,WA,Registered,Small,58699120455,,,,,,,http://puma.org.au/,53108.0,42498.0,Adults - aged 25 to under 65; Adults - aged 65 and over; Children - aged 6 to under 15; Early childhood - aged under 6; Families; People in rural/regional/remote communities; Victims of disaster; Youth - 15 to under 25,16 Jan 2022,0.0
1725,https://www.acnc.gov.au/charity/charities/0fc843a1-3aaf-e811-a962-000d3ad24a0d/profile,The Townsend Memorial Scholarship,Mirador,NSW,Registered,Small,84509156504,,,,,,,,14966.0,17974.0,Other; People in rural/regional/remote communities; Youth - 15 to under 25,2 Feb 2021,0.0
1726,https://www.acnc.gov.au/charity/charities/aa4c3ba7-3aaf-e811-a962-000d3ad24a0d/profile,Mildura Chinese Christian Fellowship (Church) Inc.,Unavailable,Unavailable,Registered,Small,77398458492,,,,,,,,14381.0,11857.0,Adults - aged 25 to under 65; Families; Other; Youth - 15 to under 25,24 Mar 2022,1.0
1727,https://www.acnc.gov.au/charity/charities/63b843a1-3aaf-e811-a962-000d3ad24a0d/profile,Confidence Grace and Faith Ministry to the Women of Liberia Incorporated,Christies Beach,SA,Registered,Small,67480564691,,,,,,,https://https:wra.org.au/2208cgfliberia,3196.0,8579.0,Children - aged 6 to under 15; Females; Financially disadvantaged people,2 Dec 2021,0.0
1728,https://www.acnc.gov.au/charity/charities/acc843a1-3aaf-e811-a962-000d3ad24a0d/profile,Asthma Foundation SA Trust,Adelaide,SA,Registered,Small,63262247312,,,,,,,,189247.0,278940.0,People with chronic illness (including terminal illness),28 Jan 2022,0.0
1729,https://www.acnc.gov.au/charity/charities/ffd71395-3aaf-e811-a962-000d3ad24a0d/profile,Barefoot to Boots Foundation,Unley Bc,SA,Registered,Small,43689202947,,,,,,,http://barefoottoboots.org/,15198.0,35815.0,Other charities,21 Jan 2022,0.0
1730,https://www.acnc.gov.au/charity/charities/89b943a1-3aaf-e811-a962-000d3ad24a0d/profile,Wildlife Rescue Whyalla and Surrounding Areas Incorporated,Whyalla Norrie,SA,Registered,Small,39474473425,,,,,,,http://wrwsainc.wixsite.com/website,6705.0,18154.0,Animals,30 Jan 2022,0.0
1731,https://www.acnc.gov.au/charity/charities/e7493ba7-3aaf-e811-a962-000d3ad24a0d/profile,Sydney Culture Network Limited,Paddington,NSW,Registered,Small,33623167760,,,,,,,http://sydneyculture.org/,0.0,88.0,Aboriginal and Torres Strait Islander people; Adults - aged 25 to under 65; People from a culturally and linguistically diverse background,4 Jun 2022,0.0
1732,https://www.acnc.gov.au/charity/charities/da4c3ba7-3aaf-e811-a962-000d3ad24a0d/profile,Green Southern Cross Community Ltd,Unavailable,Unavailable,Registered,Small,37618962717,,,,,,,,0.0,0.0,,24 Jun 2020,0.0
1733,https://www.acnc.gov.au/charity/charities/0ec843a1-3aaf-e811-a962-000d3ad24a0d/profile,Ride Aid Inc,East Fremantle,WA,Registered,Small,34728277139,,,,,,,http://www.rideaid.net/,15852.0,7000.0,Financially disadvantaged people; Overseas communities or charities; People in rural/regional/remote communities; People with disabilities; Youth - 15 to under 25,31 Jan 2022,0.0
1734,https://www.acnc.gov.au/charity/charities/d94c3ba7-3aaf-e811-a962-000d3ad24a0d/profile,Husky Rescue WA Inc,Cannington,WA,Registered,Small,80588919189,,,,,,,http://www.huskyrescue.com.au/,44691.0,44951.0,Animals; Families,31 Jan 2022,0.0
1735,https://www.acnc.gov.au/charity/charities/57493ba7-3aaf-e811-a962-000d3ad24a0d/profile,INCIDENT RESPONSE AUSTRALIA TECHNICAL EXCHANGE INC.,Brunswick East,VIC,Registered,Small,55167112533,,,,,,,,0.0,176.0,General community in Australia; Other,29 Jan 2022,0.0
1736,https://www.acnc.gov.au/charity/charities/06f79aad-3aaf-e811-a962-000d3ad24a0d/profile,The Empowerment Challenge Inc,Unavailable,Unavailable,Registered,Small,64884331680,,,,,,,http://www.empowermentchallenge.org.au/,18155.0,8489.0,"Aboriginal and Torres Strait Islander people; Adults - aged 25 to under 65; Children - aged 6 to under 15; Early childhood - aged under 6; Families; Females; Financially disadvantaged people; Gay, lesbian, bisexual, transgender or intersex persons; Migrants, refugees or asylum seekers; People at risk of homelessness/ people experiencing homelessness; People from a culturally and linguistically diverse background; People in rural/regional/remote communities; Unemployed persons; Victims of crime (including family violence); Youth - 15 to under 25",30 Jan 2022,0.0
1737,https://www.acnc.gov.au/charity/charities/2f423ba7-3aaf-e811-a962-000d3ad24a0d/profile,World Central Ltd,Macleay Island,QLD,Registered,Small,49622481378,,,,,,,http://www.worldcentral.com.au/,0.0,0.0,Aboriginal and Torres Strait Islander people; Adults - aged 25 to under 65; Adults - aged 65 and over; Children - aged 6 to under 15; Early childhood - aged under 6; Families; Females; Financially disadvantaged people; General community in Australia; Males; Other charities; People at risk of homelessness/ people experiencing homelessness; People from a culturally and linguistically diverse background; People in rural/regional/remote communities; People with chronic illness (including terminal illness); People with disabilities; Unemployed persons; Veterans and/or their families; Victims of crime (including family violence); Victims of disaster; Youth - 15 to under 25,28 Apr 2022,0.0
1738,https://www.acnc.gov.au/charity/charities/bdba43a1-3aaf-e811-a962-000d3ad24a0d/profile,Harrison Riedel Foundation Limited,Longueville,NSW,Registered,Small,47619978513,,,,,,,http://www.harrisonriedelfoundation.com/,216842.0,117109.0,"Adults - aged 25 to under 65; Children - aged 6 to under 15; Females; Gay, lesbian, bisexual, transgender or intersex persons; General community in Australia; Males; People in rural/regional/remote communities; Youth - 15 to under 25",28 Jan 2022,0.0
1739,https://www.acnc.gov.au/charity/charities/314c3ba7-3aaf-e811-a962-000d3ad24a0d/profile,The Wangaratta Anglican Development Fund,Wangaratta,VIC,Registered,Small,51754436565,,,,,,,http://www.wangaratta-anglican.org.au/,0.0,0.0,Females; Males,1 Apr 2022,1.0
1740,https://www.acnc.gov.au/charity/charities/bc6292b3-3aaf-e811-a962-000d3ad24a0d/profile,Unheard Voices Inc,Unavailable,Unavailable,Registered,Small,24690023219,,,,,,,,2144.0,2142.0,Financially disadvantaged people; General community in Australia; People with disabilities,16 Jan 2020,0.0
1741,https://www.acnc.gov.au/charity/charities/a36592b3-3aaf-e811-a962-000d3ad24a0d/profile,Mia Wilkinson Trust - Necessitous Circumstances Fund,Unavailable,Unavailable,Registered,Small,75712524454,,,,,,,https://movementformia.org/miawilkinsontrust/,24743.0,666.0,Children - aged 6 to under 15; People with disabilities,5 Aug 2022,0.0
1742,https://www.acnc.gov.au/charity/charities/b9423ba7-3aaf-e811-a962-000d3ad24a0d/profile,Padua College Parents and Friends Association,Kedron,QLD,Registered,Small,67100374256,,,,,,,http://www.padua.qld.edu.au/,105719.0,99601.0,Children - aged 6 to under 15; Males; Youth - 15 to under 25,4 Jul 2022,0.0
1743,https://www.acnc.gov.au/charity/charities/70c143a1-3aaf-e811-a962-000d3ad24a0d/profile,Football Empowerment Incorporated,Melbourne,VIC,Registered,Small,52475545059,,,,,,,http://www.footballempowerment.org.au/,83965.0,73057.0,Children - aged 6 to under 15; Females; Financially disadvantaged people; Males; People from a culturally and linguistically diverse background; Unemployed persons; Youth - 15 to under 25,7 Jun 2022,0.0
1744,https://www.acnc.gov.au/charity/charities/07f79aad-3aaf-e811-a962-000d3ad24a0d/profile,ASIT (WA) Ltd.,Edgewater,WA,Registered,Small,11624336054,,,,,,,http://www.stitchintime.org.au/,68594.0,44600.0,Aboriginal and Torres Strait Islander people; Adults - aged 25 to under 65; Adults - aged 65 and over; Children - aged 6 to under 15; Families; Females; Financially disadvantaged people; Males; People at risk of homelessness/ people experiencing homelessness; People from a culturally and linguistically diverse background; People in rural/regional/remote communities; People with disabilities; Unemployed persons; Youth - 15 to under 25,1 Feb 2022,0.0
1745,https://www.acnc.gov.au/charity/charities/2ff99aad-3aaf-e811-a962-000d3ad24a0d/profile,Friends4Fiji Incorporated,Unavailable,Unavailable,Registered,Small,87887514554,,,,,,,http://www.friends4fiji.org/,993.0,448.0,Adults - aged 25 to under 65; Financially disadvantaged people; General community in Australia; Overseas communities or charities; People from a culturally and linguistically diverse background; People in rural/regional/remote communities; Youth - 15 to under 25,6 Mar 2022,0.0
1746,https://www.acnc.gov.au/charity/charities/819c4a9b-3aaf-e811-a962-000d3ad24a0d/profile,The South End Progress Association Inc.,South Gladstone,QLD,Registered,Small,57697253438,,,,,,,,8796.0,35690.0,Adults - aged 25 to under 65; Adults - aged 65 and over; Children - aged 6 to under 15; Families; Females; Financially disadvantaged people; Males; People in rural/regional/remote communities; Youth - 15 to under 25,13 May 2022,0.0
1747,https://www.acnc.gov.au/charity/charities/91ee4cba-3aaf-e811-a962-000d3ad24a0d/profile,ROBWC Inc,Bayswater Nth,VIC,Registered,Small,17381317370,,,,,,,http://robwc.org.au/,69415.0,58725.0,Adults - aged 25 to under 65; Adults - aged 65 and over; Children - aged 6 to under 15; Early childhood - aged under 6; Families; Females; Financially disadvantaged people; Males; People at risk of homelessness/ people experiencing homelessness; Victims of crime (including family violence); Youth - 15 to under 25,30 Jan 2022,0.0
1748,https://www.acnc.gov.au/charity/charities/916a92b3-3aaf-e811-a962-000d3ad24a0d/profile,Early Years Intercultural Association Ltd,Liverpool,NSW,Registered,Small,94625601247,,,,,,,http://www.eyia.org.au/,2000.0,736.0,Aboriginal and Torres Strait Islander people; Adults - aged 25 to under 65; Adults - aged 65 and over; Children - aged 6 to under 15; Early childhood - aged under 6; Families; Females; Financially disadvantaged people; General community in Australia; Males; Other charities; People at risk of homelessness/ people experiencing homelessness; People from a culturally and linguistically diverse background; People with disabilities; Unemployed persons; Veterans and/or their families; Victims of crime (including family violence); Victims of disaster; Youth - 15 to under 25,31 Jan 2022,0.0
1749,https://www.acnc.gov.au/charity/charities/0d6392b3-3aaf-e811-a962-000d3ad24a0d/profile,Chosen Generation Christian Church Inc.,Gosnells,WA,Registered,Small,50554879663,,,,,,,,0.0,0.0,Aboriginal and Torres Strait Islander people; Adults - aged 25 to under 65; Adults - aged 65 and over; Children - aged 6 to under 15; Early childhood - aged under 6; Families; Females; Financially disadvantaged people; General community in Australia; Males; Other charities; People at risk of homelessness/ people experiencing homelessness; People from a culturally and linguistically diverse background; People in rural/regional/remote communities; People with chronic illness (including terminal illness); People with disabilities; Victims of crime (including family violence); Victims of disaster; Youth - 15 to under 25,3 Feb 2020,1.0
1750,https://www.acnc.gov.au/charity/charities/d8f24cba-3aaf-e811-a962-000d3ad24a0d/profile,Faye Foundation,Unavailable,Unavailable,Registered,Small,57527724402,,,,,,,http://papisfayefoundation.com/,32000.0,0.0,Adults - aged 65 and over; Children - aged 6 to under 15; Families; People in rural/regional/remote communities; Youth - 15 to under 25,26 Jan 2022,0.0
1751,https://www.acnc.gov.au/charity/charities/17f04cba-3aaf-e811-a962-000d3ad24a0d/profile,ACT Heritage Rail Holdings Limited,Kingston,ACT,Registered,Small,91625904627,,,,,,,http://www.canberrarail.org.au/,17500.0,13861.0,Families,28 Jan 2022,0.0
1752,https://www.acnc.gov.au/charity/charities/4263607c-a2cd-e811-a963-000d3ad24a0d/profile,The Potters House Christian Center- Werribee,Werribee,VIC,Registered,Small,84498425883,,,,,,,http://werribeechurch.com.au/,0.0,0.0,Adults - aged 25 to under 65; Adults - aged 65 and over; Children - aged 6 to under 15; Early childhood - aged under 6; Families; Females; Financially disadvantaged people; Males; People from a culturally and linguistically diverse background; Unemployed persons; Youth - 15 to under 25,14 Dec 2021,1.0
1753,https://www.acnc.gov.au/charity/charities/91a24a9b-3aaf-e811-a962-000d3ad24a0d/profile,Sylvan Glades Inc,Monbulk,VIC,Registered,Small,51445386189,,,,,,,http://www.sylvanglades.com.au/,168607.0,286306.0,Adults - aged 65 and over; Families; Females; Financially disadvantaged people; Males; People in rural/regional/remote communities; People with disabilities,26 Nov 2021,0.0
1754,https://www.acnc.gov.au/charity/charities/254d3ba7-3aaf-e811-a962-000d3ad24a0d/profile,Queensland Employment Support Services Ltd,Coorparoo,QLD,Registered,Small,95621436226,,,,,,,,79490.0,72196.0,Other; Unemployed persons,9 Aug 2021,0.0
1755,https://www.acnc.gov.au/charity/charities/c56292b3-3aaf-e811-a962-000d3ad24a0d/profile,Be Happy Music Club Ltd,Byron Bay,NSW,Registered,Small,85624029812,,,,,,,http://www.behappymusicclub.org/,4479.0,1902.0,Children - aged 6 to under 15; Females; Financially disadvantaged people; Males; Overseas communities or charities; People at risk of homelessness/ people experiencing homelessness; People from a culturally and linguistically diverse background; People in rural/regional/remote communities; People with chronic illness (including terminal illness); People with disabilities; Victims of crime (including family violence),19 Jan 2022,0.0
1756,https://www.acnc.gov.au/charity/charities/b1f79aad-3aaf-e811-a962-000d3ad24a0d/profile,Antioch Network Church Incorporated,Unavailable,Unavailable,Registered,Small,36850607436,,,,,,,,85303.0,84075.0,Aboriginal and Torres Strait Islander people; Adults - aged 25 to under 65; Families; Financially disadvantaged people; People at risk of homelessness/ people experiencing homelessness; People from a culturally and linguistically diverse background,29 Nov 2021,1.0
1757,https://www.acnc.gov.au/charity/charities/79f89aad-3aaf-e811-a962-000d3ad24a0d/profile,Tamworth Toy Library Inc,West Tamworth,NSW,Registered,Small,41495721770,,,,,,,https://www.facebook.com/tamworthtoylibrary/?ref=bookmarks,30055.0,30752.0,Aboriginal and Torres Strait Islander people; Early childhood - aged under 6; Families; Females; Financially disadvantaged people; General community in Australia; Males; People from a culturally and linguistically diverse background; People in rural/regional/remote communities; People with disabilities,27 Jan 2022,0.0
1758,https://www.acnc.gov.au/charity/charities/e8ef4cba-3aaf-e811-a962-000d3ad24a0d/profile,Alatulya Inc,Kippa-ring,QLD,Registered,Small,80402015971,,,,,,,http://www.morethanavillage.com.au/,1642.0,0.0,Children - aged 6 to under 15; Financially disadvantaged people; People at risk of homelessness/ people experiencing homelessness; Victims of crime (including family violence); Youth - 15 to under 25,27 Jan 2021,0.0
1759,https://www.acnc.gov.au/charity/charities/8f71b571-30ba-e811-a962-000d3ad24a0d/profile,Melbourne Holy City Movement Inc,Carlton,VIC,Registered,Small,41447619342,,,,,,,http://melbourneholycitymarch.com/,2594.0,2864.0,General community in Australia,31 Mar 2021,1.0
1760,https://www.acnc.gov.au/charity/charities/1d6cbd6b-30ba-e811-a962-000d3ad24a0d/profile,Tradies IN Sight Inc,Dubbo,NSW,Registered,Small,97307837277,,,,,,,http://www.tradiesinsight.support/,72143.0,37400.0,Adults - aged 25 to under 65; Adults - aged 65 and over; Families; Females; Males; People in rural/regional/remote communities; Youth - 15 to under 25,23 Oct 2021,0.0
1761,https://www.acnc.gov.au/charity/charities/246992b3-3aaf-e811-a962-000d3ad24a0d/profile,Asha Lectures Incorporated,Unavailable,Unavailable,Registered,Small,69120879836,,,,,,,https://ashalectures.org/,16428.0,0.0,Children - aged 6 to under 15; Financially disadvantaged people; Youth - 15 to under 25,22 Feb 2022,0.0
1762,https://www.acnc.gov.au/charity/charities/7cf64cba-3aaf-e811-a962-000d3ad24a0d/profile,Grace Ministries International Property Ltd,Ferny Hills,QLD,Registered,Small,79161463010,,,,,,,,213209.0,204483.0,Adults - aged 25 to under 65; Adults - aged 65 and over; Families; Females; General community in Australia; Males; Overseas communities or charities,28 Jan 2022,1.0
1763,https://www.acnc.gov.au/charity/charities/034e9d5f-30ba-e811-a962-000d3ad24a0d/profile,Charis Care Ltd,Unavailable,Unavailable,Registered,Small,15628091243,,,,,,,https://www.facebook.com/CharisCareQld/,15550.0,7625.0,"Migrants, refugees or asylum seekers",26 Mar 2020,0.0
1764,https://www.acnc.gov.au/charity/charities/666bbd6b-30ba-e811-a962-000d3ad24a0d/profile,Re-Home-It Limited,South Yarra,VIC,Registered,Small,43625741175,,,,,,,,2.0,725.0,Families; Females; Financially disadvantaged people; Victims of crime (including family violence),10 Jan 2022,0.0
1765,https://www.acnc.gov.au/charity/charities/506b92b3-3aaf-e811-a962-000d3ad24a0d/profile,Rapids Landing Primary School Parents and Citizens' Association Incorporated,Margaret River,WA,Registered,Small,37986273731,,,,,,,,21123.0,11739.0,Children - aged 6 to under 15; Early childhood - aged under 6,1 Jul 2022,0.0
1766,https://www.acnc.gov.au/charity/charities/f967740c-2caf-e811-a95e-000d3ad24c60/profile,Croatian Catholic Church,Figtree,NSW,Registered,Small,53848303699,,,,,,,http://www.hkc.com.au/,0.0,0.0,Adults - aged 25 to under 65; Adults - aged 65 and over; Children - aged 6 to under 15; Early childhood - aged under 6; Families; Youth - 15 to under 25,25 Jan 2022,1.0
1767,https://www.acnc.gov.au/charity/charities/024e9d5f-30ba-e811-a962-000d3ad24a0d/profile,currumbin happy group inc,Palm Beach,QLD,Registered,Small,65919849374,,,,,,,,14392.0,16697.0,Adults - aged 65 and over; Females; Males,26 Jan 2022,0.0
1768,https://www.acnc.gov.au/charity/charities/83617e06-2caf-e811-a95e-000d3ad24c60/profile,The Trustee For Trude Weiss Foundation,Melbourne,VIC,Registered,Small,25812210249,,,,,,,,6515.0,30481.0,Youth - 15 to under 25,25 May 2022,0.0
1769,https://www.acnc.gov.au/charity/charities/74f94cba-3aaf-e811-a962-000d3ad24a0d/profile,Gippsland Farmer Relief Incorporated,Traralgon East,VIC,Registered,Small,19524853715,,,,,,,http://www.gippslandfarmerrelief.com.au/,110402.0,200603.0,Families; Females; Financially disadvantaged people; Males; People in rural/regional/remote communities; Victims of disaster,1 Feb 2022,0.0
1770,https://www.acnc.gov.au/charity/charities/47f86ac0-3aaf-e811-a962-000d3ad24a0d/profile,Church of England Norfolk Island,Norfolk Island,NSW,Registered,Small,71270027937,,,,,,,http://www.norfolkislandchurchofengland.com/,0.0,0.0,General community in Australia,6 May 2022,1.0
1771,https://www.acnc.gov.au/charity/charities/9dee4cba-3aaf-e811-a962-000d3ad24a0d/profile,Eternity Chapel Limited,Minlaton,SA,Registered,Small,49626878528,,,,,,,http://www.eternitychapel.com/,108550.0,119452.0,Families; General community in Australia,23 Jan 2022,1.0
1772,https://www.acnc.gov.au/charity/charities/c7607e06-2caf-e811-a95e-000d3ad24c60/profile,Greenville Kindergarten Incorporated,Grovedale,VIC,Registered,Small,31760024304,,,,,,,https://www.bcyf.org.au/greenville-kindergarten/,5301.0,6242.0,Early childhood - aged under 6,26 Jan 2022,0.0
1773,https://www.acnc.gov.au/charity/charities/044e9d5f-30ba-e811-a962-000d3ad24a0d/profile,BUILD CAMBODIA PTY. LTD.,Brunswick,VIC,Registered,Small,22626391964,,,,,,,https://www.facebook.com/BuildCambodia/,33377.0,23983.0,Families; People with chronic illness (including terminal illness),5 Jun 2022,0.0
1774,https://www.acnc.gov.au/charity/charities/a560740c-2caf-e811-a95e-000d3ad24c60/profile,Church Of The Nazarene Maryborough Incorporated,Maryborough,QLD,Registered,Small,77580135179,,,,,,,,78702.0,50716.0,,,1.0
1775,https://www.acnc.gov.au/charity/charities/3264740c-2caf-e811-a95e-000d3ad24c60/profile,VERBUM DEI MISSIONARY FRATERNITY SYDNEY INCORPORATED,Bexley,NSW,Registered,Small,77619267273,,,,,,,http://verbumdeiaustralia.com/,89342.0,72216.0,Adults - aged 25 to under 65; Adults - aged 65 and over; Families; General community in Australia; Youth - 15 to under 25,30 Jun 2022,0.0
1776,https://www.acnc.gov.au/charity/charities/80f84cba-3aaf-e811-a962-000d3ad24a0d/profile,Karuna Sri Lanka Inc.,Padbury,WA,Registered,Small,33644180262,,,,,,,http://www.karunasrilanka.com.au/,28327.0,16885.0,Children - aged 6 to under 15; Families; Females; Financially disadvantaged people; Males; Overseas communities or charities; Youth - 15 to under 25,20 Dec 2021,0.0
1777,https://www.acnc.gov.au/charity/charities/e2fa4cba-3aaf-e811-a962-000d3ad24a0d/profile,Someone Who Cares Ltd,Unavailable,Unavailable,Registered,Small,14627070697,,,,,,,https://www.someonewhocares.net.au/,25639.0,44092.0,Families; Financially disadvantaged people; General community in Australia; Overseas communities or charities; People from a culturally and linguistically diverse background; People in rural/regional/remote communities; Youth - 15 to under 25,28 Jan 2022,0.0
1778,https://www.acnc.gov.au/charity/charities/752aad77-30ba-e811-a962-000d3ad24a0d/profile,Myriam Cottage Inc,Unavailable,Unavailable,Registered,Small,98225830047,,,,,,,,46842.0,0.0,Females,17 Jun 2022,0.0
1779,https://www.acnc.gov.au/charity/charities/2f6592b3-3aaf-e811-a962-000d3ad24a0d/profile,Blind Bats Inc.,Unavailable,Unavailable,Registered,Small,66816964232,,,,,,,http://www.blindbats.org/,203934.0,20363.0,Adults - aged 25 to under 65; Adults - aged 65 and over; Families; People with disabilities; Youth - 15 to under 25,17 Jan 2022,0.0
1780,https://www.acnc.gov.au/charity/charities/4ad9c23b-dfc5-e811-a963-000d3ad24a0d/profile,ADVENTURE WORKS AUSTRALIA LTD,Whitfield,VIC,Registered,Small,70627050613,,,,,,,http://adventureworks.org.au/,61491.0,65759.0,Aboriginal and Torres Strait Islander people; Adults - aged 25 to under 65; Adults - aged 65 and over; Children - aged 6 to under 15; Families; Females; Financially disadvantaged people; Males; People at risk of homelessness/ people experiencing homelessness; People with chronic illness (including terminal illness); People with disabilities; Pre/post release offenders and/or their families; Unemployed persons; Victims of crime (including family violence); Youth - 15 to under 25,15 Jun 2022,0.0
1781,https://www.acnc.gov.au/charity/charities/c1cb5b82-a2cd-e811-a963-000d3ad24a0d/profile,Galbraith Family Charitable Trust The Donaldson Bequest,Adelaide,SA,Registered,Small,68273326520,,,,,,,,142618.0,112044.0,General community in Australia,20 Jan 2022,0.0
1782,https://www.acnc.gov.au/charity/charities/59617e06-2caf-e811-a95e-000d3ad24c60/profile,Watt Preah Puth Mean Chey Ass Inc,Unavailable,Unavailable,Registered,Small,25943509688,,,,,,,,116695.0,41139.0,"Adults - aged 25 to under 65; Adults - aged 65 and over; Children - aged 6 to under 15; Families; Females; Financially disadvantaged people; General community in Australia; Males; Migrants, refugees or asylum seekers; Other charities; Other: DIVERSE NATIONALITY FROM DIFFERNT BACKGROUND ARE WELCOME; Overseas communities or charities; People at risk of homelessness/ people experiencing homelessness; People from a culturally and linguistically diverse background; People in rural/regional/remote communities; People with chronic illness (including terminal illness); People with disabilities; Unemployed persons; Victims of disaster; Youth - 15 to under 25",2 May 2020,1.0
1783,https://www.acnc.gov.au/charity/charities/c3427a12-2caf-e811-a95e-000d3ad24c60/profile,Scottsdale Gospel Hall,Scottsdale,TAS,Registered,Small,63803149835,,,,,,,,0.0,0.0,Children - aged 6 to under 15; Families; Females; General community in Australia; Males; Other charities; Overseas communities or charities,24 Jan 2022,1.0
1784,https://www.acnc.gov.au/charity/charities/735f7e06-2caf-e811-a95e-000d3ad24c60/profile,Allora Presbyterian Church,Spring Hill,QLD,Registered,Small,31756053220,,,,,,,http://www.pcq.org.au/,0.0,0.0,Females; General community in Australia; Males,8 Jun 2022,1.0
1785,https://www.acnc.gov.au/charity/charities/71477a12-2caf-e811-a95e-000d3ad24c60/profile,Anglican Parish Of Sharkbay,Denham,WA,Registered,Small,13460486859,,,,,,,http://www.anglicandnwa.org/,0.0,0.0,General community in Australia,21 Jun 2022,1.0
1786,https://www.acnc.gov.au/charity/charities/26487a12-2caf-e811-a95e-000d3ad24c60/profile,Mission To Seafarers (Albany Branch),Albany Dc,WA,Registered,Small,68554974746,,,,,,,http://www.missiontoseafarers.or.au/,34669.0,35951.0,Adults - aged 25 to under 65,12 Jun 2022,0.0
1787,https://www.acnc.gov.au/charity/charities/ff65740c-2caf-e811-a95e-000d3ad24c60/profile,Gove Peninsula Surf Life Saving Club Incorporated,Nhulunbuy,NT,Registered,Small,73148533994,,,,,,,http://www.govesurfclub.org/,104114.0,135919.0,Adults - aged 25 to under 65; Adults - aged 65 and over; Children - aged 6 to under 15; Families; General community in Australia; Youth - 15 to under 25,27 Jun 2022,0.0
1788,https://www.acnc.gov.au/charity/charities/9b417a12-2caf-e811-a95e-000d3ad24c60/profile,Buddhism Diamond Way Australia Pty Limited,Lyneham,ACT,Registered,Small,38096200332,,,,,,,,158420.0,28544.0,Adults - aged 25 to under 65; Adults - aged 65 and over; General community in Australia; Youth - 15 to under 25,29 Jan 2022,1.0
1789,https://www.acnc.gov.au/charity/charities/4161740c-2caf-e811-a95e-000d3ad24c60/profile,The Old School Mt Wilson Inc,Mount Wilson,NSW,Registered,Small,32006465124,,,,,,,https://www.mtwilson.com.au/mt-wilson-study-centre/artists-in-residence,8305.0,10609.0,General community in Australia,23 Jun 2022,0.0
