,Index_Link,Legal_Name,Town/Suburb,State,Status,Size,ABN,Website,Revenue,Expenses,Cause/s,Last_report_date,ref_religion,website,revenue,expenses,causes,lastreport,religious_ref
1426,https://www.acnc.gov.au/charity/charities/3f91a49c-38af-e811-a963-000d3ad244fd/profile,Ruach Ministries Limited,Seaforth,NSW,Registered,Small,40050612336,,,,,,,http://www.ruachchurch.org/,222228.0,250621.0,Adults - aged 25 to under 65; Adults - aged 65 and over; Children - aged 6 to under 15; Early childhood - aged under 6; Families; General community in Australia; Overseas communities or charities; Youth - 15 to under 25,10 Jun 2022,1.0
1427,https://www.acnc.gov.au/charity/charities/fd367cb5-38af-e811-a963-000d3ad244fd/profile,The Trustee For Woollhara Parish - Acpt (1473),Sydney,NSW,Registered,Small,34452971024,,,,,,,,0.0,0.0,General community in Australia,23 Jun 2022,1.0
1428,https://www.acnc.gov.au/charity/charities/c190a49c-38af-e811-a963-000d3ad244fd/profile,Mohair Australia Limited,Mundaring Dc,WA,Registered,Small,40008585135,,,,,,,http://www.mohair.com.au/,21650.0,24825.0,Adults - aged 25 to under 65; Adults - aged 65 and over; Children - aged 6 to under 15; Families; People in rural/regional/remote communities; Youth - 15 to under 25,8 Nov 2021,0.0
1429,https://www.acnc.gov.au/charity/charities/f029f2a8-38af-e811-a963-000d3ad244fd/profile,Illawarra Christian School Tongarra Campus Parents & Friends,Calderwood,NSW,Registered,Small,50838178670,,,,,,,,10320.0,22338.0,Children - aged 6 to under 15; Early childhood - aged under 6; Youth - 15 to under 25,14 Jul 2022,1.0
1430,https://www.acnc.gov.au/charity/charities/af34ac96-38af-e811-a963-000d3ad244fd/profile,AusSchol Incorporated,Sydney,NSW,Registered,Small,83420919581,,,,,,,http://www.scholarships.org.au/,37.0,0.0,Aboriginal and Torres Strait Islander people; Adults - aged 25 to under 65; Adults - aged 65 and over; Females; Males; Other charities; People from a culturally and linguistically diverse background; People in rural/regional/remote communities,30 Jun 2022,0.0
1431,https://www.acnc.gov.au/charity/charities/7d36fba2-38af-e811-a963-000d3ad244fd/profile,The Central Coast Revival Fellowship Inc,Gosford,NSW,Registered,Small,65554216675,,,,,,,,139588.0,63832.0,Adults - aged 25 to under 65; Adults - aged 65 and over; Children - aged 6 to under 15; Families; Females; General community in Australia; Males; Youth - 15 to under 25,24 Mar 2022,1.0
1432,https://www.acnc.gov.au/charity/charities/7d20f2a8-38af-e811-a963-000d3ad244fd/profile,Pathways Farm Inc,Mundaring,WA,Registered,Small,79186659965,,,,,,,,43388.0,40931.0,Adults - aged 25 to under 65; Adults - aged 65 and over; Females; Males; People with disabilities,31 Jan 2022,0.0
1433,https://www.acnc.gov.au/charity/charities/3d497baf-38af-e811-a963-000d3ad244fd/profile,Millicent Baptist Church Inc,Millicent,SA,Registered,Small,40378009552,,,,,,,http://www.millicentbaptist.org/,47981.0,32220.0,Families; Financially disadvantaged people; Other charities; People at risk of homelessness/ people experiencing homelessness; People in rural/regional/remote communities; People with chronic illness (including terminal illness),28 Jan 2022,1.0
1434,https://www.acnc.gov.au/charity/charities/b927f2a8-38af-e811-a963-000d3ad244fd/profile,The Trustee For Church Centenary Endowment Fund,Melbourne,VIC,Registered,Small,60945533723,,,,,,,http://www.melbourneanglican.org.au/,0.0,0.0,General community in Australia,27 Jun 2022,1.0
1435,https://www.acnc.gov.au/charity/charities/9a2df2a8-38af-e811-a963-000d3ad244fd/profile,Sydney Estonian Evangelical Lutheran St. John's Congregation,North Strathfield,NSW,Registered,Small,50843408543,,,,,,,,0.0,0.0,Families,20 Jun 2022,1.0
1436,https://www.acnc.gov.au/charity/charities/1d4c7baf-38af-e811-a963-000d3ad244fd/profile,Green Park Kindergarten Inc,Horsham,VIC,Registered,Small,28468358734,,,,,,,http://www.hdka.com.au/green-park-kindergarten,12264.0,26920.0,Early childhood - aged under 6,23 Jun 2021,0.0
1437,https://www.acnc.gov.au/charity/charities/473efba2-38af-e811-a963-000d3ad244fd/profile,Borden Primary School Parents And Citizens Association Incorporated,Borden,WA,Registered,Small,79171077045,,,,,,,,55699.0,42433.0,Children - aged 6 to under 15; Early childhood - aged under 6; People in rural/regional/remote communities,21 Jun 2022,0.0
1438,https://www.acnc.gov.au/charity/charities/6b3dfba2-38af-e811-a963-000d3ad244fd/profile,The Returned Services League Of Australia (Qld Branch) Tully Sub Bran,Tully,QLD,Registered,Small,55766239590,,,,,,,,72844.0,76781.0,Adults - aged 25 to under 65; Adults - aged 65 and over; Children - aged 6 to under 15; Families; People with disabilities; Veterans and/or their families; Youth - 15 to under 25,9 Mar 2022,0.0
1439,https://www.acnc.gov.au/charity/charities/7e447baf-38af-e811-a963-000d3ad244fd/profile,Parkes Christian Education Association Incorporated,Unavailable,Unavailable,Registered,Small,95447675415,,,,,,,,0.0,0.0,Children - aged 6 to under 15,27 Apr 2022,1.0
1440,https://www.acnc.gov.au/charity/charities/bd1ff2a8-38af-e811-a963-000d3ad244fd/profile,Clare Agricultural And Horticultural Society Inc,Clare,SA,Registered,Small,55776842938,,,,,,,http://www.clareshow.com.au/,194599.0,127362.0,Adults - aged 25 to under 65; Adults - aged 65 and over; Children - aged 6 to under 15; Environment; Families; Females; Financially disadvantaged people; General community in Australia; Males; People from a culturally and linguistically diverse background; People in rural/regional/remote communities; People with disabilities; Unemployed persons; Youth - 15 to under 25,24 Jul 2022,0.0
1441,https://www.acnc.gov.au/charity/charities/cb27f2a8-38af-e811-a963-000d3ad244fd/profile,The Trustee For The Ndy Charitable Trust,North Sydney,NSW,Registered,Small,45503221572,,,,,,,https://www.ndycharitabletrust.org/,60753.0,75944.0,Aboriginal and Torres Strait Islander people; Children - aged 6 to under 15; Financially disadvantaged people; Other charities; Youth - 15 to under 25,31 Mar 2022,0.0
1442,https://www.acnc.gov.au/charity/charities/4231ac96-38af-e811-a963-000d3ad244fd/profile,The Trustee For Community Placement Network Assistance Trust,Melbourne,VIC,Registered,Small,50544781258,,,,,,,,0.0,0.0,,22 Jan 2022,0.0
1443,https://www.acnc.gov.au/charity/charities/17477baf-38af-e811-a963-000d3ad244fd/profile,Morundah Bush Entertainment Committee Inc,Unavailable,Unavailable,Registered,Small,91689214541,,,,,,,,82349.0,0.0,Adults - aged 25 to under 65; People in rural/regional/remote communities,27 Jul 2022,0.0
1444,https://www.acnc.gov.au/charity/charities/ca467baf-38af-e811-a963-000d3ad244fd/profile,The Trustee For St Andrews Cathedral Music Foundation,Sydney,NSW,Registered,Small,91578552648,,,,,,,,13344.0,14.0,Adults - aged 25 to under 65; Adults - aged 65 and over; Children - aged 6 to under 15; Youth - 15 to under 25,28 Jun 2022,1.0
1445,https://www.acnc.gov.au/charity/charities/a02df2a8-38af-e811-a963-000d3ad244fd/profile,Craigie Heights Primary School Parents And Citizens Associated Incorporated,Unavailable,Unavailable,Registered,Small,45644575428,,,,,,,,58616.0,64943.0,Aboriginal and Torres Strait Islander people; Children - aged 6 to under 15; Early childhood - aged under 6; Families; Females; Males; People from a culturally and linguistically diverse background,21 May 2022,0.0
1446,https://www.acnc.gov.au/charity/charities/bb817dbb-38af-e811-a963-000d3ad244fd/profile,New Life Wesleyan Methodist Church,Ravenhall,VIC,Registered,Small,83727367065,,,,,,,,0.0,0.0,General community in Australia,3 Dec 2021,1.0
1447,https://www.acnc.gov.au/charity/charities/234a7baf-38af-e811-a963-000d3ad244fd/profile,The Corporation Of The Synod Of The Diocese Of Brisbane,Brisbane City,QLD,Registered,Small,28648236606,,,,,,,,0.0,0.0,General community in Australia,27 May 2022,1.0
1448,https://www.acnc.gov.au/charity/charities/132ef2a8-38af-e811-a963-000d3ad244fd/profile,Bassendean Christadelphian Ecclesia Inc.,Bassendean,WA,Registered,Small,50843640220,,,,,,,,14316.0,10991.0,Families,3 Jan 2022,1.0
1449,https://www.acnc.gov.au/charity/charities/4320f2a8-38af-e811-a963-000d3ad244fd/profile,Country Life Community Care Incorporated,Strathalbyn,SA,Registered,Small,79308107710,,,,,,,http://www.emmanuelchristianoutreach.org.au/,1.0,0.0,Families; Females; Males; Other charities,13 Dec 2021,1.0
1450,https://www.acnc.gov.au/charity/charities/dc4a7baf-38af-e811-a963-000d3ad244fd/profile,The Trustee For Pratt Group Scholarship Fund,Southbank,VIC,Registered,Small,40451595460,,,,,,,,85.0,9219.0,Children - aged 6 to under 15; Youth - 15 to under 25,18 Jan 2022,0.0
1451,https://www.acnc.gov.au/charity/charities/d8857dbb-38af-e811-a963-000d3ad244fd/profile,Catholic Diocese Of Port Pirie Inc Motor Mission Account,Port Pirie,SA,Registered,Small,83811778380,,,,,,,,0.0,0.0,General community in Australia,13 Feb 2022,1.0
1452,https://www.acnc.gov.au/charity/charities/d4397cb5-38af-e811-a963-000d3ad244fd/profile,Jung Shim Victoria Inc.,Beaumaris,VIC,Registered,Small,34643389350,,,,,,,http://www.jungshim.org.au/,14296.0,13318.0,Adults - aged 25 to under 65; Adults - aged 65 and over; General community in Australia; People with chronic illness (including terminal illness); People with disabilities,8 Dec 2021,0.0
1453,https://www.acnc.gov.au/charity/charities/113c7cb5-38af-e811-a963-000d3ad244fd/profile,Presbyterian Church Of Australia In The State Of New South Wales Parish Of Coolah/Dunedoo,Unavailable,Unavailable,Registered,Small,34624352433,,,,,,,,0.0,0.0,Families,26 May 2022,1.0
1454,https://www.acnc.gov.au/charity/charities/cd8ea49c-38af-e811-a963-000d3ad244fd/profile,Surf Life Saving Queensland North Queensland Branch Inc,Smithfield,QLD,Registered,Small,87567189545,,,,,,,http://www.nqlifesaving.com.au/,65464.0,133082.0,Adults - aged 25 to under 65; Adults - aged 65 and over; Children - aged 6 to under 15; Families; Females; Males; Youth - 15 to under 25,4 Jul 2022,0.0
1455,https://www.acnc.gov.au/charity/charities/09447baf-38af-e811-a963-000d3ad244fd/profile,Uniting Church In Australia Kangaroo Island,Unavailable,Unavailable,Registered,Small,95440436704,,,,,,,,0.0,0.0,Adults - aged 65 and over; Families; Overseas communities or charities; People in rural/regional/remote communities,7 May 2022,1.0
1456,https://www.acnc.gov.au/charity/charities/b64b7baf-38af-e811-a963-000d3ad244fd/profile,The Trustee For Latin Mass (Melbourne) Trust,Caulfield North,VIC,Registered,Small,28467130995,,,,,,,http://pol.org.au/caulfieldsouth,0.0,0.0,"Aboriginal and Torres Strait Islander people; Adults - aged 25 to under 65; Adults - aged 65 and over; Children - aged 6 to under 15; Early childhood - aged under 6; Families; Females; Financially disadvantaged people; Gay, lesbian, bisexual, transgender or intersex persons; Males; Migrants, refugees or asylum seekers; Other charities; Overseas communities or charities; People at risk of homelessness/ people experiencing homelessness; People from a culturally and linguistically diverse background; People in rural/regional/remote communities; People with chronic illness (including terminal illness); People with disabilities; Pre/post release offenders and/or their families; Unemployed persons; Veterans and/or their families; Victims of crime (including family violence); Victims of disaster; Youth - 15 to under 25",15 Jun 2022,1.0
1457,https://www.acnc.gov.au/charity/charities/41487baf-38af-e811-a963-000d3ad244fd/profile,The Religious Society Of Friends (Quakers)Qld Regl Meeting Inc,Kelvin Grove,QLD,Registered,Small,28644233127,,,,,,,https://www.quakersaustralia.info/QRM,108547.0,107799.0,Aboriginal and Torres Strait Islander people; Adults - aged 25 to under 65; Adults - aged 65 and over; Children - aged 6 to under 15; Early childhood - aged under 6; Environment; Families; Females; Financially disadvantaged people; General community in Australia; Males; People at risk of homelessness/ people experiencing homelessness; People from a culturally and linguistically diverse background; People in rural/regional/remote communities; People with chronic illness (including terminal illness); People with disabilities; Pre/post release offenders and/or their families; Unemployed persons; Veterans and/or their families; Victims of crime (including family violence); Victims of disaster; Youth - 15 to under 25,4 May 2022,1.0
1458,https://www.acnc.gov.au/charity/charities/214e7baf-38af-e811-a963-000d3ad244fd/profile,Samford Valley Steiner School Parents And Friends Association,Wights Mountain,QLD,Registered,Small,16142703774,,,,,,,https://www.facebook.com/SVSSPAFA,986.0,2985.0,Adults - aged 25 to under 65; Children - aged 6 to under 15,1 Aug 2022,0.0
1459,https://www.acnc.gov.au/charity/charities/d9397cb5-38af-e811-a963-000d3ad244fd/profile,Barham Public School P&C Association,Barham,NSW,Registered,Small,34613975852,,,,,,,,10270.0,15575.0,Adults - aged 25 to under 65; Children - aged 6 to under 15; Families,5 Apr 2022,0.0
1460,https://www.acnc.gov.au/charity/charities/014d7baf-38af-e811-a963-000d3ad244fd/profile,The Trustee For The Meridian Global Foundation,Leederville,WA,Registered,Small,16135214179,,,,,,,https://www.meridianglobal.org/,116066.0,39767.0,Other charities; Overseas communities or charities,9 Nov 2021,0.0
1461,https://www.acnc.gov.au/charity/charities/f0857dbb-38af-e811-a963-000d3ad244fd/profile,Wamuran Christadelphian Ecclesia,Wamuran Basin,QLD,Registered,Small,99303137051,,,,,,,,23686.0,25080.0,Adults - aged 25 to under 65; Adults - aged 65 and over; Children - aged 6 to under 15; Early childhood - aged under 6; Families; Overseas communities or charities; Victims of disaster; Youth - 15 to under 25,22 Jan 2022,1.0
1462,https://www.acnc.gov.au/charity/charities/f03a7cb5-38af-e811-a963-000d3ad244fd/profile,Wyrallah School P&C Assn,Unavailable,Unavailable,Registered,Small,34646252365,,,,,,,,6476.0,5482.0,Children - aged 6 to under 15; Early childhood - aged under 6,6 Aug 2022,0.0
1463,https://www.acnc.gov.au/charity/charities/a6457baf-38af-e811-a963-000d3ad244fd/profile,St Thomas Mores Catholic Church Belgrave,Belgrave,VIC,Registered,Small,91561171684,,,,,,,http://pol.org.au/belgrave,0.0,0.0,"Aboriginal and Torres Strait Islander people; Adults - aged 25 to under 65; Adults - aged 65 and over; Children - aged 6 to under 15; Early childhood - aged under 6; Families; Females; Financially disadvantaged people; Gay, lesbian, bisexual, transgender or intersex persons; Males; Migrants, refugees or asylum seekers; Other charities; Overseas communities or charities; People at risk of homelessness/ people experiencing homelessness; People from a culturally and linguistically diverse background; People in rural/regional/remote communities; People with chronic illness (including terminal illness); People with disabilities; Pre/post release offenders and/or their families; Unemployed persons; Veterans and/or their families; Victims of crime (including family violence); Victims of disaster; Youth - 15 to under 25",15 Jun 2022,1.0
1464,https://www.acnc.gov.au/charity/charities/ec847dbb-38af-e811-a963-000d3ad244fd/profile,The Trustee For The St Clements Mosman Welfare Fund,Mosman,NSW,Registered,Small,83743030872,,,,,,,http://www.stclementsmosman.org.au/,6000.0,5940.0,Adults - aged 25 to under 65; Adults - aged 65 and over; Females; Financially disadvantaged people; Males,8 Dec 2021,1.0
1465,https://www.acnc.gov.au/charity/charities/c63dfba2-38af-e811-a963-000d3ad244fd/profile,Glenbrook Primary School P&C Association,Glenbrook,NSW,Registered,Small,55768384594,,,,,,,,33610.0,20603.0,Children - aged 6 to under 15,26 Jun 2022,0.0
1466,https://www.acnc.gov.au/charity/charities/44487baf-38af-e811-a963-000d3ad244fd/profile,Light Of Hope Foundation Incorporated,Caulfield South,VIC,Registered,Small,40375715114,,,,,,,http://www.lhfoundation.org.au/,99304.0,92364.0,"Adults - aged 25 to under 65; Females; Financially disadvantaged people; Males; Migrants, refugees or asylum seekers; People at risk of homelessness/ people experiencing homelessness; People from a culturally and linguistically diverse background; People with chronic illness (including terminal illness); People with disabilities; Unemployed persons; Victims of crime (including family violence)",9 Apr 2021,0.0
1467,https://www.acnc.gov.au/charity/charities/7c3b7cb5-38af-e811-a963-000d3ad244fd/profile,Anglican Trusts Corporation Of The Diocese Of Gippsland,Mallacoota,VIC,Registered,Small,34746129944,,,,,,,http://www.gippslandanglicans.org.au/,0.0,0.0,General community in Australia; People in rural/regional/remote communities,25 Jul 2022,1.0
1468,https://www.acnc.gov.au/charity/charities/77377cb5-38af-e811-a963-000d3ad244fd/profile,Albion Baptist Church,Albion,QLD,Registered,Small,34453383783,,,,,,,,0.0,0.0,Families,22 Jan 2022,1.0
1469,https://www.acnc.gov.au/charity/charities/252ef2a8-38af-e811-a963-000d3ad244fd/profile,Returned Services League Of Australia - Pittsworth Sub Branch,Pittsworth,QLD,Registered,Small,45646754889,,,,,,,,10756.0,8191.0,Adults - aged 25 to under 65; Adults - aged 65 and over; Females; Males; Veterans and/or their families,30 Jun 2022,0.0
1470,https://www.acnc.gov.au/charity/charities/7a3b7cb5-38af-e811-a963-000d3ad244fd/profile,Living Valley Springs Benevolent Trust,Kin Kin,QLD,Registered,Small,22630184929,,,,,,,http://www.livingvalley.com.au/,140909.0,91020.0,Adults - aged 25 to under 65; Adults - aged 65 and over; Families; Females; Financially disadvantaged people; Males; People from a culturally and linguistically diverse background; People in rural/regional/remote communities; People with chronic illness (including terminal illness),28 Jun 2022,1.0
1471,https://www.acnc.gov.au/charity/charities/314d7baf-38af-e811-a963-000d3ad244fd/profile,Sydney Institute For Biblical Studies Inc.,Unavailable,Unavailable,Registered,Small,16135864561,,,,,,,,121.0,0.0,,1 Jul 2021,0.0
1472,https://www.acnc.gov.au/charity/charities/604d7baf-38af-e811-a963-000d3ad244fd/profile,Oatley West Parish - Acpt (1320),Sydney,NSW,Registered,Small,40512011470,,,,,,,,0.0,0.0,General community in Australia,23 Jun 2022,1.0
1473,https://www.acnc.gov.au/charity/charities/4c4e7baf-38af-e811-a963-000d3ad244fd/profile,Castle Hill Christian Education Association Incorporated,Unavailable,Unavailable,Registered,Small,40515485009,,,,,,,https://chcea.weebly.com/,44917.0,24815.0,Children - aged 6 to under 15; Youth - 15 to under 25,30 Jun 2022,1.0
1474,https://www.acnc.gov.au/charity/charities/33887dbb-38af-e811-a963-000d3ad244fd/profile,Okines Community House Incorporated,Dodges Ferry,TAS,Registered,Small,99433272191,,,,,,,http://okinescommunityhouse.com.au/,249832.0,279378.0,"Aboriginal and Torres Strait Islander people; Adults - aged 25 to under 65; Adults - aged 65 and over; Children - aged 6 to under 15; Early childhood - aged under 6; Families; Females; Financially disadvantaged people; Gay, lesbian, bisexual, transgender or intersex persons; General community in Australia; Males; Migrants, refugees or asylum seekers; People at risk of homelessness/ people experiencing homelessness; People from a culturally and linguistically diverse background; People in rural/regional/remote communities; People with chronic illness (including terminal illness); People with disabilities; Pre/post release offenders and/or their families; Unemployed persons; Veterans and/or their families; Victims of crime (including family violence); Victims of disaster; Youth - 15 to under 25",10 Feb 2022,0.0
1475,https://www.acnc.gov.au/charity/charities/5f477baf-38af-e811-a963-000d3ad244fd/profile,The Trustee For The Ruyton Foundation Building Fund,Kew,VIC,Registered,Small,91692302789,,,,,,,http://www.ruyton.vic.edu.au/,28918.0,15948.0,Children - aged 6 to under 15; Early childhood - aged under 6; Youth - 15 to under 25,11 May 2021,0.0
1476,https://www.acnc.gov.au/charity/charities/a824f2a8-38af-e811-a963-000d3ad244fd/profile,Friends Of Billanook College Incorporated,Mooroolbark,VIC,Registered,Small,45492898608,,,,,,,,5230.0,6957.0,Children - aged 6 to under 15; Early childhood - aged under 6; Youth - 15 to under 25,6 Apr 2022,0.0
1477,https://www.acnc.gov.au/charity/charities/0e3c7cb5-38af-e811-a963-000d3ad244fd/profile,Camberwell St Mark Opp Shop Mission Fund,Melbourne,VIC,Registered,Small,34603868305,,,,,,,http://www.melbourneanglican.org.au/,0.0,0.0,General community in Australia,27 Jun 2022,1.0
1478,https://www.acnc.gov.au/charity/charities/e81799a1-39af-e811-a960-000d3ad24282/profile,Nundle Community Welfare Foundation,Nundle,NSW,Registered,Small,53307377270,,,,,,,,43.0,112203.0,Aboriginal and Torres Strait Islander people; Adults - aged 25 to under 65; Adults - aged 65 and over; Children - aged 6 to under 15; Early childhood - aged under 6; Families; Females; Financially disadvantaged people; General community in Australia; Males; People in rural/regional/remote communities; People with disabilities; Unemployed persons; Youth - 15 to under 25,28 Jan 2022,0.0
1479,https://www.acnc.gov.au/charity/charities/0de6a9b4-39af-e811-a960-000d3ad24282/profile,Uca - Benalla Parish,Unavailable,Unavailable,Registered,Small,85865811394,,,,,,,,0.0,0.0,Adults - aged 25 to under 65; Adults - aged 65 and over; Families; Females; Financially disadvantaged people; General community in Australia; Males; People at risk of homelessness/ people experiencing homelessness; People in rural/regional/remote communities,29 May 2022,1.0
1480,https://www.acnc.gov.au/charity/charities/dd8ac3d4-39af-e811-a960-000d3ad24282/profile,The Trustee For Bendigo Community Theatre And Arts Public Fund,Unavailable,Unavailable,Registered,Small,68195761492,,,,,,,http://www.apolloproductions.org/,980.0,8699.0,"Aboriginal and Torres Strait Islander people; Adults - aged 25 to under 65; Adults - aged 65 and over; Families; Females; Gay, lesbian, bisexual, transgender or intersex persons; General community in Australia; Males; Migrants, refugees or asylum seekers; People from a culturally and linguistically diverse background; People in rural/regional/remote communities; People with chronic illness (including terminal illness); People with disabilities",3 Aug 2022,0.0
1481,https://www.acnc.gov.au/charity/charities/eb8cc3d4-39af-e811-a960-000d3ad24282/profile,Sacred Heart Cathedral Catholic Church - Bendigo,Bendigo,VIC,Registered,Small,19493368135,,,,,,,http://www.sacredheartcathedral.org.au/,0.0,0.0,Other,18 Jan 2022,1.0
1482,https://www.acnc.gov.au/charity/charities/b68bc3d4-39af-e811-a960-000d3ad24282/profile,Church Of Christ Penrith,Penrith,NSW,Registered,Small,63626797979,,,,,,,http://www.churchofchristpenrith/,0.0,0.0,Adults - aged 25 to under 65; Adults - aged 65 and over; Early childhood - aged under 6; Families; Females; Financially disadvantaged people; Males; People at risk of homelessness/ people experiencing homelessness; People from a culturally and linguistically diverse background; Unemployed persons; Youth - 15 to under 25,11 May 2022,1.0
1483,https://www.acnc.gov.au/charity/charities/b91099a1-39af-e811-a960-000d3ad24282/profile,The Trustee For The Fortitude Foundation,Swanbourne,WA,Registered,Small,25579279796,,,,,,,,6561.0,4017.0,Adults - aged 25 to under 65; Females; People at risk of homelessness/ people experiencing homelessness; Youth - 15 to under 25,12 Feb 2022,0.0
1484,https://www.acnc.gov.au/charity/charities/841599a1-39af-e811-a960-000d3ad24282/profile,Meredith Rsl Sub-Branch,She Oaks,VIC,Registered,Small,58673491650,,,,,,,,0.0,100.0,General community in Australia; Veterans and/or their families,19 Nov 2021,0.0
1485,https://www.acnc.gov.au/charity/charities/9a8ec3d4-39af-e811-a960-000d3ad24282/profile,The Anglican Parish Of St Mary Magdalene Moore Street,Adelaide,SA,Registered,Small,19722156938,,,,,,,,0.0,0.0,General community in Australia,27 Jun 2022,1.0
1486,https://www.acnc.gov.au/charity/charities/ec8cc3d4-39af-e811-a960-000d3ad24282/profile,The Trustee For The Ferry Family Charitable Trust,Unavailable,Unavailable,Registered,Small,19638418804,,,,,,,,63243.0,171035.0,Children - aged 6 to under 15,1 Dec 2021,0.0
1487,https://www.acnc.gov.au/charity/charities/7417aa95-39af-e811-a960-000d3ad24282/profile,Australians For Disability And Diversity Employment (Adde) Inc.,Lakes Entrance,VIC,Registered,Small,37573031165,,,,,,,http://www.adde.org.au/,3.0,0.0,,27 Apr 2021,0.0
1488,https://www.acnc.gov.au/charity/charities/5dc7868f-39af-e811-a960-000d3ad24282/profile,The Revival Fellowship,Mount Gambier,SA,Registered,Small,81311970074,,,,,,,https://www.therevivalfellowship.com/,0.0,0.0,Families,25 Jan 2022,1.0
1489,https://www.acnc.gov.au/charity/charities/9ec5868f-39af-e811-a960-000d3ad24282/profile,Western Heights Common Equity Rental Housing Co-Operative Ltd,Unavailable,Unavailable,Registered,Small,81308360034,,,,,,,,217641.0,216836.0,General community in Australia,30 Jan 2022,0.0
1490,https://www.acnc.gov.au/charity/charities/cb13aa95-39af-e811-a960-000d3ad24282/profile,The Sapphire Coast Music Society Incorporated,Merimbula,NSW,Registered,Small,89644224345,,,,,,,http://www.sapphirecoastmusicsociety.com/,8728.0,8661.0,People in rural/regional/remote communities,24 May 2022,0.0
1491,https://www.acnc.gov.au/charity/charities/7f10aa95-39af-e811-a960-000d3ad24282/profile,Uca - Lowan Uniting Parish,Nhill,VIC,Registered,Small,63328616406,,,,,,,,0.0,0.0,,2 Aug 2022,1.0
1492,https://www.acnc.gov.au/charity/charities/4b27bc82-39af-e811-a960-000d3ad24282/profile,Armenian Missionary Association Of Australia Inc,Unavailable,Unavailable,Registered,Small,25292307915,,,,,,,http://amaaust.org.au/,180643.0,194376.0,Children - aged 6 to under 15; Early childhood - aged under 6; Families; Females; Financially disadvantaged people; General community in Australia; Males; Other charities; Overseas communities or charities; People at risk of homelessness/ people experiencing homelessness; Unemployed persons,12 Jan 2022,0.0
