,Index_Link,Legal_Name,Town/Suburb,State,Status,Size,ABN,Website,Revenue,Expenses,Cause/s,Last_report_date,ref_religion,website,revenue,expenses,causes,lastreport,religious_ref
1340,https://www.acnc.gov.au/charity/charities/1c9b7790-39af-e811-a962-000d3ad24a0d/profile,Old Xaverians Association,Kew,VIC,Registered,Small,81554106495,,,,,,,http://www.xavnet.com.au/,24507.0,17793.0,Adults - aged 25 to under 65; Children - aged 6 to under 15; Females; Males; Youth - 15 to under 25,9 Jun 2022,0.0
1341,https://www.acnc.gov.au/charity/charities/b4ffd643-39af-e811-a962-000d3ad24a0d/profile,Disciples Of Jesus Covenant Community Inc,Burwood,VIC,Registered,Small,89064979936,,,,,,,https://dojcommunity.com/,85575.0,48807.0,"Aboriginal and Torres Strait Islander people; Adults - aged 25 to under 65; Adults - aged 65 and over; Children - aged 6 to under 15; Early childhood - aged under 6; Families; Females; Financially disadvantaged people; Gay, lesbian, bisexual, transgender or intersex persons; Males; Migrants, refugees or asylum seekers; People at risk of homelessness/ people experiencing homelessness; People from a culturally and linguistically diverse background; People in rural/regional/remote communities; People with chronic illness (including terminal illness); People with disabilities; Pre/post release offenders and/or their families; Unemployed persons; Veterans and/or their families; Victims of crime (including family violence); Victims of disaster; Youth - 15 to under 25",31 May 2021,1.0
1342,https://www.acnc.gov.au/charity/charities/a5fad33d-39af-e811-a962-000d3ad24a0d/profile,Trinity Lutheran Church,Southport,QLD,Registered,Small,96835868422,,,,,,,http://www.trinitysouthport.com/,199224.0,226098.0,Aboriginal and Torres Strait Islander people; Adults - aged 25 to under 65; Adults - aged 65 and over; Families; Females; Financially disadvantaged people; General community in Australia; Males; People from a culturally and linguistically diverse background; People in rural/regional/remote communities,11 Jul 2022,1.0
1343,https://www.acnc.gov.au/charity/charities/2dfed643-39af-e811-a962-000d3ad24a0d/profile,Canberra Islamic Centre Incorporated,Monash,ACT,Registered,Small,47299363767,,,,,,,http://www.cic-anil.org.au/,217970.0,214682.0,"Aboriginal and Torres Strait Islander people; Adults - aged 25 to under 65; Adults - aged 65 and over; Families; Females; Financially disadvantaged people; Gay, lesbian, bisexual, transgender or intersex persons; Males; Migrants, refugees or asylum seekers; People at risk of homelessness/ people experiencing homelessness; People from a culturally and linguistically diverse background; People with disabilities; Victims of crime (including family violence); Youth - 15 to under 25",24 Nov 2021,1.0
1344,https://www.acnc.gov.au/charity/charities/9c07d743-39af-e811-a962-000d3ad24a0d/profile,Salisbury Christadelphian Ecclesia Incorporated,Unavailable,SA,Registered,Small,42152447656,,,,,,,,43912.0,37414.0,Adults - aged 25 to under 65; Adults - aged 65 and over; Children - aged 6 to under 15; Families; General community in Australia,7 Nov 2020,1.0
1345,https://www.acnc.gov.au/charity/charities/5607d743-39af-e811-a962-000d3ad24a0d/profile,Lighthouse Baptist Church,Phillip Bay,NSW,Registered,Small,42280768396,,,,,,,http://lhbc.org.au/,133563.0,115149.0,General community in Australia,3 Apr 2022,1.0
1346,https://www.acnc.gov.au/charity/charities/2900d743-39af-e811-a962-000d3ad24a0d/profile,Penola Chaplaincy Support Group Inc,Unavailable,Unavailable,Registered,Small,57636650188,,,,,,,,0.0,41.0,,9 Mar 2022,0.0
1347,https://www.acnc.gov.au/charity/charities/d8bcce49-39af-e811-a962-000d3ad24a0d/profile,Church Of Christ Numurkah,Numurkah,VIC,Registered,Small,67448501414,,,,,,,,59454.0,48590.0,Adults - aged 25 to under 65; Overseas communities or charities; People in rural/regional/remote communities,25 Feb 2022,1.0
1348,https://www.acnc.gov.au/charity/charities/fcb9ce49-39af-e811-a962-000d3ad24a0d/profile,Tumbarumba Subbranch Of The Returned and Services League Of Australia New South Wales Branch,Tumbarumba,NSW,Registered,Small,42158864865,,,,,,,,800.0,3210.0,"Aboriginal and Torres Strait Islander people; Adults - aged 25 to under 65; Adults - aged 65 and over; Children - aged 6 to under 15; Early childhood - aged under 6; Families; Females; Financially disadvantaged people; Gay, lesbian, bisexual, transgender or intersex persons; Males; People at risk of homelessness/ people experiencing homelessness; People from a culturally and linguistically diverse background; People in rural/regional/remote communities; People with chronic illness (including terminal illness); People with disabilities; Veterans and/or their families; Youth - 15 to under 25",17 Aug 2022,0.0
1349,https://www.acnc.gov.au/charity/charities/defdd33d-39af-e811-a962-000d3ad24a0d/profile,Healthy Work Places Limited as trustee of Tour de office Foundation,Milton,QLD,Registered,Small,96865172834,,,,,,,http://www.tourdeoffice.com/,7427.0,7427.0,Adults - aged 25 to under 65; Adults - aged 65 and over; Children - aged 6 to under 15; Females; Financially disadvantaged people; General community in Australia; Males; Overseas communities or charities; People with chronic illness (including terminal illness); Youth - 15 to under 25,29 Jun 2022,0.0
1350,https://www.acnc.gov.au/charity/charities/55c0ce49-39af-e811-a962-000d3ad24a0d/profile,Lightning Ridge Community Church (Anglican Diocese Of Armidale),Armidale,NSW,Registered,Small,18370240397,,,,,,,http://www.armidaleanglicandiocese.com/our-churches/,0.0,0.0,People in rural/regional/remote communities,26 Jan 2022,1.0
1351,https://www.acnc.gov.au/charity/charities/77239851-39af-e811-a962-000d3ad24a0d/profile,ACPT - Toongabbie Trust,Sydney,NSW,Registered,Small,24648315789,,,,,,,,0.0,0.0,General community in Australia,23 Jun 2022,1.0
1352,https://www.acnc.gov.au/charity/charities/6e289851-39af-e811-a962-000d3ad24a0d/profile,Nharangga Aboriginal Progress Association,North Moonta,SA,Registered,Small,12224669460,,,,,,,http://www.napinc.com.au/,209458.0,199300.0,Aboriginal and Torres Strait Islander people; Adults - aged 25 to under 65; Adults - aged 65 and over; Children - aged 6 to under 15; Females; Males; Youth - 15 to under 25,6 Dec 2021,0.0
1353,https://www.acnc.gov.au/charity/charities/b9fdd643-39af-e811-a962-000d3ad24a0d/profile,Cristina's House Of Hope Incorporated,Corrimal,NSW,Registered,Small,47477309320,,,,,,,http://www.cristinashouseofhope.com.au/,3416.0,559.0,Adults - aged 25 to under 65; Children - aged 6 to under 15; Females; Victims of crime (including family violence); Youth - 15 to under 25,10 Dec 2021,0.0
1354,https://www.acnc.gov.au/charity/charities/91249851-39af-e811-a962-000d3ad24a0d/profile,Merri Common Equity Rentalhousing Co-Operative Ltd,Northcote,VIC,Registered,Small,12152039573,,,,,,,,,,General community in Australia,30 Jan 2022,0.0
1355,https://www.acnc.gov.au/charity/charities/6a06d743-39af-e811-a962-000d3ad24a0d/profile,Wyong High School Parents And Citizens Association,Wyong,NSW,Registered,Small,42277319578,,,,,,,,20803.0,14620.0,Children - aged 6 to under 15; Families; General community in Australia; Youth - 15 to under 25,27 Aug 2020,0.0
1356,https://www.acnc.gov.au/charity/charities/4002d743-39af-e811-a962-000d3ad24a0d/profile,One Of A Kind Community Support,West Tamworth,NSW,Registered,Small,57531033430,,,,,,,http://www.oneofakind.org.au/,182411.0,461486.0,Aboriginal and Torres Strait Islander people; Adults - aged 25 to under 65; Adults - aged 65 and over; Children - aged 6 to under 15; Early childhood - aged under 6; Environment; Families; Females; Financially disadvantaged people; Males; Other charities; People at risk of homelessness/ people experiencing homelessness; People in rural/regional/remote communities; People with disabilities; Unemployed persons; Victims of disaster; Youth - 15 to under 25,31 Mar 2022,0.0
1357,https://www.acnc.gov.au/charity/charities/3ac2ce49-39af-e811-a962-000d3ad24a0d/profile,Millicent Mens Shed Inc.,Millicent,SA,Registered,Small,62571031981,,,,,,,,15323.0,20348.0,"Adults - aged 25 to under 65; Adults - aged 65 and over; Children - aged 6 to under 15; Early childhood - aged under 6; Families; Females; Males; Migrants, refugees or asylum seekers; People from a culturally and linguistically diverse background; People in rural/regional/remote communities; People with disabilities; Unemployed persons; Veterans and/or their families; Youth - 15 to under 25",24 Nov 2021,0.0
1358,https://www.acnc.gov.au/charity/charities/62249851-39af-e811-a962-000d3ad24a0d/profile,Chapter Seven Limited,Mitcham,VIC,Registered,Small,12151724980,,,,,,,http://www.theretreat.org.au/,235357.0,171233.0,Families; People with chronic illness (including terminal illness); People with disabilities; Victims of crime (including family violence); Victims of disaster,22 Nov 2021,0.0
1359,https://www.acnc.gov.au/charity/charities/0fc3ce49-39af-e811-a962-000d3ad24a0d/profile,The Trustee For Heinrich Theodore Noske Estate,Adelaide,SA,Registered,Small,62575987810,,,,,,,,0.0,0.0,Adults - aged 25 to under 65; Children - aged 6 to under 15; Females; Males; Other charities; People with disabilities; Pre/post release offenders and/or their families; Unemployed persons; Youth - 15 to under 25,30 Jan 2022,0.0
1360,https://www.acnc.gov.au/charity/charities/661c9851-39af-e811-a962-000d3ad24a0d/profile,Maryborough Sub-Branch Rsl,Maryborough,VIC,Registered,Small,30745422429,,,,,,,,590.0,360.0,Adults - aged 25 to under 65; Adults - aged 65 and over; Families; Veterans and/or their families,4 Aug 2022,0.0
1361,https://www.acnc.gov.au/charity/charities/13239851-39af-e811-a962-000d3ad24a0d/profile,The Trustee For The H And O Slade Memorial Trust,Browns Plains,QLD,Registered,Small,24721989723,,,,,,,,0.0,0.0,Families; General community in Australia,18 Dec 2019,1.0
1362,https://www.acnc.gov.au/charity/charities/e5bfce49-39af-e811-a962-000d3ad24a0d/profile,Bellingen Community Arts Council Incorporated,Bellingen,NSW,Registered,Small,18349252379,,,,,,,http://bcac.org.au/,110092.0,102742.0,Adults - aged 25 to under 65; Adults - aged 65 and over; Females; Males; People in rural/regional/remote communities; Youth - 15 to under 25,27 Jun 2022,0.0
1363,https://www.acnc.gov.au/charity/charities/f5279851-39af-e811-a962-000d3ad24a0d/profile,Hia Charitable Foundation,Campbell,ACT,Registered,Small,37685982657,,,,,,,http://hia.com.au/foundation/,92775.0,138267.0,Adults - aged 25 to under 65; Other; Youth - 15 to under 25,11 May 2022,0.0
1364,https://www.acnc.gov.au/charity/charities/42f68f57-39af-e811-a962-000d3ad24a0d/profile,Mt Helena Primary School P & C Assoc Inc,Unavailable,Unavailable,Registered,Small,93239092527,,,,,,,,15255.0,11063.0,Children - aged 6 to under 15,3 Apr 2022,0.0
1365,https://www.acnc.gov.au/charity/charities/f9bdce49-39af-e811-a962-000d3ad24a0d/profile,Meals On Wheels Broken Hill Inc,Broken Hill,NSW,Registered,Small,67361523522,,,,,,,,142417.0,92945.0,Aboriginal and Torres Strait Islander people; Adults - aged 25 to under 65; Adults - aged 65 and over; Families; Females; Financially disadvantaged people; Males; People in rural/regional/remote communities; People with chronic illness (including terminal illness); People with disabilities; Veterans and/or their families,5 Jan 2022,0.0
1366,https://www.acnc.gov.au/charity/charities/7ef78f57-39af-e811-a962-000d3ad24a0d/profile,Quest Aid Inc.,West Woombye,QLD,Registered,Small,85181820874,,,,,,,,0.0,0.0,,27 Jan 2021,0.0
1367,https://www.acnc.gov.au/charity/charities/d0279851-39af-e811-a962-000d3ad24a0d/profile,Barom Kagyu Chodrak Drupju Chuling Incorporated,Sefton,NSW,Registered,Small,72168544397,,,,,,,https://baromkagyu.org/,79782.0,242082.0,"Adults - aged 25 to under 65; Adults - aged 65 and over; Children - aged 6 to under 15; Families; Females; General community in Australia; Males; Migrants, refugees or asylum seekers; People from a culturally and linguistically diverse background; Youth - 15 to under 25",23 Dec 2021,1.0
1368,https://www.acnc.gov.au/charity/charities/0c229851-39af-e811-a962-000d3ad24a0d/profile,Western Australian Tandem Cycling Advisory Council Incorporated,Victoria Park,WA,Registered,Small,76705603824,,,,,,,http://watcac.org/,8063.0,15047.0,Adults - aged 25 to under 65; Adults - aged 65 and over; Females; Males; People with disabilities; Youth - 15 to under 25,6 May 2022,0.0
1369,https://www.acnc.gov.au/charity/charities/e1259851-39af-e811-a962-000d3ad24a0d/profile,Melville Baptist Church Incorporated,Melville,WA,Registered,Small,12134647151,,,,,,,https://www.melvillebaptistchurch.org.au/,100719.0,39965.0,Adults - aged 25 to under 65; Adults - aged 65 and over; Children - aged 6 to under 15; Families; Females; General community in Australia; Overseas communities or charities; Victims of crime (including family violence); Youth - 15 to under 25,9 Feb 2022,1.0
1370,https://www.acnc.gov.au/charity/charities/e3c2ce49-39af-e811-a962-000d3ad24a0d/profile,St Andrews Presbyterian Church Reservoir,Reservoir,VIC,Registered,Small,62652061546,,,,,,,http://reservoirpc.org.au/,0.0,0.0,"Adults - aged 25 to under 65; Adults - aged 65 and over; Children - aged 6 to under 15; Early childhood - aged under 6; Families; Females; Financially disadvantaged people; Males; Migrants, refugees or asylum seekers; People at risk of homelessness/ people experiencing homelessness; People from a culturally and linguistically diverse background; People with chronic illness (including terminal illness); People with disabilities; Unemployed persons; Victims of crime (including family violence); Youth - 15 to under 25",24 Jun 2022,1.0
1371,https://www.acnc.gov.au/charity/charities/63229851-39af-e811-a962-000d3ad24a0d/profile,The City Of Liverpool And District Historical Society Inc,Liverpool,NSW,Registered,Small,24642742379,,,,,,,http://www.liverpoolnswhistory.org.au/,15625.0,4465.0,Adults - aged 25 to under 65; Adults - aged 65 and over; Families; Females; Males; Youth - 15 to under 25,6 Jan 2022,0.0
1372,https://www.acnc.gov.au/charity/charities/b2c2ce49-39af-e811-a962-000d3ad24a0d/profile,Harvest Worship Centre Christian Church Inc,Loganlea,QLD,Registered,Small,62573070843,,,,,,,,234794.0,165999.0,Adults - aged 25 to under 65; Children - aged 6 to under 15; Early childhood - aged under 6; Families; Females; Males; Youth - 15 to under 25,5 Apr 2022,1.0
1373,https://www.acnc.gov.au/charity/charities/1e03d43d-39af-e811-a962-000d3ad24a0d/profile,The Anglican Parish Of Hamilton,Newcastle,NSW,Registered,Small,12059639293,,,,,,,http://stpetershamilton.org.au/,0.0,0.0,Families; General community in Australia,12 Aug 2022,1.0
1374,https://www.acnc.gov.au/charity/charities/2606d743-39af-e811-a962-000d3ad24a0d/profile,Uca - Alstonville Uniting Church,Alstonville,NSW,Registered,Small,36502616753,,,,,,,,246847.0,216309.0,Adults - aged 25 to under 65; Adults - aged 65 and over; Children - aged 6 to under 15; Early childhood - aged under 6; Families; Females; Males; Youth - 15 to under 25,17 Jan 2022,1.0
1375,https://www.acnc.gov.au/charity/charities/fef6d33d-39af-e811-a962-000d3ad24a0d/profile,Computers 4 Learning,Unavailable,Unavailable,Registered,Small,24451978124,,,,,,,http://www.computers4learning.org.au/,15435.0,13260.0,Aboriginal and Torres Strait Islander people; Adults - aged 25 to under 65; Adults - aged 65 and over; Families; Females; Financially disadvantaged people; Males; People from a culturally and linguistically diverse background; People in rural/regional/remote communities; People with disabilities; Unemployed persons; Youth - 15 to under 25,16 Dec 2021,0.0
1376,https://www.acnc.gov.au/charity/charities/69c8c537-39af-e811-a962-000d3ad24a0d/profile,Mundubbera Kindergarten Assoc,Mundubbera,QLD,Registered,Small,71919068507,,,,,,,https://www.facebook.com/mundubberakindy,206011.0,220251.0,Aboriginal and Torres Strait Islander people; Early childhood - aged under 6; Families; People in rural/regional/remote communities; People with disabilities,30 May 2022,0.0
1377,https://www.acnc.gov.au/charity/charities/e006d743-39af-e811-a962-000d3ad24a0d/profile,University Of The Third Age Southern Peninsula Inc,Unavailable,Unavailable,Registered,Small,42123530408,,,,,,,http://www.u3asouthpen.org.au/,15330.0,17273.0,Adults - aged 65 and over,29 Jun 2022,0.0
1378,https://www.acnc.gov.au/charity/charities/dfffd33d-39af-e811-a962-000d3ad24a0d/profile,Churchill & District News,Churchill,VIC,Registered,Small,12048446864,,,,,,,http://cdnews.com.au/,32014.0,32119.0,Adults - aged 25 to under 65; Adults - aged 65 and over; Children - aged 6 to under 15; Early childhood - aged under 6; General community in Australia; Youth - 15 to under 25,22 Jun 2022,1.0
1379,https://www.acnc.gov.au/charity/charities/b1fcd33d-39af-e811-a962-000d3ad24a0d/profile,Nannup District High School Parents & Citizens Association,Nannup,WA,Registered,Small,96863785379,,,,,,,,22598.0,23772.0,Children - aged 6 to under 15; Females; General community in Australia; Males; People in rural/regional/remote communities,13 May 2022,0.0
1380,https://www.acnc.gov.au/charity/charities/7100d43d-39af-e811-a962-000d3ad24a0d/profile,Scone Public School P&C Association Canteen,Scone,NSW,Registered,Small,12060568633,,,,,,,,132175.0,121351.0,Children - aged 6 to under 15; Early childhood - aged under 6; Families; Females; Males; People in rural/regional/remote communities,17 May 2022,0.0
1381,https://www.acnc.gov.au/charity/charities/8dc2c537-39af-e811-a962-000d3ad24a0d/profile,Vietnam Veterans Peacekeepers & Peacemakers Association Of Australia Central Coast Sub-Branch Incorporated,Ettalong Beach,NSW,Registered,Small,30192075729,,,,,,,,100320.0,127855.0,Females; Financially disadvantaged people; Males; Veterans and/or their families,30 Jun 2022,0.0
1382,https://www.acnc.gov.au/charity/charities/9fb9ce49-39af-e811-a962-000d3ad24a0d/profile,Plymouth Brethren Christian Church,Sydney Olympic Park,NSW,Registered,Small,42158542075,,,,,,,https://www.plymouthbrethrenchristianchurch.org/,245349.0,146387.0,Adults - aged 25 to under 65; Adults - aged 65 and over; Children - aged 6 to under 15; Early childhood - aged under 6; Families; Females; Financially disadvantaged people; Males; People at risk of homelessness/ people experiencing homelessness; People with chronic illness (including terminal illness); People with disabilities; Unemployed persons; Victims of disaster; Youth - 15 to under 25,19 Feb 2022,1.0
1383,https://www.acnc.gov.au/charity/charities/8600d43d-39af-e811-a962-000d3ad24a0d/profile,Greenmount Returned Soldiers Memorial Hall Association Inc,Greenmount,QLD,Registered,Small,12287590250,,,,,,,,15437.0,13493.0,Families; Females; Males; People in rural/regional/remote communities,17 Jul 2022,0.0
1384,https://www.acnc.gov.au/charity/charities/4cfdd643-39af-e811-a962-000d3ad24a0d/profile,Positive Aid Inc,Unavailable,Unavailable,Registered,Small,47476624173,,,,,,,http://www.positiveaid.org.au/,58411.0,58379.0,People in rural/regional/remote communities,20 Oct 2021,0.0
1385,https://www.acnc.gov.au/charity/charities/e206d743-39af-e811-a962-000d3ad24a0d/profile,Forsyth Foundation Incorporated,Adelaide,SA,Registered,Small,36604828795,,,,,,,,0.0,0.0,All ages,28 Jan 2016,0.0
1386,https://www.acnc.gov.au/charity/charities/e8bace49-39af-e811-a962-000d3ad24a0d/profile,Church Of Christ Blackwood,Blackwood,SA,Registered,Small,42099443962,,,,,,,https://blackwoodcc.org.au/,225203.0,209382.0,Adults - aged 25 to under 65; Adults - aged 65 and over; Children - aged 6 to under 15; Early childhood - aged under 6; Families; Males; Youth - 15 to under 25,26 Jun 2022,1.0
1387,https://www.acnc.gov.au/charity/charities/fc00d43d-39af-e811-a962-000d3ad24a0d/profile,St Andrews Anglican Church Sans Souci,Sans Souci,NSW,Registered,Small,12053879016,,,,,,,http://sanssoucianglican.com/,0.0,0.0,General community in Australia,18 Jun 2022,1.0
1388,https://www.acnc.gov.au/charity/charities/9d07d743-39af-e811-a962-000d3ad24a0d/profile,Mandurah State Emergency Service,Mandurah,WA,Registered,Small,36607561590,,,,,,,https://mandurahses.org.au/,37539.0,33878.0,Families; General community in Australia; People at risk of homelessness/ people experiencing homelessness; People in rural/regional/remote communities; Victims of disaster,23 Jan 2022,0.0
1389,https://www.acnc.gov.au/charity/charities/5d08d743-39af-e811-a962-000d3ad24a0d/profile,Georges Hall Public School P&C Assoc,Georges Hall,NSW,Registered,Small,52347443629,,,,,,,,220861.0,289135.0,Children - aged 6 to under 15; Early childhood - aged under 6; Females; Financially disadvantaged people; Males,7 Apr 2022,0.0
1390,https://www.acnc.gov.au/charity/charities/babbce49-39af-e811-a962-000d3ad24a0d/profile,Sister Kate's Children 1934 To 1953 Foundation,Queens Park,WA,Registered,Small,20514880297,,,,,,,,190545.0,128782.0,Aboriginal and Torres Strait Islander people; Adults - aged 65 and over,31 Jan 2022,0.0
1391,https://www.acnc.gov.au/charity/charities/dfc7c537-39af-e811-a962-000d3ad24a0d/profile,Gerringong RSL sub-Branch (RSL NSW),Gerringong,NSW,Registered,Small,71890590943,,,,,,,,27404.0,22670.0,Families; Females; General community in Australia; Males; Veterans and/or their families,29 Jun 2022,0.0
1392,https://www.acnc.gov.au/charity/charities/0ac1ce49-39af-e811-a962-000d3ad24a0d/profile,The Trustee For Estate Henry Spencer Sewell,Adelaide,SA,Registered,Small,18405342331,,,,,,,,142940.0,114052.0,Other charities,30 Jan 2022,0.0
1393,https://www.acnc.gov.au/charity/charities/eb03d743-39af-e811-a962-000d3ad24a0d/profile,CAA-Wyndham Community Arts Alliance Inc t/a Wyndham Art Works,Werribee,VIC,Registered,Small,57535983043,,,,,,,http://www.wyndhamcommunityartsalliance.wordpress.com/,15407.0,14378.0,Adults - aged 25 to under 65; People from a culturally and linguistically diverse background,28 Nov 2021,0.0
1394,https://www.acnc.gov.au/charity/charities/ec03d743-39af-e811-a962-000d3ad24a0d/profile,The Trustee For The Slavic Mission Charitable Trust,Unavailable,Unavailable,Registered,Small,57657330379,,,,,,,,2355.0,0.0,Adults - aged 25 to under 65; Adults - aged 65 and over; Families; Financially disadvantaged people; General community in Australia; Overseas communities or charities; People from a culturally and linguistically diverse background,19 Dec 2021,1.0
1395,https://www.acnc.gov.au/charity/charities/bdfc872a-39af-e811-a962-000d3ad24a0d/profile,The Right Start Foundation Limited,Narellan,NSW,Registered,Small,67153244323,,,,,,,http://www.therightstartfoundation.org/,11222.0,27339.0,Early childhood - aged under 6,10 Feb 2022,0.0
1396,https://www.acnc.gov.au/charity/charities/54c0ce49-39af-e811-a962-000d3ad24a0d/profile,Gymea Peoples Church Inc.,Gymea Bay,NSW,Registered,Small,18402780975,,,,,,,http://www.gpc.org.au/,178772.0,138853.0,Families,31 Mar 2022,1.0
1397,https://www.acnc.gov.au/charity/charities/f901d743-39af-e811-a962-000d3ad24a0d/profile,KAPINARA PRIMARY SCHOOL PARENTS AND CITIZENS' ASSOCIATION INC.,City Beach,WA,Registered,Small,89095098172,,,,,,,,195759.0,217129.0,Children - aged 6 to under 15; Early childhood - aged under 6,21 Jan 2022,0.0
1398,https://www.acnc.gov.au/charity/charities/758dd464-39af-e811-a962-000d3ad24a0d/profile,Polish Christian Fellowship Incorporated,Albert Park,SA,Registered,Small,18822680753,,,,,,,,88680.0,64799.0,General community in Australia,4 Feb 2022,1.0
1399,https://www.acnc.gov.au/charity/charities/598cd464-39af-e811-a962-000d3ad24a0d/profile,Inspired Carers Incorporated,Mooroopna,VIC,Registered,Small,52903453517,,,,,,,http://www.inspiredcarers.org.au/,137160.0,101116.0,Families; People with disabilities,18 May 2021,0.0
1400,https://www.acnc.gov.au/charity/charities/e38ed464-39af-e811-a962-000d3ad24a0d/profile,The Trustee For Bendat Family Foundation,Crawley,WA,Registered,Small,89417787522,,,,,,,,181324.0,1221374.0,,20 Dec 2021,0.0
1401,https://www.acnc.gov.au/charity/charities/39f92072-39af-e811-a962-000d3ad24a0d/profile,Blue Mountains Gospel Trust,Unavailable,Unavailable,Registered,Small,12568312344,,,,,,,,0.0,0.0,General community in Australia,30 Jan 2022,1.0
1402,https://www.acnc.gov.au/charity/charities/de012172-39af-e811-a962-000d3ad24a0d/profile,St. Luke's (Anglican Church In Australia) Association Pty Ltd,Hobart,TAS,Registered,Small,77009478353,,,,,,,,0.0,0.0,,30 Dec 2021,1.0
1403,https://www.acnc.gov.au/charity/charities/e0391978-39af-e811-a962-000d3ad24a0d/profile,Unavailable,Unavailable,Unavailable,Registered,Small,Unavailable,,,,,,,,180904.0,267822.0,Other charities,17 Mar 2022,0.0
1404,https://www.acnc.gov.au/charity/charities/a5072172-39af-e811-a962-000d3ad24a0d/profile,Harry Meyn Foundation Ltd,Unavailable,Unavailable,Registered,Small,37147668693,,,,,,,http://www.harryshouse.com.au/,155386.0,169470.0,Children - aged 6 to under 15; Early childhood - aged under 6; Families; People with chronic illness (including terminal illness); Youth - 15 to under 25,21 Jan 2022,0.0
1405,https://www.acnc.gov.au/charity/charities/1688d464-39af-e811-a962-000d3ad24a0d/profile,Only Believe Mission,Cashmere,QLD,Registered,Small,52948975636,,,,,,,,0.0,0.0,General community in Australia,14 Jan 2022,1.0
1406,https://www.acnc.gov.au/charity/charities/a6252fcf-39af-e811-a962-000d3ad24a0d/profile,Dwellingup Community Village Inc,Dwellingup,WA,Registered,Small,63537096468,,,,,,,http://www.dcvillage.com.au/home,85452.0,72081.0,Adults - aged 65 and over,29 Nov 2021,0.0
1407,https://www.acnc.gov.au/charity/charities/97cb4fe1-39af-e811-a962-000d3ad24a0d/profile,Star Learning Foundation,Werribee,VIC,Registered,Small,62160940116,,,,,,,https://starlearning.org.au/,13172.0,0.0,,8 Mar 2022,0.0
