,Index_Link,Legal_Name,Town/Suburb,State,Status,Size,ABN,Website,Revenue,Expenses,Cause/s,Last_report_date,ref_religion,website,revenue,expenses,causes,lastreport,religious_ref
1408,https://www.acnc.gov.au/charity/charities/a36527d5-39af-e811-a962-000d3ad24a0d/profile,Geelong Animal Rescue Gar Limited,Highton,VIC,Registered,Small,68157850452,,,,,,,http://www.geelonganimalrescue.org.au/,138176.0,92602.0,Animals; Families; Females; Financially disadvantaged people; Males; Other charities; People at risk of homelessness/ people experiencing homelessness; People with disabilities; Unemployed persons; Victims of crime (including family violence),18 Jan 2022,0.0
1409,https://www.acnc.gov.au/charity/charities/b52e43db-39af-e811-a962-000d3ad24a0d/profile,Dean And Chapter Christ Church Cathedral Newcastle,Newcastle,NSW,Registered,Small,97395738640,,,,,,,http://www.newcastlecathedral.org.au/,0.0,0.0,General community in Australia,14 Jun 2022,1.0
1410,https://www.acnc.gov.au/charity/charities/c36627d5-39af-e811-a962-000d3ad24a0d/profile,Southern Agricultural Society Incorporated,Victor Harbor,SA,Registered,Small,93792261556,,,,,,,http://portelliotshow.com.au/,248312.0,112407.0,Families; General community in Australia,22 Mar 2022,0.0
1411,https://www.acnc.gov.au/charity/charities/259db2a3-39af-e811-a962-000d3ad24a0d/profile,Christian Cultural Trust Fund,Perth,WA,Registered,Small,58663041208,,,,,,,,53717.0,44204.0,Families; General community in Australia; People from a culturally and linguistically diverse background,5 Jul 2022,1.0
1412,https://www.acnc.gov.au/charity/charities/35cb4fe1-39af-e811-a962-000d3ad24a0d/profile,Bdcu Goulburn Hospital Fundarising Inc,Goulburn,NSW,Registered,Small,13379448180,,,,,,,https://www.bdcualliancebank.com.au/community/bdcu-goulburn-hospital-fundraising,15954.0,8691.0,General community in Australia,2 May 2022,0.0
1413,https://www.acnc.gov.au/charity/charities/f6cf4fe1-39af-e811-a962-000d3ad24a0d/profile,Allora Medical Support Group Incorporated,Allora,QLD,Registered,Small,47362450812,,,,,,,,36591.0,17383.0,People in rural/regional/remote communities,6 Oct 2020,0.0
1414,https://www.acnc.gov.au/charity/charities/4fd34fe1-39af-e811-a962-000d3ad24a0d/profile,The Trustee for the Trinity Grammar School Charitable Fund,Kew,VIC,Registered,Small,92259128251,,,,,,,,0.0,0.0,Children - aged 6 to under 15; Early childhood - aged under 6; Youth - 15 to under 25,17 Jun 2022,0.0
1415,https://www.acnc.gov.au/charity/charities/5485bb9d-39af-e811-a962-000d3ad24a0d/profile,The Trustee For Kevin Stewart Cowell Estate,Melbourne,VIC,Registered,Small,31398434100,,,,,,,,42871.0,40943.0,General community in Australia,16 Jan 2022,0.0
1416,https://www.acnc.gov.au/charity/charities/f5cf4fe1-39af-e811-a962-000d3ad24a0d/profile,Narre Warren Christian Church Inc Welfare Fund,Narre Warren,VIC,Registered,Small,45475818969,,,,,,,http://transitoutreach.org.au/,62084.0,89757.0,"Aboriginal and Torres Strait Islander people; Adults - aged 25 to under 65; Adults - aged 65 and over; Children - aged 6 to under 15; Early childhood - aged under 6; Families; Females; Financially disadvantaged people; Gay, lesbian, bisexual, transgender or intersex persons; General community in Australia; Males; Migrants, refugees or asylum seekers; People at risk of homelessness/ people experiencing homelessness; People from a culturally and linguistically diverse background; People with chronic illness (including terminal illness); People with disabilities; Unemployed persons; Youth - 15 to under 25",9 Dec 2021,1.0
1417,https://www.acnc.gov.au/charity/charities/4f3943db-39af-e811-a962-000d3ad24a0d/profile,Machinery Preservation Club of WA.Inc,Midland Dc,WA,Registered,Small,89977424595,,,,,,,http://machinerypreservationwa.com/,66222.0,44387.0,Adults - aged 25 to under 65; Adults - aged 65 and over; Children - aged 6 to under 15; General community in Australia,19 Jun 2022,0.0
1418,https://www.acnc.gov.au/charity/charities/833543db-39af-e811-a962-000d3ad24a0d/profile,The Trustee For The Catholiccare Trust,Bunbury,WA,Registered,Small,97621230808,,,,,,,,24500.0,440.0,General community in Australia; Other charities,26 Jan 2022,1.0
1419,https://www.acnc.gov.au/charity/charities/2f3243db-39af-e811-a962-000d3ad24a0d/profile,The Trustee For Clifford Ward Trust,Melbourne,VIC,Registered,Small,97407906459,,,,,,,,19200.0,18598.0,Early childhood - aged under 6,16 Jan 2022,0.0
1420,https://www.acnc.gov.au/charity/charities/496627d5-39af-e811-a962-000d3ad24a0d/profile,Fellowship Baptist Church Inc,Moorebank,NSW,Registered,Small,68250388793,,,,,,,http://fellowshipbaptist.org.au/,148587.0,113604.0,"Aboriginal and Torres Strait Islander people; Adults - aged 25 to under 65; Adults - aged 65 and over; Children - aged 6 to under 15; Early childhood - aged under 6; Families; Females; Financially disadvantaged people; Gay, lesbian, bisexual, transgender or intersex persons; General community in Australia; Males; Migrants, refugees or asylum seekers; Other charities; Overseas communities or charities; People at risk of homelessness/ people experiencing homelessness; People from a culturally and linguistically diverse background; People in rural/regional/remote communities; People with chronic illness (including terminal illness); People with disabilities; Pre/post release offenders and/or their families; Unemployed persons; Veterans and/or their families; Victims of crime (including family violence); Victims of disaster; Youth - 15 to under 25",8 Nov 2021,1.0
1421,https://www.acnc.gov.au/charity/charities/27fbd33d-39af-e811-a962-000d3ad24a0d/profile,KINGSGROVE PUBLIC SCHOOL P&C ASSOC,Kingsgrove,NSW,Registered,Small,96868712464,,,,,,,http://kingsgroveps.nsw.edu.au/,5895.0,6506.0,Children - aged 6 to under 15,16 May 2022,0.0
1422,https://www.acnc.gov.au/charity/charities/66c8c537-39af-e811-a962-000d3ad24a0d/profile,The Trustee For The Ron And Margaret Dobell Foundation,Melbourne,VIC,Registered,Small,30295480675,,,,,,,http://dobellfoundation.com/,37794.0,67985.0,Adults - aged 25 to under 65; Adults - aged 65 and over; People from a culturally and linguistically diverse background; Youth - 15 to under 25,31 Jan 2022,0.0
1423,https://www.acnc.gov.au/charity/charities/09c9c537-39af-e811-a962-000d3ad24a0d/profile,The Corporation Of The Diocesan Synod Of North Queensland,Townsville,QLD,Registered,Small,30370958694,,,,,,,,0.0,0.0,"Aboriginal and Torres Strait Islander people; Adults - aged 25 to under 65; Adults - aged 65 and over; Children - aged 6 to under 15; Early childhood - aged under 6; Families; Females; Financially disadvantaged people; Gay, lesbian, bisexual, transgender or intersex persons; General community in Australia; Males; Migrants, refugees or asylum seekers; Other charities; Overseas communities or charities; People at risk of homelessness/ people experiencing homelessness; People from a culturally and linguistically diverse background; People in rural/regional/remote communities; People with chronic illness (including terminal illness); People with disabilities; Pre/post release offenders and/or their families; Unemployed persons; Veterans and/or their families; Victims of crime (including family violence); Victims of disaster; Youth - 15 to under 25",10 Jun 2022,1.0
1424,https://www.acnc.gov.au/charity/charities/17cac537-39af-e811-a962-000d3ad24a0d/profile,Uniting Church In Australia Traralgon District,Traralgon,VIC,Registered,Small,71920703924,,,,,,,http://traralgonuc.blogspot.com/,0.0,0.0,Adults - aged 25 to under 65; Adults - aged 65 and over; Children - aged 6 to under 15; Early childhood - aged under 6; Families,16 Jun 2022,1.0
1425,https://www.acnc.gov.au/charity/charities/0dc9c537-39af-e811-a962-000d3ad24a0d/profile,Younger Onset Dementia Association Inc,Unavailable,Unavailable,Registered,Small,71894874731,,,,,,,,0.0,0.0,,9 Sep 2020,0.0
1426,https://www.acnc.gov.au/charity/charities/17715a24-39af-e811-a962-000d3ad24a0d/profile,The Trustee For Melbourne Rudolf Steiner School Scholarship/ Bursary Fund,Unavailable,Unavailable,Registered,Small,88672908638,,,,,,,,4841.0,25156.0,Children - aged 6 to under 15; Early childhood - aged under 6; Youth - 15 to under 25,29 Jun 2022,0.0
1427,https://www.acnc.gov.au/charity/charities/52c1ce49-39af-e811-a962-000d3ad24a0d/profile,Wildlife In Secure Environment Inc,Glen Iris,VIC,Registered,Small,18375095732,,,,,,,http://wisetrust.org.au/,53577.0,102507.0,Animals; Environment; People in rural/regional/remote communities,1 Jan 2022,0.0
1428,https://www.acnc.gov.au/charity/charities/a602d43d-39af-e811-a962-000d3ad24a0d/profile,The Trustee For Mark Mitchell Research Foundation,Adelaide,SA,Registered,Small,12007032266,,,,,,,,63440.0,19230.0,Adults - aged 25 to under 65; Children - aged 6 to under 15; Females; Males; Other charities; People with disabilities; Unemployed persons; Youth - 15 to under 25,30 Jan 2022,0.0
1429,https://www.acnc.gov.au/charity/charities/2dbece49-39af-e811-a962-000d3ad24a0d/profile,High Street Church Incorporated,Queanbeyan East,NSW,Registered,Small,67488780219,,,,,,,http://www.highst.com.au/,221994.0,142292.0,General community in Australia,24 Nov 2021,1.0
1430,https://www.acnc.gov.au/charity/charities/31fed643-39af-e811-a962-000d3ad24a0d/profile,Meklit Wholistic International Ministry Incorprated,Unavailable,Unavailable,Registered,Small,47479598833,,,,,,,,26607.0,29901.0,Families,31 Jan 2022,1.0
1431,https://www.acnc.gov.au/charity/charities/65fcd643-39af-e811-a962-000d3ad24a0d/profile,The Trustee For Cox Family Foundation,Unavailable,Unavailable,Registered,Small,89005346014,,,,,,,,42311.0,39180.0,Youth - 15 to under 25,29 Dec 2021,1.0
1432,https://www.acnc.gov.au/charity/charities/30fed643-39af-e811-a962-000d3ad24a0d/profile,Catholic Parish Of St.Dominic Kandos,Bathurst,NSW,Registered,Small,47265927702,,,,,,,http://www.bathurst.catholic.org.au/,0.0,0.0,"Aboriginal and Torres Strait Islander people; Adults - aged 25 to under 65; Adults - aged 65 and over; Children - aged 6 to under 15; Early childhood - aged under 6; Families; Females; Financially disadvantaged people; Gay, lesbian, bisexual, transgender or intersex persons; General community in Australia; Males; Migrants, refugees or asylum seekers; Other charities; People at risk of homelessness/ people experiencing homelessness; People from a culturally and linguistically diverse background; People in rural/regional/remote communities; People with chronic illness (including terminal illness); People with disabilities; Pre/post release offenders and/or their families; Unemployed persons; Veterans and/or their families; Victims of crime (including family violence); Victims of disaster; Youth - 15 to under 25",18 Jan 2022,1.0
1433,https://www.acnc.gov.au/charity/charities/e0c1ce49-39af-e811-a962-000d3ad24a0d/profile,Mount Pleasant Natural Resource Centre Inc,Mount Pleasant,SA,Registered,Small,18356671553,,,,,,,,241336.0,234625.0,Adults - aged 25 to under 65; Adults - aged 65 and over; Children - aged 6 to under 15; Early childhood - aged under 6; Environment; Families; Females; Financially disadvantaged people; General community in Australia; Males; Other charities; People in rural/regional/remote communities; Unemployed persons; Youth - 15 to under 25,31 Jan 2022,0.0
1434,https://www.acnc.gov.au/charity/charities/40bbce49-39af-e811-a962-000d3ad24a0d/profile,Shine Community Care Limited,Buddina,QLD,Registered,Small,42105098253,,,,,,,http://www.shinecare.com.au/,33708.0,41029.0,Adults - aged 25 to under 65; Adults - aged 65 and over; Children - aged 6 to under 15; Early childhood - aged under 6; Families; People with chronic illness (including terminal illness); Youth - 15 to under 25,10 Mar 2022,0.0
1435,https://www.acnc.gov.au/charity/charities/651c9851-39af-e811-a962-000d3ad24a0d/profile,St Patricks Catholic School Walcha Parents And Friends Association,Walcha,NSW,Registered,Small,30796137005,,,,,,,https://stpatrickswalcha.catholic.edu.au/,41227.0,21883.0,Children - aged 6 to under 15,21 Jul 2022,0.0
1436,https://www.acnc.gov.au/charity/charities/72fed33d-39af-e811-a962-000d3ad24a0d/profile,Trundle Pastoral & Agricultural Societ,Trundle,NSW,Registered,Small,80824197038,,,,,,,,62384.0,36882.0,Aboriginal and Torres Strait Islander people; Adults - aged 25 to under 65; Adults - aged 65 and over; Animals; Children - aged 6 to under 15; Early childhood - aged under 6; Environment; Families; Females; Financially disadvantaged people; General community in Australia; Males; Other; Other charities; People from a culturally and linguistically diverse background; People in rural/regional/remote communities; People with disabilities; Unemployed persons; Veterans and/or their families; Youth - 15 to under 25,4 Nov 2021,0.0
1437,https://www.acnc.gov.au/charity/charities/4abcce49-39af-e811-a962-000d3ad24a0d/profile,Swan Hill Group Of Bendigo Legacy Club,Swan Hill,VIC,Registered,Small,67483541571,,,,,,,,7506.0,37201.0,Adults - aged 65 and over; Females; People in rural/regional/remote communities; Veterans and/or their families,23 Jun 2022,0.0
1438,https://www.acnc.gov.au/charity/charities/99c1ce49-39af-e811-a962-000d3ad24a0d/profile,Thurgoona Baptist Church,Thurgoona,NSW,Registered,Small,18380726549,,,,,,,,45596.0,17118.0,"Families; General community in Australia; Migrants, refugees or asylum seekers; People from a culturally and linguistically diverse background",27 Aug 2017,1.0
1439,https://www.acnc.gov.au/charity/charities/46219851-39af-e811-a962-000d3ad24a0d/profile,Future Direction Network Inc,Sydney,NSW,Registered,Small,76543859401,,,,,,,http://fdn.net.au/,115315.0,59173.0,Youth - 15 to under 25,24 Jan 2022,0.0
1440,https://www.acnc.gov.au/charity/charities/86fb8f57-39af-e811-a962-000d3ad24a0d/profile,The Spiritual Assembly of The Baha'is of Wingecarribee,Bowral,NSW,Registered,Small,57802431506,,,,,,,http://www.bahaiwingecarribee.org.au/,0.0,0.0,Adults - aged 25 to under 65; Children - aged 6 to under 15; Youth - 15 to under 25,7 Jun 2022,1.0
1441,https://www.acnc.gov.au/charity/charities/a48bd464-39af-e811-a962-000d3ad24a0d/profile,Terry Prunster Memorial Trust Fund,Mariginiup,WA,Registered,Small,89204943514,,,,,,,,2210.0,0.0,Children - aged 6 to under 15,25 Mar 2021,0.0
1442,https://www.acnc.gov.au/charity/charities/c78ed464-39af-e811-a962-000d3ad24a0d/profile,Outreach Fellowship,Chatswood,NSW,Registered,Small,89344925662,,,,,,,,37.0,200.0,Adults - aged 25 to under 65,5 Dec 2021,1.0
1443,https://www.acnc.gov.au/charity/charities/5c89d464-39af-e811-a962-000d3ad24a0d/profile,Redeemer Lutheran Church,Unavailable,Unavailable,Registered,Small,52893852889,,,,,,,,0.0,0.0,Families,20 Aug 2022,1.0
1444,https://www.acnc.gov.au/charity/charities/1f259851-39af-e811-a962-000d3ad24a0d/profile,The Biography Program,Fitzroy North,VIC,Registered,Small,12153358313,,,,,,,http://www.beyondwords.org.au/,3042.0,29293.0,Adults - aged 65 and over; Other,17 Jan 2022,0.0
1445,https://www.acnc.gov.au/charity/charities/49bcce49-39af-e811-a962-000d3ad24a0d/profile,Prospect-Enfield Adelphos Inter-Church Council Incorporated,Prospect,SA,Registered,Small,67446602531,,,,,,,http://smg.asn.au/,5940.0,6492.0,Children - aged 6 to under 15; Females; Males; People from a culturally and linguistically diverse background,21 Jan 2022,1.0
1446,https://www.acnc.gov.au/charity/charities/2bde9a5e-39af-e811-a962-000d3ad24a0d/profile,Brady Cancer Support Foundation Inc,Cottesloe,WA,Registered,Small,42445821049,,,,,,,,155749.0,267314.0,General community in Australia,17 Jan 2022,0.0
1447,https://www.acnc.gov.au/charity/charities/dce49a5e-39af-e811-a962-000d3ad24a0d/profile,Queensland Indigenous Working Group Limited,Unavailable,Unavailable,Registered,Small,81114579985,,,,,,,,0.0,0.0,,19 Feb 2022,0.0
1448,https://www.acnc.gov.au/charity/charities/e08cd464-39af-e811-a962-000d3ad24a0d/profile,Catholic Parish Of St Patrick Mortlake,Mortlake,NSW,Registered,Small,52701877964,,,,,,,,0.0,0.0,General community in Australia,27 Jan 2022,1.0
1449,https://www.acnc.gov.au/charity/charities/e0bece49-39af-e811-a962-000d3ad24a0d/profile,Jesuit Fathers Athelstone,Athelstone,SA,Registered,Small,18347641419,,,,,,,,0.0,0.0,General community in Australia,21 Apr 2022,1.0
1450,https://www.acnc.gov.au/charity/charities/f28cd464-39af-e811-a962-000d3ad24a0d/profile,Gateway Baptist Church,Launceston,TAS,Registered,Small,89211589515,,,,,,,,0.0,0.0,"Families; General community in Australia; Migrants, refugees or asylum seekers",31 Jan 2020,1.0
1451,https://www.acnc.gov.au/charity/charities/35f78f57-39af-e811-a962-000d3ad24a0d/profile,Dalwood Auxiliary Incorporated,Seaforth,NSW,Registered,Small,93049724409,,,,,,,http://www.dalwoodauxiliary.com.au/,17749.0,160119.0,Aboriginal and Torres Strait Islander people; Children - aged 6 to under 15; Early childhood - aged under 6; Families; Females; Financially disadvantaged people; Males; People at risk of homelessness/ people experiencing homelessness; People from a culturally and linguistically diverse background,28 Mar 2022,0.0
1452,https://www.acnc.gov.au/charity/charities/578cd464-39af-e811-a962-000d3ad24a0d/profile,Malaysian-Singaporean Catholic Community Of Australia,Perth,WA,Registered,Small,18833627287,,,,,,,http://www.mscca.org.au/,20411.0,11313.0,Adults - aged 25 to under 65; Adults - aged 65 and over; Children - aged 6 to under 15; Females; General community in Australia; Males; People at risk of homelessness/ people experiencing homelessness; Youth - 15 to under 25,5 Dec 2021,1.0
1453,https://www.acnc.gov.au/charity/charities/44fe8f57-39af-e811-a962-000d3ad24a0d/profile,Hopetoun Men In Sheds Incorporated,Hopetoun,WA,Registered,Small,36978105184,,,,,,,,92040.0,71610.0,Adults - aged 65 and over; Environment; Financially disadvantaged people; General community in Australia; People in rural/regional/remote communities; Victims of disaster,28 Jan 2022,0.0
1454,https://www.acnc.gov.au/charity/charities/25e39a5e-39af-e811-a962-000d3ad24a0d/profile,Hope Community Church Menai Incorporated,Menai Central,NSW,Registered,Small,81130360519,,,,,,,,68174.0,58824.0,Early childhood - aged under 6; Families; Females; Males; Other,11 Mar 2022,1.0
1455,https://www.acnc.gov.au/charity/charities/e18fd464-39af-e811-a962-000d3ad24a0d/profile,THE SAINT PAUL'S EVANGELICAL LUTHERAN CHURCH (WARABA),Caboolture,QLD,Registered,Small,89443380665,,,,,,,http://www.stpaulscaboolture.org.au/,0.0,0.0,Adults - aged 25 to under 65; Adults - aged 65 and over; Children - aged 6 to under 15; Early childhood - aged under 6; Families; Youth - 15 to under 25,21 Mar 2022,1.0
1456,https://www.acnc.gov.au/charity/charities/d94dc46b-39af-e811-a962-000d3ad24a0d/profile,Out Of School Hours Goonellabah Inc,Goonellabah,NSW,Registered,Small,24906206786,,,,,,,,100102.0,90719.0,Children - aged 6 to under 15,27 Jan 2022,0.0
1457,https://www.acnc.gov.au/charity/charities/9fe09a5e-39af-e811-a962-000d3ad24a0d/profile,Kadina High School P&C Assn,Unavailable,Unavailable,Registered,Small,18574243984,,,,,,,,169254.0,193693.0,Children - aged 6 to under 15; Youth - 15 to under 25,27 Apr 2022,0.0
1458,https://www.acnc.gov.au/charity/charities/71d89a5e-39af-e811-a962-000d3ad24a0d/profile,Hastings Community House Inc,Hastings,VIC,Registered,Small,57930437561,,,,,,,http://www.hastingsch.com/,185573.0,132846.0,Adults - aged 25 to under 65; Children - aged 6 to under 15; Females; Financially disadvantaged people; Males; People at risk of homelessness/ people experiencing homelessness; People from a culturally and linguistically diverse background; People with chronic illness (including terminal illness); People with disabilities; Unemployed persons; Youth - 15 to under 25,9 Feb 2022,0.0
1459,https://www.acnc.gov.au/charity/charities/36da9a5e-39af-e811-a962-000d3ad24a0d/profile,Australian Institute Of Administrative Law Incorporated,Mawson,ACT,Registered,Small,97054164064,,,,,,,http://www.aial.org.au/,56166.0,84818.0,General community in Australia,10 Dec 2021,0.0
1460,https://www.acnc.gov.au/charity/charities/9389d464-39af-e811-a962-000d3ad24a0d/profile,UCA - Footscray Community Uniting Church,Footscray,VIC,Registered,Small,89201641397,,,,,,,,0.0,0.0,,2 Aug 2022,1.0
1461,https://www.acnc.gov.au/charity/charities/4df78f57-39af-e811-a962-000d3ad24a0d/profile,Gertonia Gospel Trust,Unavailable,Unavailable,Registered,Small,85083823154,,,,,,,,0.0,0.0,General community in Australia,30 Jan 2022,1.0
1462,https://www.acnc.gov.au/charity/charities/b6f38f57-39af-e811-a962-000d3ad24a0d/profile,The Trustee For Catapult Foundation,Norwood,SA,Registered,Small,47764807442,,,,,,,https://www.catapultfoundation.com.au/,147459.0,147220.0,Financially disadvantaged people; Other charities; People at risk of homelessness/ people experiencing homelessness; People with disabilities; Youth - 15 to under 25,22 Dec 2021,0.0
1463,https://www.acnc.gov.au/charity/charities/0288d464-39af-e811-a962-000d3ad24a0d/profile,Inverloch And District Hostel Development Committee Inc,Inverloch,VIC,Registered,Small,52685141243,,,,,,,,5026.0,620.0,Adults - aged 65 and over; Financially disadvantaged people; People with disabilities,22 Dec 2021,0.0
1464,https://www.acnc.gov.au/charity/charities/cbdd9a5e-39af-e811-a962-000d3ad24a0d/profile,Mount Lewis P&C Association,Greenacre,NSW,Registered,Small,42524077886,,,,,,,,32354.0,31780.0,Children - aged 6 to under 15,14 Oct 2021,0.0
1465,https://www.acnc.gov.au/charity/charities/3af92072-39af-e811-a962-000d3ad24a0d/profile,The Trustee For Lithgow Gospel Trust,Unavailable,Unavailable,Registered,Small,12418043471,,,,,,,,0.0,0.0,General community in Australia,30 Jan 2022,1.0
1466,https://www.acnc.gov.au/charity/charities/fb209851-39af-e811-a962-000d3ad24a0d/profile,The Trustee For Campbellfield Lands Trust,Melbourne,VIC,Registered,Small,76700822577,,,,,,,http://www.melbourneanglican.org.au/,0.0,0.0,General community in Australia,27 Jun 2022,1.0
1467,https://www.acnc.gov.au/charity/charities/f08dd464-39af-e811-a962-000d3ad24a0d/profile,Cairns Cook Island Christian Church Association Inc,Mount Sheridan,QLD,Registered,Small,89435981661,,,,,,,,157920.0,123991.0,Adults - aged 25 to under 65; Adults - aged 65 and over; Children - aged 6 to under 15; Early childhood - aged under 6; Families; Youth - 15 to under 25,11 Aug 2022,1.0
1468,https://www.acnc.gov.au/charity/charities/ec72c096-39af-e811-a962-000d3ad24a0d/profile,Hopetoun Recreation Reserve Management Committee,Hopetoun,VIC,Registered,Small,77216094519,,,,,,,,80286.0,23000.0,Adults - aged 25 to under 65; Adults - aged 65 and over; Children - aged 6 to under 15; Early childhood - aged under 6; Families; Females; Males; People in rural/regional/remote communities; Youth - 15 to under 25,19 Jan 2022,0.0
1469,https://www.acnc.gov.au/charity/charities/ed83bb9d-39af-e811-a962-000d3ad24a0d/profile,The Trustee For Donovan Astronomical Trust,Unavailable,Unavailable,Registered,Small,58587743748,,,,,,,,0.0,0.0,General community in Australia,25 Mar 2021,0.0
1470,https://www.acnc.gov.au/charity/charities/ea6ec096-39af-e811-a962-000d3ad24a0d/profile,Uca-Carlton/Ramsgate,Ramsgate,NSW,Registered,Small,42973623530,,,,,,,https://ramsgatechurch.wordpress.com/,0.0,0.0,Adults - aged 25 to under 65; Adults - aged 65 and over; Children - aged 6 to under 15; Early childhood - aged under 6; Families; Females; General community in Australia; Males; Other charities; Youth - 15 to under 25,24 Jan 2022,1.0
1471,https://www.acnc.gov.au/charity/charities/7e72c096-39af-e811-a962-000d3ad24a0d/profile,Australian Poetry Limited,Melbourne,VIC,Registered,Small,77146117679,,,,,,,http://australianpoetry.org/,233871.0,236410.0,"Aboriginal and Torres Strait Islander people; Adults - aged 25 to under 65; Adults - aged 65 and over; Females; Gay, lesbian, bisexual, transgender or intersex persons; Males; Migrants, refugees or asylum seekers; People from a culturally and linguistically diverse background; People in rural/regional/remote communities; People with disabilities; Youth - 15 to under 25",26 Jun 2022,0.0
1472,https://www.acnc.gov.au/charity/charities/be82bb9d-39af-e811-a962-000d3ad24a0d/profile,Coonabarabran High School P&C Assoc,Coonabarabran,NSW,Registered,Small,31575460139,,,,,,,,213147.0,225220.0,Children - aged 6 to under 15; People in rural/regional/remote communities; Youth - 15 to under 25,9 Jul 2022,0.0
1473,https://www.acnc.gov.au/charity/charities/197bbb9d-39af-e811-a962-000d3ad24a0d/profile,Balaklava Lutheran Youth Fellowship,Unavailable,Unavailable,Registered,Small,77372838543,,,,,,,,0.0,0.0,General community in Australia; People in rural/regional/remote communities,18 Mar 2020,1.0
1474,https://www.acnc.gov.au/charity/charities/d670c096-39af-e811-a962-000d3ad24a0d/profile,The Trustee For The Tony & Gwenyth Lennon Family Foundation,Unavailable,Unavailable,Registered,Small,42975207954,,,,,,,,88101.0,153060.0,Youth - 15 to under 25,24 Jan 2022,0.0
1475,https://www.acnc.gov.au/charity/charities/e27dbb9d-39af-e811-a962-000d3ad24a0d/profile,Shepparton Church Of Christ,Shepparton,VIC,Registered,Small,13076052155,,,,,,,http://www.sheppartonchurchofchrist.org.au/,244414.0,187634.0,Families; Financially disadvantaged people; People from a culturally and linguistically diverse background; People with disabilities; Unemployed persons,11 Jan 2022,1.0
1476,https://www.acnc.gov.au/charity/charities/1f86bb9d-39af-e811-a962-000d3ad24a0d/profile,ACPT - Paddington Trust,Sydney,NSW,Registered,Small,58408417173,,,,,,,,0.0,0.0,General community in Australia,23 Jun 2022,1.0
1477,https://www.acnc.gov.au/charity/charities/6f4e557e-39af-e811-a962-000d3ad24a0d/profile,Community Radio Association Mackay Inc,Mackay,QLD,Registered,Small,53055764022,,,,,,,http://4crm.com.au/,61817.0,38260.0,Aboriginal and Torres Strait Islander people; Adults - aged 25 to under 65; Adults - aged 65 and over; Children - aged 6 to under 15; Families; Females; Males; People from a culturally and linguistically diverse background; People in rural/regional/remote communities; Youth - 15 to under 25,22 Dec 2021,0.0
