,Index_Link,Legal_Name,Town/Suburb,State,Status,Size,ABN,Website,Revenue,Expenses,Cause/s,Last_report_date,ref_religion,website,revenue,expenses,causes,lastreport,religious_ref
218,https://www.acnc.gov.au/charity/charities/9e099443-3aaf-e811-a960-000d3ad24282/profile,The Trustee for The Girls & Boys Brigade Foundation,Surry Hills,NSW,Registered,Small,37142341507,,,,,,,,116729.0,291837.0,Aboriginal and Torres Strait Islander people; Children - aged 6 to under 15; Families; Females; Financially disadvantaged people; General community in Australia; Males; People at risk of homelessness/ people experiencing homelessness; People from a culturally and linguistically diverse background; People with disabilities; Pre/post release offenders and/or their families; Unemployed persons; Victims of crime (including family violence); Youth - 15 to under 25,29 Jun 2022,0.0
219,https://www.acnc.gov.au/charity/charities/140f9443-3aaf-e811-a960-000d3ad24282/profile,Newport Baptist Church,Newport,VIC,Registered,Small,41698601897,,,,,,,http://www.newportbaptistchurch.com.au/,108144.0,123654.0,Adults - aged 25 to under 65; Adults - aged 65 and over; Children - aged 6 to under 15; Early childhood - aged under 6; Families; Females; General community in Australia; Males; People from a culturally and linguistically diverse background; People with chronic illness (including terminal illness); Unemployed persons; Youth - 15 to under 25,5 May 2022,1.0
220,https://www.acnc.gov.au/charity/charities/1c077f25-3aaf-e811-a960-000d3ad24282/profile,Rockhampton West Congregation of Jehovah's Witnesses,Park Avenue,QLD,Registered,Small,50870575144,,,,,,,,0.0,0.0,General community in Australia,16 Dec 2021,1.0
221,https://www.acnc.gov.au/charity/charities/1b5c0a08-3aaf-e811-a960-000d3ad24282/profile,Bardon Congregation of Jehovah's Witnesses,Toowong,QLD,Registered,Small,72994649153,,,,,,,,0.0,0.0,General community in Australia,21 Dec 2021,1.0
222,https://www.acnc.gov.au/charity/charities/ca5cd232-3aaf-e811-a960-000d3ad24282/profile,Babymum Australia Inc,Launceston,TAS,Registered,Small,18625511309,,,,,,,https://www.facebook.com/babymumaustralia/,383.0,1121.0,Females; Financially disadvantaged people; Youth - 15 to under 25,19 Jan 2022,0.0
223,https://www.acnc.gov.au/charity/charities/006c8c49-3aaf-e811-a960-000d3ad24282/profile,Cubberla-Witton Catchments Network Inc,Chapel Hill,QLD,Registered,Small,21367529654,,,,,,,http://www.cwcn.org.au/,47409.0,46396.0,General community in Australia,11 May 2022,0.0
224,https://www.acnc.gov.au/charity/charities/6765844f-3aaf-e811-a960-000d3ad24282/profile,SCOTTSDALE RSL SUB-BRANCH INC.,Scottsdale,TAS,Registered,Small,73569399670,,,,,,,,8459.0,7105.0,Children - aged 6 to under 15; Veterans and/or their families; Youth - 15 to under 25,20 Mar 2022,0.0
225,https://www.acnc.gov.au/charity/charities/8e65844f-3aaf-e811-a960-000d3ad24282/profile,Uncle Alfred's Mens Group,Tarragindi,QLD,Registered,Small,90411547086,,,,,,,,64684.0,53039.0,Aboriginal and Torres Strait Islander people; Adults - aged 25 to under 65; Adults - aged 65 and over; Children - aged 6 to under 15; Families; Financially disadvantaged people; People at risk of homelessness/ people experiencing homelessness; People in rural/regional/remote communities; Victims of crime (including family violence); Youth - 15 to under 25,4 Apr 2021,0.0
226,https://www.acnc.gov.au/charity/charities/276e844f-3aaf-e811-a960-000d3ad24282/profile,Did You Know Education Incorporated,Pitt Town,NSW,Registered,Small,63245736315,,,,,,,http://www.didyouknow.org.au/,236501.0,155673.0,Children - aged 6 to under 15; General community in Australia; Other; Youth - 15 to under 25,19 Jan 2022,0.0
227,https://www.acnc.gov.au/charity/charities/d16d844f-3aaf-e811-a960-000d3ad24282/profile,Abilities Empowered Association Incorporated,Bella Vista,NSW,Registered,Small,74896793947,,,,,,,http://www.abilitiesempowered.org/,44285.0,43749.0,Children - aged 6 to under 15; Females; Financially disadvantaged people; General community in Australia; Males; Other charities; People with disabilities; Unemployed persons; Youth - 15 to under 25,13 Mar 2022,0.0
228,https://www.acnc.gov.au/charity/charities/7e71844f-3aaf-e811-a960-000d3ad24282/profile,ISOKRSNA INCORPORATED,Seabrook,VIC,Registered,Small,84558704825,,,,,,,http://www.isokrsna.com/,2946.0,2107.0,Adults - aged 25 to under 65; Children - aged 6 to under 15; Early childhood - aged under 6; Females; General community in Australia; Males; Youth - 15 to under 25,30 Jan 2020,0.0
229,https://www.acnc.gov.au/charity/charities/4d768c49-3aaf-e811-a960-000d3ad24282/profile,HISTORYMAKER AUSTRALIA AS THE OPERATOR OF A PBI,Beerwah,QLD,Registered,Small,54508660061,,,,,,,http://historymaker.org.au/,245000.0,200000.0,Adults - aged 25 to under 65; Adults - aged 65 and over; Children - aged 6 to under 15; Early childhood - aged under 6; Families; Females; Financially disadvantaged people; Males; Other charities; People at risk of homelessness/ people experiencing homelessness; People with chronic illness (including terminal illness); Pre/post release offenders and/or their families; Unemployed persons; Youth - 15 to under 25,19 Jan 2022,1.0
230,https://www.acnc.gov.au/charity/charities/6770844f-3aaf-e811-a960-000d3ad24282/profile,ISPS Power of Sports Fund Ltd,Perth,WA,Registered,Small,27169559282,,,,,,,,0.0,27620.0,Adults - aged 25 to under 65; People with disabilities; Veterans and/or their families,15 Jun 2022,0.0
231,https://www.acnc.gov.au/charity/charities/cb728c49-3aaf-e811-a960-000d3ad24282/profile,Oceania Australia Foundation,Melbourne,VIC,Registered,Small,66121646277,,,,,,,http://www.oceaniaaustraliafoundation.com.au/,32566.0,213345.0,Females; Financially disadvantaged people; People in rural/regional/remote communities; Youth - 15 to under 25,31 Jan 2022,0.0
232,https://www.acnc.gov.au/charity/charities/52758c49-3aaf-e811-a960-000d3ad24282/profile,THE EVERGREEN TAOIST CHURCH OF AUSTRALIA AS THE OPERATOR OF A PBI,Deagon,QLD,Registered,Small,67459512516,,,,,,,,0.0,0.0,Adults - aged 65 and over; General community in Australia; People from a culturally and linguistically diverse background,23 Sep 2017,1.0
233,https://www.acnc.gov.au/charity/charities/f8758c49-3aaf-e811-a960-000d3ad24282/profile,COMMUNITY OPTIONS INCORPORATED AS THE OPERATOR OF A PBI,Manuka,ACT,Registered,Small,97595636628,,,,,,,http://www.communityoptions.com.au/,0.0,0.0,Adults - aged 25 to under 65; Adults - aged 65 and over; Families,7 Feb 2022,0.0
234,https://www.acnc.gov.au/charity/charities/6365844f-3aaf-e811-a960-000d3ad24282/profile,Rockhampton Men's Shed Inc,North Rockhampton,QLD,Registered,Small,62137118647,,,,,,,http://rockhamptonmensshed.org.au/,135710.0,32842.0,Aboriginal and Torres Strait Islander people; Adults - aged 25 to under 65; Adults - aged 65 and over; Females; Financially disadvantaged people; General community in Australia; Males; People at risk of homelessness/ people experiencing homelessness; People with disabilities; Unemployed persons; Veterans and/or their families; Victims of disaster,24 Dec 2021,0.0
235,https://www.acnc.gov.au/charity/charities/516e844f-3aaf-e811-a960-000d3ad24282/profile,Blossoms Rescue,Orange,NSW,Registered,Small,51829647986,,,,,,,http://www.facebook.com/blossomsrescue,46460.0,44156.0,Animals,7 Dec 2021,0.0
236,https://www.acnc.gov.au/charity/charities/d9768c49-3aaf-e811-a960-000d3ad24282/profile,International Collaboration on Cancer Reporting Limited,Surry Hills,NSW,Registered,Small,69601723960,,,,,,,http://www.iccr-cancer.org/,183888.0,185868.0,General community in Australia; Overseas communities or charities,3 Nov 2021,0.0
237,https://www.acnc.gov.au/charity/charities/ae11583b-3aaf-e811-a960-000d3ad24282/profile,THE TRUSTEE FOR THE HAY FAMILY BENEVOLENT FUND,Unavailable,Unavailable,Registered,Small,48799526973,,,,,,,,153247.0,92559.0,Other charities,28 Jan 2022,0.0
238,https://www.acnc.gov.au/charity/charities/2c628c49-3aaf-e811-a960-000d3ad24282/profile,BANGABANDHU COUNCIL AUSTRALIA INCORPORATED,Unavailable,Unavailable,Registered,Small,84768115907,,,,,,,,0.0,24182.0,Females; People from a culturally and linguistically diverse background,20 Jan 2022,0.0
239,https://www.acnc.gov.au/charity/charities/0a1ece55-3aaf-e811-a960-000d3ad24282/profile,Journeys for Climate Justice Inc,Surrey Hills,VIC,Registered,Small,63782124595,,,,,,,http://www.journeysforclimatejustice.org.au/,1548.0,1493.0,Overseas communities or charities; People in rural/regional/remote communities; Victims of disaster,2 Jan 2022,0.0
240,https://www.acnc.gov.au/charity/charities/41758c49-3aaf-e811-a960-000d3ad24282/profile,Missionary Daughters of the Holy Family of Nazareth,Karama,NT,Registered,Small,45355742070,,,,,,,,0.0,0.0,Children - aged 6 to under 15; Early childhood - aged under 6; Families; Females; Males; People from a culturally and linguistically diverse background; Youth - 15 to under 25,25 Jan 2022,1.0
241,https://www.acnc.gov.au/charity/charities/74748c49-3aaf-e811-a960-000d3ad24282/profile,Woodend Neighbourhood House Inc,Woodend,VIC,Registered,Small,97689716244,,,,,,,http://www.woodendnh.org.au/,227288.0,170810.0,Adults - aged 25 to under 65; Adults - aged 65 and over; People in rural/regional/remote communities; Victims of disaster; Youth - 15 to under 25,29 Jun 2022,0.0
242,https://www.acnc.gov.au/charity/charities/4ca8f05b-3aaf-e811-a960-000d3ad24282/profile,"Tuvalu Christian Church, Brisbane Inc.",Darra,QLD,Registered,Small,47648381881,,,,,,,,188030.0,69149.0,Families,10 Sep 2021,1.0
243,https://www.acnc.gov.au/charity/charities/136f8c49-3aaf-e811-a960-000d3ad24282/profile,Greenway Tenants' Group Incorporated,Kirribilli,NSW,Registered,Small,88401966052,,,,,,,http://greenwaytg.com.au/,93586.0,93633.0,Adults - aged 65 and over; Females; Financially disadvantaged people; Males; People from a culturally and linguistically diverse background; Unemployed persons,29 Dec 2021,0.0
244,https://www.acnc.gov.au/charity/charities/8124ce55-3aaf-e811-a960-000d3ad24282/profile,Truc Lam Tu An Charitable Trust,Tylden,VIC,Registered,Small,78773859482,,,,,,,,77690.0,22048.0,Adults - aged 25 to under 65; Adults - aged 65 and over; Females; Financially disadvantaged people; General community in Australia; Males; Victims of disaster,4 Feb 2020,1.0
245,https://www.acnc.gov.au/charity/charities/36acf05b-3aaf-e811-a960-000d3ad24282/profile,Sport For Humanity Foundation,Payneham,SA,Registered,Small,46614045631,,,,,,,,0.0,0.0,,7 Apr 2021,0.0
246,https://www.acnc.gov.au/charity/charities/9569844f-3aaf-e811-a960-000d3ad24282/profile,NATIONAL HOME MISSION FUND OF THE ANGLICAN CHURCH OF AUSTRALIA AS THE OPERATOR OF A PBI,Sydney,NSW,Registered,Small,12287735240,,,,,,,,0.0,0.0,Aboriginal and Torres Strait Islander people; General community in Australia; People in rural/regional/remote communities,29 Jun 2022,1.0
247,https://www.acnc.gov.au/charity/charities/d220ce55-3aaf-e811-a960-000d3ad24282/profile,Aestus Trust,Sydney,NSW,Registered,Small,66359097367,,,,,,,,112254.0,8959.0,Children - aged 6 to under 15; Financially disadvantaged people; Other charities; Overseas communities or charities; Victims of disaster,26 Jun 2022,0.0
248,https://www.acnc.gov.au/charity/charities/4b6e844f-3aaf-e811-a960-000d3ad24282/profile,Greenhead Men's Shed Incorporated,Green Head,WA,Registered,Small,54770373809,,,,,,,,27042.0,20066.0,Adults - aged 65 and over; Veterans and/or their families,15 Apr 2021,0.0
249,https://www.acnc.gov.au/charity/charities/a172844f-3aaf-e811-a960-000d3ad24282/profile,St Nicholas Antiochian Orthodox Church,Bankstown,NSW,Registered,Small,61852637252,,,,,,,,127360.0,60894.0,General community in Australia,14 Sep 2021,1.0
250,https://www.acnc.gov.au/charity/charities/091ece55-3aaf-e811-a960-000d3ad24282/profile,YOUTH ENGAGEMENT SUPPORT LTD,Geelong,VIC,Registered,Small,96603968672,,,,,,,,0.0,0.0,Aboriginal and Torres Strait Islander people; Children - aged 6 to under 15; Youth - 15 to under 25,21 Aug 2022,0.0
251,https://www.acnc.gov.au/charity/charities/7769844f-3aaf-e811-a960-000d3ad24282/profile,Korean Full Gospel Church of Adelaide Incorporated,Adelaide,SA,Registered,Small,16160596069,,,,,,,http://www.kfgca.com/,57161.0,37152.0,General community in Australia,19 Sep 2021,1.0
252,https://www.acnc.gov.au/charity/charities/6167844f-3aaf-e811-a960-000d3ad24282/profile,Northridge Haven Retirement Village Committee,Rockville,QLD,Registered,Small,29250326551,,,,,,,https://www.northridgehaven.com.au/,0.0,41000.0,,3 Feb 2021,0.0
253,https://www.acnc.gov.au/charity/charities/a171844f-3aaf-e811-a960-000d3ad24282/profile,Northside Christian College Foundation,Everton Park,QLD,Registered,Small,17563063096,,,,,,,https://www.northside.qld.edu.au/,33329.0,15677.0,Children - aged 6 to under 15; Youth - 15 to under 25,15 Jun 2022,1.0
254,https://www.acnc.gov.au/charity/charities/b249e861-3aaf-e811-a960-000d3ad24282/profile,Coonamble High School Parents & Citizens Association,Coonamble,NSW,Registered,Small,11627663070,,,,,,,,104451.0,112349.0,Children - aged 6 to under 15; Families; People in rural/regional/remote communities; Youth - 15 to under 25,28 May 2021,0.0
255,https://www.acnc.gov.au/charity/charities/e3a82868-3aaf-e811-a960-000d3ad24282/profile,Dulwich High School of Visual Arts & Design P & C Association,Dulwich Hill,NSW,Registered,Small,64806579925,,,,,,,,37974.0,44350.0,Children - aged 6 to under 15; Youth - 15 to under 25,3 Jun 2022,0.0
256,https://www.acnc.gov.au/charity/charities/051ece55-3aaf-e811-a960-000d3ad24282/profile,Good Thnx Foundation,Adelaide,SA,Registered,Small,93518935755,,,,,,,https://goodthnxfoundation.org/,225232.0,175507.0,Other charities,23 Dec 2021,0.0
257,https://www.acnc.gov.au/charity/charities/31b32868-3aaf-e811-a960-000d3ad24282/profile,"Australia Kachin Baptist Church, Sydney",Lidcombe,NSW,Registered,Small,78549591823,,,,,,,,0.0,0.0,General community in Australia; People from a culturally and linguistically diverse background,22 Jan 2022,1.0
258,https://www.acnc.gov.au/charity/charities/33aa2868-3aaf-e811-a960-000d3ad24282/profile,Secular Public Education Limited,Toowoomba,QLD,Registered,Small,67607107648,,,,,,,http://www.spe.org.au/,2000.0,6215.0,Children - aged 6 to under 15; Families; Youth - 15 to under 25,28 Jan 2022,1.0
259,https://www.acnc.gov.au/charity/charities/a64ee861-3aaf-e811-a960-000d3ad24282/profile,Australians at Pozieres Limited,Unavailable,Unavailable,Registered,Small,11605302663,,,,,,,,1.0,1423.0,Children - aged 6 to under 15,29 Aug 2019,0.0
260,https://www.acnc.gov.au/charity/charities/264de861-3aaf-e811-a960-000d3ad24282/profile,NRL Foundation,Unavailable,Unavailable,Registered,Small,90728528868,,,,,,,https://www.nrl.com/,0.0,38126.0,Adults - aged 25 to under 65; Males; People with disabilities; Youth - 15 to under 25,29 Apr 2022,0.0
261,https://www.acnc.gov.au/charity/charities/caaa2868-3aaf-e811-a960-000d3ad24282/profile,Catmint Cottage Sydney Rescue Inc,Fairfield West,NSW,Registered,Small,55694324426,,,,,,,http://www.catmintcottagestreetcatrescue.com.au/,62732.0,54601.0,Animals; Financially disadvantaged people; General community in Australia,8 Mar 2022,0.0
262,https://www.acnc.gov.au/charity/charities/58af2868-3aaf-e811-a960-000d3ad24282/profile,NACare Foundation,Brendale,QLD,Registered,Small,43115488662,,,,,,,http://nacare.org.au/,124495.0,105049.0,General community in Australia; Other charities; Victims of disaster,29 Sep 2021,1.0
263,https://www.acnc.gov.au/charity/charities/5f21ce55-3aaf-e811-a960-000d3ad24282/profile,SYDNEY HOPE CHURCH INCORPORATED,Unavailable,Unavailable,Registered,Small,36439670859,,,,,,,,140000.0,87568.0,Females; Males,21 Dec 2021,1.0
264,https://www.acnc.gov.au/charity/charities/a322206e-3aaf-e811-a960-000d3ad24282/profile,Australian Association of General Practitioners Ltd,Glynde,SA,Registered,Small,71058881431,,,,,,,,0.0,0.0,General community in Australia,12 Jun 2020,0.0
265,https://www.acnc.gov.au/charity/charities/de4de861-3aaf-e811-a960-000d3ad24282/profile,Hepburn Regional Community Cheer,Daylesford,VIC,Registered,Small,92400773302,,,,,,,https://hepburnregionalcommunitycheer.org.au/,82480.0,81501.0,Aboriginal and Torres Strait Islander people; Adults - aged 25 to under 65; Adults - aged 65 and over; Animals; Children - aged 6 to under 15; Early childhood - aged under 6; Environment; Families; Females; Financially disadvantaged people; General community in Australia; Males; Other charities; People at risk of homelessness/ people experiencing homelessness; People from a culturally and linguistically diverse background; People in rural/regional/remote communities; People with chronic illness (including terminal illness); People with disabilities; Pre/post release offenders and/or their families; Unemployed persons; Veterans and/or their families; Victims of crime (including family violence); Victims of disaster; Youth - 15 to under 25,15 Jun 2022,0.0
266,https://www.acnc.gov.au/charity/charities/35b42868-3aaf-e811-a960-000d3ad24282/profile,Port Stephens Women's Cancer Support Group Incorporated,Anna Bay,NSW,Registered,Small,34199832745,,,,,,,http://www.pswcsg.org.au/,405.0,4017.0,Females,26 Feb 2022,0.0
267,https://www.acnc.gov.au/charity/charities/ee67844f-3aaf-e811-a960-000d3ad24282/profile,Centre for Ecological Learning Incorporated,Hydes Creek,NSW,Registered,Small,37164705030,,,,,,,http://www.cel.org.au/,43232.0,49212.0,Adults - aged 25 to under 65; Animals; Early childhood - aged under 6; Environment; People in rural/regional/remote communities,6 Feb 2022,0.0
268,https://www.acnc.gov.au/charity/charities/bbb82868-3aaf-e811-a960-000d3ad24282/profile,Motivational Media Ltd,Unavailable,Unavailable,Registered,Small,72609590721,,,,,,,https://www.motivationalmedia.org.au/,0.0,0.0,"Aboriginal and Torres Strait Islander people; Females; Financially disadvantaged people; Gay, lesbian, bisexual, transgender or intersex persons; General community in Australia; Males; Migrants, refugees or asylum seekers; People at risk of homelessness/ people experiencing homelessness; People from a culturally and linguistically diverse background; People in rural/regional/remote communities; People with chronic illness (including terminal illness); People with disabilities; Pre/post release offenders and/or their families; Unemployed persons; Victims of crime (including family violence); Victims of disaster; Youth - 15 to under 25",28 Jul 2021,1.0
269,https://www.acnc.gov.au/charity/charities/71ba2868-3aaf-e811-a960-000d3ad24282/profile,NSW Council for Pacific Communities Inc,Minto,NSW,Registered,Small,65655017110,,,,,,,https://www.nswcpc.org.au/,65292.0,76127.0,Adults - aged 25 to under 65; Adults - aged 65 and over; Females; General community in Australia; Males; People from a culturally and linguistically diverse background; Youth - 15 to under 25,4 Dec 2021,0.0
270,https://www.acnc.gov.au/charity/charities/93b12868-3aaf-e811-a960-000d3ad24282/profile,Riding for the Disabled Association of WA Midwest Group Inc,Spalding,WA,Registered,Small,91154611743,,,,,,,https://www.horsepower.org.au/HorsePower_Australia-Home.htm,19473.0,16400.0,People with disabilities,17 Sep 2021,0.0
271,https://www.acnc.gov.au/charity/charities/b20ec176-3aaf-e811-a960-000d3ad24282/profile,Lions Gate Ministries Ltd,Brinsmead,QLD,Registered,Small,85165782043,,,,,,,https://www.facebook.com/lionsgateau,24656.0,25403.0,Aboriginal and Torres Strait Islander people; Adults - aged 25 to under 65; Females; General community in Australia; Males; Overseas communities or charities; People from a culturally and linguistically diverse background; People in rural/regional/remote communities,16 Dec 2021,0.0
272,https://www.acnc.gov.au/charity/charities/d80fc176-3aaf-e811-a960-000d3ad24282/profile,Healthy Workplaces Limited,Milton,QLD,Registered,Small,56611087944,,,,,,,https://healthyworkplaces.org.au/,144502.0,125070.0,Adults - aged 25 to under 65; Females; Males; Youth - 15 to under 25,29 Jun 2022,0.0
273,https://www.acnc.gov.au/charity/charities/71b62868-3aaf-e811-a960-000d3ad24282/profile,Turtle Cove Wildlife Sanctuary Inc,Llandilo,NSW,Registered,Small,69343500485,,,,,,,http://www.facebook.com/groups/turtlecovereptilesanctuary/,200.0,0.0,General community in Australia,25 Jan 2018,0.0
274,https://www.acnc.gov.au/charity/charities/18ad2868-3aaf-e811-a960-000d3ad24282/profile,Saints Peter and Paul's Parents and Friends Association,Balmoral,QLD,Registered,Small,63652701456,,,,,,,http://www.stspp.qld.edu.au/Our%20Community/Parents%20and%20Friends/Pages/default.aspx,139415.0,152574.0,Children - aged 6 to under 15,12 Jun 2022,0.0
275,https://www.acnc.gov.au/charity/charities/bb15c176-3aaf-e811-a960-000d3ad24282/profile,Matchstick Theatre Limited,Unavailable,Unavailable,Registered,Small,78610917943,,,,,,,http://www.matchsticktheatre.com.au/,0.0,254.0,,20 Jan 2022,0.0
276,https://www.acnc.gov.au/charity/charities/a40bc176-3aaf-e811-a960-000d3ad24282/profile,The Southwest Institute of TAFE Foundation,Unavailable,Unavailable,Registered,Small,52960554958,,,,,,,http://www.swtafe.vic.edu.au/home/,0.0,0.0,,28 Oct 2021,0.0
277,https://www.acnc.gov.au/charity/charities/8a0bc176-3aaf-e811-a960-000d3ad24282/profile,Leongatha District Community Foundation Ltd,Leongatha,VIC,Registered,Small,69609832082,,,,,,,,22019.0,29859.0,People in rural/regional/remote communities; Youth - 15 to under 25,1 Dec 2020,0.0
278,https://www.acnc.gov.au/charity/charities/010bc176-3aaf-e811-a960-000d3ad24282/profile,Narrabri High School Parents and Citizens Association,Narrabri,NSW,Registered,Small,96696235184,,,,,,,,0.0,0.0,Children - aged 6 to under 15; Youth - 15 to under 25,12 Jul 2022,0.0
279,https://www.acnc.gov.au/charity/charities/aeb32868-3aaf-e811-a960-000d3ad24282/profile,NeuroDiversity Connect Ltd,Katoomba,NSW,Registered,Small,45606460306,,,,,,,http://neurodiversityconnect.org.au/,506.0,506.0,People with disabilities,18 Nov 2020,0.0
280,https://www.acnc.gov.au/charity/charities/e3ba2868-3aaf-e811-a960-000d3ad24282/profile,Light of Life Chapel Inc.,Aubin Grove,WA,Registered,Small,65634308908,,,,,,,,6000.0,3500.0,Aboriginal and Torres Strait Islander people; Adults - aged 25 to under 65; Adults - aged 65 and over; Children - aged 6 to under 15; Families; Females; Males; People at risk of homelessness/ people experiencing homelessness; Unemployed persons; Youth - 15 to under 25,31 Jan 2022,0.0
281,https://www.acnc.gov.au/charity/charities/9abc2868-3aaf-e811-a960-000d3ad24282/profile,Janaranjani,Oatley,NSW,Registered,Small,80353887721,,,,,,,http://www.janaranjani.com.au/,2716.0,5865.0,Adults - aged 25 to under 65; Adults - aged 65 and over; Families; Females; Financially disadvantaged people; General community in Australia; Males; People from a culturally and linguistically diverse background; Unemployed persons; Youth - 15 to under 25,2 Feb 2022,0.0
282,https://www.acnc.gov.au/charity/charities/f629206e-3aaf-e811-a960-000d3ad24282/profile,The Ecclesia of Saint Matthew,Unavailable,Unavailable,Registered,Small,56619453565,,,,,,,,0.0,0.0,Adults - aged 25 to under 65; Families; Financially disadvantaged people,3 Sep 2021,1.0
283,https://www.acnc.gov.au/charity/charities/13bd2868-3aaf-e811-a960-000d3ad24282/profile,Asia Aid Ltd,Camperdown,NSW,Registered,Small,77607186210,,,,,,,http://www.youraid.org.au/,249900.0,722553.0,Families,3 May 2022,1.0
284,https://www.acnc.gov.au/charity/charities/f923206e-3aaf-e811-a960-000d3ad24282/profile,Single Mums Mission,Margate,QLD,Registered,Small,34332956952,,,,,,,,2850.0,2850.0,Females,28 Jan 2022,0.0
285,https://www.acnc.gov.au/charity/charities/a3727883-3aaf-e811-a960-000d3ad24282/profile,Mount Hunter Public School Parents & Citizens Association,Unavailable,Unavailable,Registered,Small,20703213522,,,,,,,,6010.0,0.0,Children - aged 6 to under 15,7 Feb 2021,0.0
286,https://www.acnc.gov.au/charity/charities/41f66e89-3aaf-e811-a960-000d3ad24282/profile,The School Food Project Ltd.,Queens Park,NSW,Registered,Small,48610681224,,,,,,,http://www.schoolfoodproject.org.au/,57900.0,70818.0,Children - aged 6 to under 15; Early childhood - aged under 6; General community in Australia; People with chronic illness (including terminal illness),25 Jan 2022,0.0
287,https://www.acnc.gov.au/charity/charities/392b206e-3aaf-e811-a960-000d3ad24282/profile,MACQUARIE UNIVERSITY CLINICAL ASSOCIATES LTD,Macquarie University,NSW,Registered,Small,56606405270,,,,,,,,0.0,0.0,,10 Jun 2022,0.0
288,https://www.acnc.gov.au/charity/charities/5ea92868-3aaf-e811-a960-000d3ad24282/profile,The Catholic Foundation Hardship Relief Fund,Brisbane City,QLD,Registered,Small,35785028390,,,,,,,,62.0,804.0,Adults - aged 25 to under 65; Adults - aged 65 and over; Children - aged 6 to under 15; Early childhood - aged under 6; Families; Youth - 15 to under 25,29 Jun 2022,1.0
289,https://www.acnc.gov.au/charity/charities/de6c7883-3aaf-e811-a960-000d3ad24282/profile,Saffron Aid Pty Ltd,Epping,NSW,Registered,Small,27614171425,,,,,,,http://www.saffronaid.com/,1790.0,2190.0,Children - aged 6 to under 15; Early childhood - aged under 6; Environment; Families; Females; Financially disadvantaged people; Males; Overseas communities or charities; People in rural/regional/remote communities; People with disabilities; Unemployed persons,9 Dec 2021,0.0
290,https://www.acnc.gov.au/charity/charities/aa647883-3aaf-e811-a960-000d3ad24282/profile,Lakeside Church Canberra,Manuka,ACT,Registered,Small,50534676427,,,,,,,http://www.lakesidechristianchurch.com.au/,170166.0,117611.0,Adults - aged 25 to under 65; Adults - aged 65 and over; Children - aged 6 to under 15; Early childhood - aged under 6; Families; Females; Males; Youth - 15 to under 25,9 Sep 2021,1.0
