,Index_Link,Legal_Name,Town/Suburb,State,Status,Size,ABN,Website,Revenue,Expenses,Cause/s,Last_report_date,ref_religion,website,revenue,expenses,causes,lastreport,religious_ref
1116,https://www.acnc.gov.au/charity/charities/9f8bca4e-3aaf-e811-a963-000d3ad244fd/profile,National Institute for Challenging Homophobia Education Ltd,South Yarra,VIC,Registered,Small,44601209929,,,,,,,http://www.niche.org.au/,95652.0,42136.0,Adults - aged 25 to under 65; Adults - aged 65 and over; Families; Females; Financially disadvantaged people; Males; People at risk of homelessness/ people experiencing homelessness; People in rural/regional/remote communities; People with chronic illness (including terminal illness); People with disabilities; Youth - 15 to under 25,30 Jan 2022,0.0
1117,https://www.acnc.gov.au/charity/charities/798aca4e-3aaf-e811-a963-000d3ad244fd/profile,UCA Longford Perth Cressy,Longford,TAS,Registered,Small,52079795993,,,,,,,http://www.victas.uca.org.au/,0.0,0.0,Adults - aged 25 to under 65; Adults - aged 65 and over; Children - aged 6 to under 15; Early childhood - aged under 6; Families; Youth - 15 to under 25,24 Jun 2022,1.0
1118,https://www.acnc.gov.au/charity/charities/eabdcc48-3aaf-e811-a963-000d3ad244fd/profile,ON TRACK FOUNDATION INC,Bakery Hill,VIC,Registered,Small,55150807945,,,,,,,http://ontrackfoundation.org.au/,141384.0,52925.0,Children - aged 6 to under 15; Financially disadvantaged people; People at risk of homelessness/ people experiencing homelessness; Youth - 15 to under 25,14 Sep 2021,0.0
1119,https://www.acnc.gov.au/charity/charities/fa075a3b-3aaf-e811-a963-000d3ad244fd/profile,BROADWAY PARISH CATHOLIC CHARITIES TRUST,Chippendale,NSW,Registered,Small,82032320467,,,,,,,http://www.stbenedicts.org.au/,17188.0,8800.0,Other charities,20 Apr 2020,1.0
1120,https://www.acnc.gov.au/charity/charities/aa8bca4e-3aaf-e811-a963-000d3ad244fd/profile,Albert Park-Semaphore Lutheran Parish,Albert Park,SA,Registered,Small,25962124709,,,,,,,,115046.0,88362.0,Adults - aged 65 and over; Families; People in rural/regional/remote communities; People with disabilities,22 Aug 2022,1.0
1121,https://www.acnc.gov.au/charity/charities/69b4cc48-3aaf-e811-a963-000d3ad244fd/profile,Advocacy for Oromia Association in Victoria Australia Inc,Melbourne,VIC,Registered,Small,71291421604,,,,,,,https://advocacy4oromia.org/,8300.0,7216.0,Adults - aged 25 to under 65; Families,15 May 2022,0.0
1122,https://www.acnc.gov.au/charity/charities/a496ca4e-3aaf-e811-a963-000d3ad244fd/profile,Apostolic Faith Mission New South Wales Inccorporated,Prestons,NSW,Registered,Small,42301049441,,,,,,,http://www.afmnsw.org/,116743.0,48634.0,Families; Females; General community in Australia; Males; People from a culturally and linguistically diverse background,1 Feb 2022,1.0
1123,https://www.acnc.gov.au/charity/charities/eabccc48-3aaf-e811-a963-000d3ad244fd/profile,Cri du Chat Support Group Limited as the Operator of a PBI,Heidelberg,VIC,Registered,Small,56841370405,,,,,,,http://www.criduchat.org.au/,24722.0,28812.0,Adults - aged 25 to under 65; Adults - aged 65 and over; Children - aged 6 to under 15; Early childhood - aged under 6; Families; People with disabilities; Youth - 15 to under 25,18 Jan 2022,0.0
1124,https://www.acnc.gov.au/charity/charities/988dca4e-3aaf-e811-a963-000d3ad244fd/profile,National Apology Foundation Ltd,Brisbane City,QLD,Registered,Small,99601082553,,,,,,,http://www.nationalapology.org.au/,623.0,4112.0,Aboriginal and Torres Strait Islander people; General community in Australia; People in rural/regional/remote communities; Youth - 15 to under 25,13 Jan 2022,0.0
1125,https://www.acnc.gov.au/charity/charities/a4c1cc48-3aaf-e811-a963-000d3ad244fd/profile,Shabbat Project Melbourne Limited,Prahran,VIC,Registered,Small,21601530527,,,,,,,,0.0,407.0,People from a culturally and linguistically diverse background,13 Jan 2022,1.0
1126,https://www.acnc.gov.au/charity/charities/a88cca4e-3aaf-e811-a963-000d3ad244fd/profile,Queensland Debating Union Incorporated,Milton,QLD,Registered,Small,26604178100,,,,,,,http://www.qdu.org.au/,228348.0,222287.0,Aboriginal and Torres Strait Islander people; Females; Males; People from a culturally and linguistically diverse background; Youth - 15 to under 25,26 Apr 2022,0.0
1127,https://www.acnc.gov.au/charity/charities/ae97ca4e-3aaf-e811-a963-000d3ad244fd/profile,Growing Change Australia Ltd,North Fremantle,WA,Registered,Small,97602988198,,,,,,,https://www.northfreosocialfarm.org/,31936.0,42003.0,Adults - aged 25 to under 65; Adults - aged 65 and over; Children - aged 6 to under 15; Families; Youth - 15 to under 25,18 May 2021,0.0
1128,https://www.acnc.gov.au/charity/charities/0593ca4e-3aaf-e811-a963-000d3ad244fd/profile,DYING AT HOME (AUS) LTD,Bundeena,NSW,Registered,Small,30602655738,,,,,,,http://www.dyingathome.org/,1000.0,2623.0,Families,19 Jan 2022,0.0
1129,https://www.acnc.gov.au/charity/charities/2a2dc254-3aaf-e811-a963-000d3ad244fd/profile,Blue Sky Pilbara Inc,Newman,WA,Registered,Small,14279047598,,,,,,,,43099.0,31756.0,Aboriginal and Torres Strait Islander people; Adults - aged 25 to under 65; Adults - aged 65 and over; Children - aged 6 to under 15; Early childhood - aged under 6; Families; Females; Financially disadvantaged people; Males; People from a culturally and linguistically diverse background; People in rural/regional/remote communities; People with chronic illness (including terminal illness); People with disabilities; Pre/post release offenders and/or their families; Unemployed persons; Youth - 15 to under 25,25 Jan 2022,1.0
1130,https://www.acnc.gov.au/charity/charities/dc32c254-3aaf-e811-a963-000d3ad244fd/profile,Friends of Oxfam Australia (Western Australia) Inc,Bayswater,WA,Registered,Small,95918191617,,,,,,,,13403.0,10724.0,General community in Australia; Other charities,22 Dec 2021,0.0
1131,https://www.acnc.gov.au/charity/charities/483e1f5b-3aaf-e811-a963-000d3ad244fd/profile,Diggers Rest @ Quails Ridge Pty Ltd,Beerwah,QLD,Registered,Small,12602293587,,,,,,,http://diggersrest.org.au/,200574.0,171046.0,General community in Australia,31 Jan 2022,0.0
1132,https://www.acnc.gov.au/charity/charities/1596ca4e-3aaf-e811-a963-000d3ad244fd/profile,Full Circle Projects Inc,Coorparoo,QLD,Registered,Small,66839486131,,,,,,,https://www.fcpinc.org/,172599.0,160118.0,"Aboriginal and Torres Strait Islander people; Adults - aged 25 to under 65; Adults - aged 65 and over; Families; Females; Financially disadvantaged people; Gay, lesbian, bisexual, transgender or intersex persons; General community in Australia; Males; Other charities; People at risk of homelessness/ people experiencing homelessness; People from a culturally and linguistically diverse background; People in rural/regional/remote communities; People with disabilities; Pre/post release offenders and/or their families; Unemployed persons; Veterans and/or their families; Youth - 15 to under 25",26 Jan 2022,0.0
1133,https://www.acnc.gov.au/charity/charities/4e89ca4e-3aaf-e811-a963-000d3ad244fd/profile,Enlighten Health Limited,Richmond,VIC,Registered,Small,62601431001,,,,,,,,50.0,1997.0,General community in Australia,10 Jan 2021,0.0
1134,https://www.acnc.gov.au/charity/charities/fc8dca4e-3aaf-e811-a963-000d3ad244fd/profile,U3A Bentleigh Incorporated,Bentleigh East,VIC,Registered,Small,74809458985,,,,,,,http://u3abentleigh.org.au/,16183.0,30874.0,"Aboriginal and Torres Strait Islander people; Adults - aged 25 to under 65; Adults - aged 65 and over; Females; Financially disadvantaged people; Gay, lesbian, bisexual, transgender or intersex persons; General community in Australia; Males; Migrants, refugees or asylum seekers; People from a culturally and linguistically diverse background; People with disabilities; Unemployed persons",30 Nov 2021,0.0
1135,https://www.acnc.gov.au/charity/charities/5f8eca4e-3aaf-e811-a963-000d3ad244fd/profile,South Sudan Child First Education (SSCFE) Incorporated,Unavailable,Unavailable,Registered,Small,50454424905,,,,,,,http://www.southsudanchildfe.org/,12000.0,19500.0,Adults - aged 25 to under 65; Adults - aged 65 and over; Children - aged 6 to under 15; Early childhood - aged under 6; Families; Females; Financially disadvantaged people; General community in Australia; Males; Overseas communities or charities; People at risk of homelessness/ people experiencing homelessness; People from a culturally and linguistically diverse background; People in rural/regional/remote communities; People with chronic illness (including terminal illness); People with disabilities; Victims of crime (including family violence); Victims of disaster; Youth - 15 to under 25,15 Dec 2021,0.0
1136,https://www.acnc.gov.au/charity/charities/a4b84d61-3aaf-e811-a963-000d3ad244fd/profile,BartMeph Foundation Limited,Oran Park,NSW,Registered,Small,83605466671,,,,,,,http://www.bartmephfoundation.org/,120.0,70.0,"Aboriginal and Torres Strait Islander people; Adults - aged 25 to under 65; Adults - aged 65 and over; Children - aged 6 to under 15; Early childhood - aged under 6; Families; Financially disadvantaged people; Gay, lesbian, bisexual, transgender or intersex persons; General community in Australia; Migrants, refugees or asylum seekers; Overseas communities or charities; People from a culturally and linguistically diverse background; People in rural/regional/remote communities; People with disabilities; Youth - 15 to under 25",29 Jan 2022,0.0
1137,https://www.acnc.gov.au/charity/charities/48371f5b-3aaf-e811-a963-000d3ad244fd/profile,Smiley Face Monthly Awareness Group,Hampton Park,VIC,Registered,Small,28426738239,,,,,,,,0.0,0.0,,27 Nov 2020,0.0
1138,https://www.acnc.gov.au/charity/charities/72381f5b-3aaf-e811-a963-000d3ad244fd/profile,Access T Foundation Ltd,Mount Martha,VIC,Registered,Small,91604875407,,,,,,,,145072.0,198.0,Aboriginal and Torres Strait Islander people; Adults - aged 25 to under 65; Adults - aged 65 and over; Children - aged 6 to under 15; Families; Financially disadvantaged people; People at risk of homelessness/ people experiencing homelessness; People from a culturally and linguistically diverse background; People in rural/regional/remote communities; People with disabilities; Unemployed persons; Victims of crime (including family violence); Youth - 15 to under 25,1 Feb 2022,1.0
1139,https://www.acnc.gov.au/charity/charities/5233c254-3aaf-e811-a963-000d3ad244fd/profile,Symphony of the Earth Inc.,Bootawa,NSW,Registered,Small,98748413276,,,,,,,http://www.symphonyoftheearth.org/,350.0,13397.0,Adults - aged 25 to under 65; Adults - aged 65 and over; Animals; Children - aged 6 to under 15; Early childhood - aged under 6; Environment; Families; Females; Males; Overseas communities or charities; Youth - 15 to under 25,14 Jan 2022,0.0
1140,https://www.acnc.gov.au/charity/charities/f52fc254-3aaf-e811-a963-000d3ad244fd/profile,Cindy's Promise - Rescue & Rehab inc.,Whittlesea,VIC,Registered,Small,54514602069,,,,,,,http://www.cindyspromise.org/,98388.0,80671.0,Adults - aged 25 to under 65; Adults - aged 65 and over; Animals; Children - aged 6 to under 15; Families; Youth - 15 to under 25,21 Jan 2022,0.0
1141,https://www.acnc.gov.au/charity/charities/40371f5b-3aaf-e811-a963-000d3ad244fd/profile,Craig Perkins Cancer Research Foundation Limited,Unavailable,Unavailable,Registered,Small,42466329077,,,,,,,,14644.0,1447.0,General community in Australia,26 Feb 2020,0.0
1142,https://www.acnc.gov.au/charity/charities/4835c254-3aaf-e811-a963-000d3ad244fd/profile,Australian Society for Kangaroos Inc.,Castlemaine,VIC,Registered,Small,25170042319,,,,,,,http://www.australiansocietyforkangaroos.org/,2500.0,2815.0,Animals; Environment,28 Jan 2022,0.0
1143,https://www.acnc.gov.au/charity/charities/6a3c1f5b-3aaf-e811-a963-000d3ad244fd/profile,Maroondah Community Assist Inc,Croydon,VIC,Registered,Small,14948239181,,,,,,,http://www.maroondahcommunityassist.org.au/,147083.0,147549.0,Adults - aged 25 to under 65; Adults - aged 65 and over; Families; Females; Financially disadvantaged people; Males; People at risk of homelessness/ people experiencing homelessness; People from a culturally and linguistically diverse background; People with disabilities; Unemployed persons,14 Dec 2021,0.0
1144,https://www.acnc.gov.au/charity/charities/e788ca4e-3aaf-e811-a963-000d3ad244fd/profile,FAMILY CHURCH MINISTRIES AS THE OPERATOR OF A PBI,Camden Park,SA,Registered,Small,32672016226,,,,,,,http://www.libertylife.com.au/,300.0,191.0,Families,24 Jun 2022,1.0
1145,https://www.acnc.gov.au/charity/charities/3993ca4e-3aaf-e811-a963-000d3ad244fd/profile,Mettamorphosis Inc,Unavailable,Unavailable,Registered,Small,50165998247,,,,,,,http://www.mettamorphosis.org.au/,2689.0,3130.0,"Aboriginal and Torres Strait Islander people; Children - aged 6 to under 15; Early childhood - aged under 6; Families; Gay, lesbian, bisexual, transgender or intersex persons; General community in Australia; Migrants, refugees or asylum seekers; People from a culturally and linguistically diverse background; People in rural/regional/remote communities; Youth - 15 to under 25",10 Dec 2021,0.0
1146,https://www.acnc.gov.au/charity/charities/ddb64d61-3aaf-e811-a963-000d3ad244fd/profile,The South West Institute of TAFE Foundation Limited,Warrnambool,VIC,Registered,Small,44151922753,,,,,,,http://www.swtafe.edu.au/,2609.0,2250.0,General community in Australia; Youth - 15 to under 25,28 Oct 2021,0.0
1147,https://www.acnc.gov.au/charity/charities/f63a1f5b-3aaf-e811-a963-000d3ad244fd/profile,Cowboy 4 Kids Incorporated,Yarramalong,NSW,Registered,Small,40693760421,,,,,,,https://cowboys4kids.com.au/,25000.0,8250.0,Aboriginal and Torres Strait Islander people; Adults - aged 25 to under 65; Adults - aged 65 and over; Children - aged 6 to under 15; Early childhood - aged under 6; Families; Females; Financially disadvantaged people; General community in Australia; Males; Other charities; People at risk of homelessness/ people experiencing homelessness; People with disabilities; Unemployed persons; Veterans and/or their families; Youth - 15 to under 25,31 Jan 2022,0.0
1148,https://www.acnc.gov.au/charity/charities/7a30c254-3aaf-e811-a963-000d3ad244fd/profile,Muslim Aid Limited,Yagoona,NSW,Registered,Small,12602417890,,,,,,,https://www.maainternational.org.au/,773.0,11450.0,Families; Females; Males,16 Nov 2021,1.0
1149,https://www.acnc.gov.au/charity/charities/b4401f5b-3aaf-e811-a963-000d3ad244fd/profile,Dennis Orton Foundation,Unavailable,Unavailable,Registered,Small,31263284896,,,,,,,,101001.0,250.0,General community in Australia,1 Sep 2021,0.0
1150,https://www.acnc.gov.au/charity/charities/2dbd4d61-3aaf-e811-a963-000d3ad244fd/profile,The Forsyths Foundation,Unavailable,Unavailable,Registered,Small,43449648282,,,,,,,,12920.0,15000.0,Adults - aged 65 and over; Children - aged 6 to under 15; Early childhood - aged under 6; Families; Financially disadvantaged people; General community in Australia; People at risk of homelessness/ people experiencing homelessness; People in rural/regional/remote communities; People with chronic illness (including terminal illness); People with disabilities; Victims of crime (including family violence); Youth - 15 to under 25,13 Sep 2021,0.0
1151,https://www.acnc.gov.au/charity/charities/8f391f5b-3aaf-e811-a963-000d3ad244fd/profile,Dunera Association Inc,Bruce,ACT,Registered,Small,11486239980,,,,,,,http://www.duneraassociation.com/,11582.0,3004.0,Females; General community in Australia; Males; People from a culturally and linguistically diverse background; Youth - 15 to under 25,4 Jan 2022,0.0
1152,https://www.acnc.gov.au/charity/charities/ca024a67-3aaf-e811-a963-000d3ad244fd/profile,ADELAIDE MEDICAL STUDENTS' SCHOLARSHIP & BURSARY FUND,Parkside,SA,Registered,Small,18289559462,,,,,,,https://www.amsf.org.au/,2872.0,1124.0,Youth - 15 to under 25,4 Feb 2022,0.0
1153,https://www.acnc.gov.au/charity/charities/c8bf4d61-3aaf-e811-a963-000d3ad244fd/profile,The Iva Harris Necessitous Circumstances Fund Trust,Unavailable,Unavailable,Registered,Small,88294257765,,,,,,,,0.0,0.0,,20 Apr 2022,0.0
1154,https://www.acnc.gov.au/charity/charities/fb2fc254-3aaf-e811-a963-000d3ad244fd/profile,Transitions Film Festival Limited,Melbourne,VIC,Registered,Small,78601384605,,,,,,,https://www.transitionsfilmfestival.com/,24351.0,23992.0,General community in Australia,3 Feb 2022,0.0
1155,https://www.acnc.gov.au/charity/charities/5ab74d61-3aaf-e811-a963-000d3ad244fd/profile,Teter Mek Foundation,Sydney,NSW,Registered,Small,92212998798,,,,,,,http://tetermekfoundation.org/,3250.0,10791.0,Aboriginal and Torres Strait Islander people; Children - aged 6 to under 15; Early childhood - aged under 6; General community in Australia,27 Jan 2022,0.0
1156,https://www.acnc.gov.au/charity/charities/673f1f5b-3aaf-e811-a963-000d3ad244fd/profile,Brisbane Bible-Presbyterian Church Inc,Unavailable,Unavailable,Registered,Small,93526539619,,,,,,,http://www.brisbanebpc.org.au/brisbanebpc_.html,73545.0,48764.0,Adults - aged 25 to under 65; Adults - aged 65 and over; Children - aged 6 to under 15; Early childhood - aged under 6; Families; Youth - 15 to under 25,12 Sep 2021,1.0
1157,https://www.acnc.gov.au/charity/charities/1dc3cc48-3aaf-e811-a963-000d3ad244fd/profile,Abrolhos Group Incorporated,Geraldton,WA,Registered,Small,48370717714,,,,,,,https://abrolhosgroup.org.au/,54644.0,41287.0,Aboriginal and Torres Strait Islander people; Children - aged 6 to under 15; Early childhood - aged under 6; Financially disadvantaged people; People in rural/regional/remote communities; Youth - 15 to under 25,6 Mar 2022,0.0
1158,https://www.acnc.gov.au/charity/charities/a0c34d61-3aaf-e811-a963-000d3ad244fd/profile,Aussie Books For Zim,Wollongong,NSW,Registered,Small,13462778021,,,,,,,https://aussiebooks4zim.org/,16617.0,43541.0,Children - aged 6 to under 15; Early childhood - aged under 6; Families; Females; Financially disadvantaged people; Males; Overseas communities or charities; People from a culturally and linguistically diverse background; People in rural/regional/remote communities,3 May 2022,0.0
1159,https://www.acnc.gov.au/charity/charities/4ec04d61-3aaf-e811-a963-000d3ad244fd/profile,UCA - Macksville Uniting Church,Macksville,NSW,Registered,Small,12876512894,,,,,,,,44813.0,45856.0,Aboriginal and Torres Strait Islander people; Families; Females; Financially disadvantaged people; Males; Overseas communities or charities; People in rural/regional/remote communities; Unemployed persons,7 Jan 2022,1.0
1160,https://www.acnc.gov.au/charity/charities/44084a67-3aaf-e811-a963-000d3ad244fd/profile,The Ernie Deomampo Charitable Trust,Kensington,NSW,Registered,Small,68549581766,,,,,,,http://www.reliefbrigade.org/,5.0,0.0,Financially disadvantaged people; Overseas communities or charities; Youth - 15 to under 25,21 Feb 2022,0.0
1161,https://www.acnc.gov.au/charity/charities/95c24d61-3aaf-e811-a963-000d3ad244fd/profile,United Youth Church,Carlingford,NSW,Registered,Small,78305652778,,,,,,,,41840.0,40540.0,General community in Australia,31 Jan 2022,1.0
1162,https://www.acnc.gov.au/charity/charities/58c04d61-3aaf-e811-a963-000d3ad244fd/profile,Harvest Ministry of Food Incorporated,Ballarat Central,VIC,Registered,Small,78160116379,,,,,,,https://www.harvestfoodministry.org.au/,30.0,1284.0,Adults - aged 25 to under 65; Adults - aged 65 and over; Families; Females; Financially disadvantaged people; General community in Australia; Males; People at risk of homelessness/ people experiencing homelessness; People with disabilities; Unemployed persons; Youth - 15 to under 25,16 Feb 2022,1.0
1163,https://www.acnc.gov.au/charity/charities/b8be4d61-3aaf-e811-a963-000d3ad244fd/profile,Estate of Annie Elizabeth Lamont,Melbourne,VIC,Registered,Small,41669748736,,,,,,,,6336.0,6454.0,Adults - aged 25 to under 65; Females; Youth - 15 to under 25,31 Jan 2022,0.0
1164,https://www.acnc.gov.au/charity/charities/e9ba4d61-3aaf-e811-a963-000d3ad244fd/profile,Montagner-Zembrzuski Family Foundation,Blackburn,VIC,Registered,Small,14869953270,,,,,,,,76.0,42472.0,Children - aged 6 to under 15; Overseas communities or charities; People in rural/regional/remote communities,30 Nov 2021,0.0
1165,https://www.acnc.gov.au/charity/charities/dd326142-3aaf-e811-a963-000d3ad244fd/profile,Rural Sector Support Inc,Elong Elong,NSW,Registered,Small,50365392826,,,,,,,https://www.rssinc.com.au/,29173.0,38190.0,Adults - aged 25 to under 65; Adults - aged 65 and over; Families; Females; Financially disadvantaged people; Males; People in rural/regional/remote communities; Youth - 15 to under 25,30 Jan 2022,0.0
1166,https://www.acnc.gov.au/charity/charities/a5bd4d61-3aaf-e811-a963-000d3ad244fd/profile,Asbestosis & Mesothelioma Association of Australia Limited,Unavailable,Unavailable,Registered,Small,59602979000,,,,,,,http://www.asbestosassociation.com.au/,57514.0,60321.0,"Aboriginal and Torres Strait Islander people; Adults - aged 25 to under 65; Adults - aged 65 and over; Females; Financially disadvantaged people; Gay, lesbian, bisexual, transgender or intersex persons; Males; Migrants, refugees or asylum seekers; People from a culturally and linguistically diverse background; People in rural/regional/remote communities; People with chronic illness (including terminal illness); People with disabilities; Veterans and/or their families",3 Feb 2021,0.0
1167,https://www.acnc.gov.au/charity/charities/d735c254-3aaf-e811-a963-000d3ad244fd/profile,Dubbo Rescue Squad Inc,Dubbo,NSW,Registered,Small,64313765799,,,,,,,http://www.rescue.org.au/,12727.0,46158.0,General community in Australia,13 Nov 2021,0.0
1168,https://www.acnc.gov.au/charity/charities/95c34d61-3aaf-e811-a963-000d3ad244fd/profile,The Here for Good Foundation Incorporated,Adelaide,SA,Registered,Small,54772604161,,,,,,,http://www.hfgf.org.au/,250.0,0.0,Aboriginal and Torres Strait Islander people; Adults - aged 25 to under 65; Adults - aged 65 and over; Families; Females; Financially disadvantaged people; Males; People at risk of homelessness/ people experiencing homelessness; People from a culturally and linguistically diverse background; Unemployed persons; Victims of crime (including family violence),1 Mar 2022,0.0
1169,https://www.acnc.gov.au/charity/charities/a9034a67-3aaf-e811-a963-000d3ad244fd/profile,Waterfall Public School P & C Association,Waterfall,NSW,Registered,Small,83510874310,,,,,,,,3417.0,4806.0,Children - aged 6 to under 15,30 Jun 2022,0.0
1170,https://www.acnc.gov.au/charity/charities/2e35c254-3aaf-e811-a963-000d3ad244fd/profile,Synectics Consulting Limited,Unavailable,Unavailable,Registered,Small,62602735688,,,,,,,http://www.synecticsconsulting.com.au/,0.0,0.0,,23 Sep 2019,0.0
1171,https://www.acnc.gov.au/charity/charities/73c14d61-3aaf-e811-a963-000d3ad244fd/profile,International FoxG1 Foundation (Australia) Ltd,Glenwood,NSW,Registered,Small,90607182650,,,,,,,https://foxg1.org.au/,2535.0,2896.0,Adults - aged 25 to under 65; Adults - aged 65 and over; Children - aged 6 to under 15; Early childhood - aged under 6; Families; Females; General community in Australia; Males; People with chronic illness (including terminal illness); People with disabilities; Youth - 15 to under 25,30 Jan 2022,0.0
1172,https://www.acnc.gov.au/charity/charities/e4ba4d61-3aaf-e811-a963-000d3ad244fd/profile,Pentecostal Apostolic Faith Church Inc,Werribee,VIC,Registered,Small,36629023226,,,,,,,http://www.pentecostalfaithchurch.com.au/,22700.0,22123.0,Youth - 15 to under 25,31 Mar 2022,1.0
1173,https://www.acnc.gov.au/charity/charities/f23d1f5b-3aaf-e811-a963-000d3ad244fd/profile,Gafcon Australia Limited,Royal Exchange,NSW,Registered,Small,45604064315,,,,,,,http://www.gafconaustralia.org/,145734.0,72271.0,General community in Australia,20 Jun 2022,1.0
1174,https://www.acnc.gov.au/charity/charities/d336c254-3aaf-e811-a963-000d3ad244fd/profile,Tintern Communities Limited,Ringwood East,VIC,Registered,Small,56696430436,,,,,,,,66363.0,62233.0,Children - aged 6 to under 15; Early childhood - aged under 6; Youth - 15 to under 25,7 Jul 2022,0.0
1175,https://www.acnc.gov.au/charity/charities/740f4a67-3aaf-e811-a963-000d3ad244fd/profile,Disadvantaged and Orphans of Vietnam Education Sponsorship,Port Melbourne,VIC,Registered,Small,21524379712,,,,,,,http://www.doves.org.au/,11431.0,0.0,Children - aged 6 to under 15; Overseas communities or charities,29 Jan 2022,0.0
1176,https://www.acnc.gov.au/charity/charities/ea064a67-3aaf-e811-a963-000d3ad244fd/profile,Hand and Wrist Medical Research Foundation Ltd,Fitzroy,VIC,Registered,Small,16608001163,,,,,,,,69731.0,1771.0,General community in Australia,30 Jan 2022,0.0
1177,https://www.acnc.gov.au/charity/charities/fa054a67-3aaf-e811-a963-000d3ad244fd/profile,Acre Housing Co-operative Incorporated,Thebarton,SA,Registered,Small,90303795097,,,,,,,http://www.cehsa.com.au/,68650.0,73973.0,Adults - aged 25 to under 65; Adults - aged 65 and over; Financially disadvantaged people; Unemployed persons,24 Jan 2022,0.0
1178,https://www.acnc.gov.au/charity/charities/9b0d4a67-3aaf-e811-a963-000d3ad244fd/profile,MiTraining Limited,Milton,QLD,Registered,Small,98608053489,,,,,,,https://www.mitraining.edu.au/,148000.0,370000.0,General community in Australia,21 Jan 2022,0.0
1179,https://www.acnc.gov.au/charity/charities/64104a67-3aaf-e811-a963-000d3ad244fd/profile,Dua Kumayl Group,Unavailable,Unavailable,Registered,Small,93683641091,,,,,,,,0.0,0.0,General community in Australia,13 Jan 2022,1.0
1180,https://www.acnc.gov.au/charity/charities/34b84d61-3aaf-e811-a963-000d3ad244fd/profile,Gippsland Road Runners Inc,Unavailable,Unavailable,Registered,Small,35790814657,,,,,,,https://business.facebook.com/latest/inbox/all?nav_ref=pages_classic_isolated_section_inbox_redirect&asset_id=627739973944568&mailbox_id=&selected_item_id=100003169278452,19228.0,17581.0,Females,31 Jan 2022,0.0
