,Index_Link,Legal_Name,Town/Suburb,State,Status,Size,ABN,Website,Revenue,Expenses,Cause/s,Last_report_date,ref_religion,website,revenue,expenses,causes,lastreport,religious_ref
15197,https://www.acnc.gov.au/charity/charities/bb07ee1b-8883-ea11-a812-000d3ad1f29c/profile,Brisbane South Hindi Congregation of Jehovah's Witnesses,Upper Mount Gravatt,QLD,Registered,Small,90136318077,,,,,,,,0.0,0.0,General community in Australia,29 Oct 2022,1.0
15198,https://www.acnc.gov.au/charity/charities/d66c7883-3aaf-e811-a960-000d3ad24282/profile,Brimbank Presbyterian Church,Unavailable,Unavailable,Registered,Small,59134782934,,,,,,,http://www.brimbank.church/,0.0,0.0,Adults - aged 25 to under 65; Adults - aged 65 and over; Children - aged 6 to under 15; Early childhood - aged under 6; Families; General community in Australia; People from a culturally and linguistically diverse background; Youth - 15 to under 25,29 Oct 2022,1.0
15199,https://www.acnc.gov.au/charity/charities/3dfb1e82-5ceb-eb11-bacc-000d3acc5d05/profile,Healthy Rivers Dubbo,Dubbo,NSW,Registered,Small,11988241202,,,,,,,http://www.healthyriversdubbo.com/,6813.0,4075.0,Aboriginal and Torres Strait Islander people; Animals; Environment; Families; General community in Australia; Other charities; People from a culturally and linguistically diverse background; People in rural/regional/remote communities,30 Oct 2022,0.0
15200,https://www.acnc.gov.au/charity/charities/3f19b092-39af-e811-a963-000d3ad24077/profile,Friends Of Orbost Op Shops,Orbost,VIC,Registered,Small,97291905884,,,,,,,,79989.0,28474.0,Families; General community in Australia; People in rural/regional/remote communities,30 Oct 2022,0.0
15201,https://www.acnc.gov.au/charity/charities/3a72ff46-39af-e811-a961-000d3ad24182/profile,Meander Valley Connect Inc,Deloraine,TAS,Registered,Small,89090614412,,,,,,,,209002.0,62000.0,Adults - aged 25 to under 65; Adults - aged 65 and over; Other; Youth - 15 to under 25,3 Nov 2022,0.0
15202,https://www.acnc.gov.au/charity/charities/6c6c1197-17b5-ea11-a812-000d3ad1fbf8/profile,AUSTRALIAN NATIONAL ASSOCIATION OF TEACHERS OF SINGING LIMITED,Red Hill,QLD,Registered,Small,26164514943,,,,,,,http://anats.org.au/,81659.0,66431.0,"Adults - aged 25 to under 65; Adults - aged 65 and over; Females; Financially disadvantaged people; Gay, lesbian, bisexual, transgender or intersex persons; Males; People from a culturally and linguistically diverse background; People in rural/regional/remote communities; Youth - 15 to under 25",27 Jan 2022,0.0
15203,https://www.acnc.gov.au/charity/charities/54fb05f4-39af-e811-a960-000d3ad24282/profile,Be Kids (Australia) Inc.,Bicton,WA,Registered,Small,27586226733,,,,,,,http://www.bekids.org/,9406.0,37943.0,Youth - 15 to under 25,30 Oct 2022,0.0
15204,https://www.acnc.gov.au/charity/charities/7ab3c3a1-38af-e811-a961-000d3ad24182/profile,Long Plains Soldiers Memorial Hall Incorporated,Unavailable,Unavailable,Registered,Small,22166431579,,,,,,,,5462.0,2238.0,Adults - aged 25 to under 65; Adults - aged 65 and over; Children - aged 6 to under 15; Early childhood - aged under 6; Families; Females; Financially disadvantaged people; Males; People with disabilities; Youth - 15 to under 25,30 Oct 2022,0.0
15205,https://www.acnc.gov.au/charity/charities/3b69aea1-38af-e811-a963-000d3ad24077/profile,Queenscliff And District Neighbourhood House Inc.,Queenscliff,VIC,Registered,Small,65700715581,,,,,,,http://www.qnhouse.com.au/,202940.0,206055.0,Adults - aged 25 to under 65; Adults - aged 65 and over; Financially disadvantaged people; General community in Australia; Males; People in rural/regional/remote communities; People with disabilities; Veterans and/or their families,2 May 2022,0.0
15206,https://www.acnc.gov.au/charity/charities/128fc3d4-39af-e811-a960-000d3ad24282/profile,Uca - St Andrews Bacchus Marsh,Bacchus Marsh,VIC,Registered,Small,19647219972,,,,,,,http://bmuc.com.au/,0.0,0.0,Adults - aged 25 to under 65; Adults - aged 65 and over; Children - aged 6 to under 15; Early childhood - aged under 6; Families; Youth - 15 to under 25,18 Jun 2022,1.0
15207,https://www.acnc.gov.au/charity/charities/065591a6-3aaf-e811-a963-000d3ad24077/profile,Pacific Dermatology Ltd,Mosman,NSW,Registered,Small,35618084209,,,,,,,https://pacificdermatology.org.au/,107267.0,79027.0,Adults - aged 25 to under 65; Overseas communities or charities,31 Oct 2022,0.0
15208,https://www.acnc.gov.au/charity/charities/9ce31824-39af-e811-a963-000d3ad244fd/profile,Eastern Emergency Relief Network Inc,Mitcham,VIC,Registered,Small,88876940581,,,,,,,http://www.easternemergency.org.au/,83255.0,65662.0,Aboriginal and Torres Strait Islander people; Adults - aged 25 to under 65; Adults - aged 65 and over; Children - aged 6 to under 15; Early childhood - aged under 6; Families; Females; Financially disadvantaged people; Males; Other charities; People at risk of homelessness/ people experiencing homelessness; People from a culturally and linguistically diverse background; People with chronic illness (including terminal illness); People with disabilities; Pre/post release offenders and/or their families; Unemployed persons; Victims of crime (including family violence); Victims of disaster; Youth - 15 to under 25,5 Jan 2022,0.0
15209,https://www.acnc.gov.au/charity/charities/cc76c226-38af-e811-a960-000d3ad24282/profile,Friends Of Geelong Botanic Gardens Gift Fund,Geelong,VIC,Registered,Small,44063083206,,,,,,,http://www.friendsgbg.org.au/,9102.0,17370.0,Environment; Families; General community in Australia; People from a culturally and linguistically diverse background; People in rural/regional/remote communities,10 Nov 2021,0.0
15210,https://www.acnc.gov.au/charity/charities/e5f8a891-39af-e811-a961-000d3ad24182/profile,Centre For Men Australia Limited,Ipswich,QLD,Registered,Small,63124479287,,,,,,,http://www.cfma.org.au/,119204.0,116128.0,Adults - aged 25 to under 65; Adults - aged 65 and over; Males; People at risk of homelessness/ people experiencing homelessness; Youth - 15 to under 25,31 Oct 2022,0.0
15211,https://www.acnc.gov.au/charity/charities/af3ab8ac-7d75-eb11-b1ac-000d3ad1ce4e/profile,FITZROY COMMUNITY HOSPICE LTD,The Range,QLD,Registered,Small,38647816920,,,,,,,http://www.fitzroyhospice.org.au/,400857.0,43450.0,Aboriginal and Torres Strait Islander people; Adults - aged 25 to under 65; Adults - aged 65 and over; Families; Females; Financially disadvantaged people; Males; People from a culturally and linguistically diverse background; People in rural/regional/remote communities; People with chronic illness (including terminal illness); People with disabilities; Youth - 15 to under 25,10 Oct 2022,0.0
15212,https://www.acnc.gov.au/charity/charities/9d2fd24a-38af-e811-a95e-000d3ad24c60/profile,Cowell Interchurch Council Inc,Cowell,SA,Registered,Small,54845994632,,,,,,,,2332.0,2995.0,Children - aged 6 to under 15,31 Oct 2022,1.0
15213,https://www.acnc.gov.au/charity/charities/de6d36d8-2daf-e811-a962-000d3ad24a0d/profile,The Autism Foundation Australia Limited,Woolloongabba,QLD,Registered,Small,20135896892,,,,,,,https://aeiou.org.au/,0.0,0.0,Early childhood - aged under 6,27 Jan 2022,0.0
15214,https://www.acnc.gov.au/charity/charities/e2ae7790-38af-e811-a962-000d3ad24a0d/profile,Pacific Coast Railway Society Inc,Casino,NSW,Registered,Small,15626410789,,,,,,,http://www.casinominirail.webs.com/,43333.0,37755.0,Aboriginal and Torres Strait Islander people; Adults - aged 25 to under 65; Adults - aged 65 and over; Children - aged 6 to under 15; Early childhood - aged under 6; Families; Females; General community in Australia; Males; People in rural/regional/remote communities; People with disabilities; Youth - 15 to under 25,28 Oct 2022,0.0
15215,https://www.acnc.gov.au/charity/charities/a71ab87c-3aaf-e811-a962-000d3ad24a0d/profile,Psychosocial Training and Education Response to Communities Association - Sierra Leone Inc.,Unavailable,Unavailable,Registered,Small,93311798807,,,,,,,http://www.sierralifecoach.com/,2898.0,2650.0,Adults - aged 25 to under 65; Families; People from a culturally and linguistically diverse background; Youth - 15 to under 25,28 Oct 2022,0.0
15216,https://www.acnc.gov.au/charity/charities/47e6e226-38af-e811-a95e-000d3ad24c60/profile,Lifemessenger Inc,Mount Eliza,VIC,Registered,Small,26743269442,,,,,,,,265542.0,243878.0,Adults - aged 25 to under 65; Adults - aged 65 and over; Families; Females; Males; Youth - 15 to under 25,28 Oct 2022,1.0
15217,https://www.acnc.gov.au/charity/charities/bfc76e7a-3aaf-e811-a963-000d3ad244fd/profile,Margaret River Baptist Church Inc.,Margaret River,WA,Registered,Small,83628295074,,,,,,,http://www.margaretriverbaptist.org.au/,138075.0,152370.0,Families,28 Oct 2022,1.0
15218,https://www.acnc.gov.au/charity/charities/69087f25-3aaf-e811-a960-000d3ad24282/profile,DOOR OF HOPE INC,Ormeau,QLD,Registered,Small,72886690733,,,,,,,http://www.doorofhope.net.au/,32415.0,9358.0,Adults - aged 25 to under 65; Children - aged 6 to under 15; Early childhood - aged under 6; Other charities; Overseas communities or charities; People at risk of homelessness/ people experiencing homelessness; People with disabilities; Unemployed persons; Youth - 15 to under 25,28 Oct 2022,1.0
15219,https://www.acnc.gov.au/charity/charities/9605d743-39af-e811-a962-000d3ad24a0d/profile,Life Gate Baptist Church,Mount Gravatt East,QLD,Registered,Small,36488658579,,,,,,,http://www.lifegatebaptist.com.au/,0.0,0.0,General community in Australia,28 Oct 2022,1.0
15220,https://www.acnc.gov.au/charity/charities/ebcab490-38af-e811-a963-000d3ad244fd/profile,Cornerstone Of Christ Evangelical Church Inc.,Kew,VIC,Registered,Small,45252388067,,,,,,,http://cornerstoneofchristchurch.org/,3780.0,4985.0,People from a culturally and linguistically diverse background,28 Oct 2022,1.0
15221,https://www.acnc.gov.au/charity/charities/a451b332-38af-e811-a960-000d3ad24282/profile,Eco Barge Clean Seas Inc.,Jubilee Pocket,Unavailable,Registered,Small,59694887928,,,,,,,https://ecobargecleanseas.org.au/,362764.0,297045.0,Aboriginal and Torres Strait Islander people; Adults - aged 25 to under 65; Adults - aged 65 and over; Animals; Children - aged 6 to under 15; Early childhood - aged under 6; Environment; Families; Females; Financially disadvantaged people; General community in Australia; Males; Other charities; People from a culturally and linguistically diverse background; People in rural/regional/remote communities; People with disabilities; Pre/post release offenders and/or their families; Unemployed persons; Veterans and/or their families; Victims of crime (including family violence); Victims of disaster; Youth - 15 to under 25,28 Oct 2022,0.0
15222,https://www.acnc.gov.au/charity/charities/1c09e587-3aaf-e811-a963-000d3ad24077/profile,Ringwood Highland Pipe Band Inc,Ringwood,VIC,Registered,Small,41282368298,,,,,,,http://www.ringwoodpb.com.au/,12850.0,8383.0,Adults - aged 25 to under 65; Adults - aged 65 and over; Children - aged 6 to under 15; Families; General community in Australia; People from a culturally and linguistically diverse background; People with disabilities; Veterans and/or their families; Youth - 15 to under 25,28 Oct 2022,0.0
15223,https://www.acnc.gov.au/charity/charities/6dad4fe1-39af-e811-a960-000d3ad24282/profile,MMM International Alliance Incorporated,Mitcham,VIC,Registered,Small,27462047026,,,,,,,http://mmminternational.net/,3190.0,2288.0,Aboriginal and Torres Strait Islander people; General community in Australia; Other charities; Overseas communities or charities,28 Oct 2022,1.0
15224,https://www.acnc.gov.au/charity/charities/402a5695-38af-e811-a95e-000d3ad24c60/profile,Mandurah Murray Mayday Club Inc,Mandurah,WA,Registered,Small,28262635161,,,,,,,,401207.0,398607.0,Aboriginal and Torres Strait Islander people; Adults - aged 25 to under 65; Adults - aged 65 and over; Children - aged 6 to under 15; Early childhood - aged under 6; Families; Females; Financially disadvantaged people; General community in Australia; Males; People at risk of homelessness/ people experiencing homelessness; People from a culturally and linguistically diverse background; People with chronic illness (including terminal illness); People with disabilities; Veterans and/or their families; Youth - 15 to under 25,28 Oct 2022,0.0
15225,https://www.acnc.gov.au/charity/charities/18f5c70b-9465-e911-a982-000d3ad05ad0/profile,Tasmania Myanmar Church Inc,Newnham,TAS,Registered,Small,18938717163,,,,,,,https://tasmaniamyanmarchurch.webs.com/,1400.0,7855519.0,"Families; Migrants, refugees or asylum seekers; People from a culturally and linguistically diverse background; Unemployed persons",28 Oct 2022,1.0
15226,https://www.acnc.gov.au/charity/charities/39bdefb8-5c20-ea11-a812-000d3ad1f29c/profile,LIFE GENERATION (AUSTRALIA) LIMITED,Sydney,NSW,Registered,Small,87635823059,,,,,,,,111865.0,3697.0,Financially disadvantaged people,20 Jan 2022,0.0
15227,https://www.acnc.gov.au/charity/charities/66022af4-3db1-eb11-8236-000d3a6a736c/profile,Blackwood Biosecurity Inc,Bridgetown,WA,Registered,Small,41668334552,,,,,,,https://www.blackwoodbiosecurity.org.au/,250769.0,229452.0,Environment; People in rural/regional/remote communities,28 Oct 2022,0.0
15228,https://www.acnc.gov.au/charity/charities/75dd45a1-38af-e811-a95e-000d3ad24c60/profile,Samoan Assembly Of God Miller Inc,Cartwright,NSW,Registered,Small,65783380051,,,,,,,https://www.facebook.com/milleraog,181181.0,63388.0,Adults - aged 25 to under 65; Adults - aged 65 and over; Children - aged 6 to under 15; Early childhood - aged under 6; Families; Females; General community in Australia; Males; People at risk of homelessness/ people experiencing homelessness; People from a culturally and linguistically diverse background; People with disabilities; Unemployed persons; Victims of crime (including family violence); Youth - 15 to under 25,29 Oct 2022,1.0
15229,https://www.acnc.gov.au/charity/charities/04f03439-38af-e811-a962-000d3ad24a0d/profile,Franciscan Province Of The Holy Spirit Australia,Waverley,NSW,Registered,Small,49556448369,,,,,,,http://www.franciscans.org.au/,0.0,0.0,General community in Australia,21 Jun 2022,1.0
15230,https://www.acnc.gov.au/charity/charities/8f867dbb-38af-e811-a963-000d3ad244fd/profile,Christian Life Centre Gatton Inc,Gatton,QLD,Registered,Small,99229652021,,,,,,,http://www.clcgatton.org/,76109.0,64944.0,Families; Females; General community in Australia; Males; Overseas communities or charities; People from a culturally and linguistically diverse background; People in rural/regional/remote communities,7 Jun 2022,1.0
15231,https://www.acnc.gov.au/charity/charities/1c196723-34d7-eb11-bacb-0022481070a1/profile,Care Kits for Kids Qld Inc,Camp Hill,QLD,Registered,Small,19407455738,,,,,,,https://carekitsforkidsqld.org.au/,132254.0,12951.0,"Aboriginal and Torres Strait Islander people; Children - aged 6 to under 15; Early childhood - aged under 6; Females; Financially disadvantaged people; Males; Migrants, refugees or asylum seekers; People at risk of homelessness/ people experiencing homelessness; People from a culturally and linguistically diverse background; People in rural/regional/remote communities; Victims of crime (including family violence); Victims of disaster; Youth - 15 to under 25",28 Jun 2022,0.0
15232,https://www.acnc.gov.au/charity/charities/2d98dd32-38af-e811-a95e-000d3ad24c60/profile,Far Northern District RSL,Cairns,QLD,Registered,Small,27013762947,,,,,,,,78083.0,141304.0,Adults - aged 25 to under 65; Adults - aged 65 and over; Females; Males; Veterans and/or their families,14 Jun 2022,0.0
15233,https://www.acnc.gov.au/charity/charities/df61637d-a2cd-e811-a964-000d3ad244fd/profile,e-Kalvi Charity Fund Inc.,Pinewood,VIC,Registered,Small,88398822680,,,,,,,http://www.ekalvi.org/,77506.0,124198.0,Children - aged 6 to under 15; Females; Financially disadvantaged people; Males; Overseas communities or charities; People at risk of homelessness/ people experiencing homelessness; People from a culturally and linguistically diverse background; People in rural/regional/remote communities; Victims of crime (including family violence); Victims of disaster; Youth - 15 to under 25,1 Oct 2022,0.0
15234,https://www.acnc.gov.au/charity/charities/98b90f1e-39af-e811-a962-000d3ad24a0d/profile,Uca - St Paul's Stafford,Stafford Heights,QLD,Registered,Small,71568083794,,,,,,,http://stpaulsstafford.org.au/,0.0,0.0,General community in Australia,6 Jun 2022,1.0
15235,https://www.acnc.gov.au/charity/charities/0e260a21-38af-e811-a962-000d3ad24a0d/profile,Assembly Of Confessing Congregations Incorporated,Newtown,NSW,Registered,Small,73794518715,,,,,,,https://confessingcongregations.org.au/,96109.0,65934.0,Adults - aged 25 to under 65; Adults - aged 65 and over,31 Oct 2022,1.0
15236,https://www.acnc.gov.au/charity/charities/67fb4cba-3aaf-e811-a962-000d3ad24a0d/profile,The Macedonian Orthodox Community of Melbourne and Victoria,Epping,VIC,Registered,Small,78004426733,,,,,,,,374217.0,346996.0,People from a culturally and linguistically diverse background,31 Oct 2022,1.0
15237,https://www.acnc.gov.au/charity/charities/b0038ec7-38af-e811-a963-000d3ad24077/profile,New Age Spiritualist Mission Inc,Unley,SA,Registered,Small,50998202157,,,,,,,http://www.nasm.org.au/,3573.0,4264.0,Adults - aged 25 to under 65; Adults - aged 65 and over; Youth - 15 to under 25,17 May 2022,1.0
15238,https://www.acnc.gov.au/charity/charities/de65aea1-38af-e811-a963-000d3ad24077/profile,Karoonda And District Soldiers Memorial Hospital Auxillary,Karoonda,SA,Registered,Small,34311919303,,,,,,,,3059.0,10159.0,Adults - aged 65 and over; General community in Australia; Other,31 Oct 2022,0.0
15239,https://www.acnc.gov.au/charity/charities/164f91a6-3aaf-e811-a963-000d3ad24077/profile,In the Paws of Angels Inc,Unavailable,QLD,Registered,Small,53487883254,,,,,,,http://www.inthepawsofangels.com/,27059.0,20816.0,Adults - aged 25 to under 65; Adults - aged 65 and over; Children - aged 6 to under 15; Females; Males; People with disabilities; Veterans and/or their families; Youth - 15 to under 25,1 Jul 2022,0.0
15240,https://www.acnc.gov.au/charity/charities/b1321278-38af-e811-a962-000d3ad24a0d/profile,Friends Of Geelong Botanic Gardens Incorporated,Geelong,VIC,Registered,Small,21699253561,,,,,,,http://www.friendsgbg.org.au/,176426.0,120034.0,Aboriginal and Torres Strait Islander people; Families; General community in Australia; People from a culturally and linguistically diverse background; People in rural/regional/remote communities,10 Nov 2021,0.0
15241,https://www.acnc.gov.au/charity/charities/f1540a24-3aaf-e811-a963-000d3ad24077/profile,Tuncurry Congregation of Jehovah's Witnesses,Forster,NSW,Registered,Small,60551629130,,,,,,,,0.0,0.0,General community in Australia,31 Oct 2022,1.0
15242,https://www.acnc.gov.au/charity/charities/e21d9c0b-3aaf-e811-a962-000d3ad24a0d/profile,Brookton Congregation of Jehovah's Witnesses,Brookton,WA,Registered,Small,70660705896,,,,,,,,0.0,0.0,General community in Australia,4 Oct 2022,1.0
15243,https://www.acnc.gov.au/charity/charities/0267c096-39af-e811-a962-000d3ad24a0d/profile,Sydney Animal Second-Chance Incorporated,Unavailable,Unavailable,Registered,Small,89780472280,,,,,,,http://facebook.com/SydneyAnimalSecondChance,104982.0,132324.0,Animals,31 Oct 2022,0.0
15244,https://www.acnc.gov.au/charity/charities/e99285d2-3775-ea11-a811-000d3ad1f497/profile,TZEMACH TZEDEK BENEVOLENT FUND INCORPORATED,Bondi,NSW,Registered,Small,72381982260,,,,,,,,0.0,0.0,,31 Oct 2022,0.0
15245,https://www.acnc.gov.au/charity/charities/096c84e6-2daf-e811-a961-000d3ad24182/profile,Fairy Meadow Surf Life Saving Club Inc,Fairy Meadow,NSW,Registered,Small,86308967130,,,,,,,http://fairymeadowslsc.com/,42917.0,38707.0,Adults - aged 25 to under 65; Children - aged 6 to under 15; Families; Females; Males; Youth - 15 to under 25,24 Aug 2021,0.0
15246,https://www.acnc.gov.au/charity/charities/27be7018-2caf-e811-a95e-000d3ad24c60/profile,River's Edge Church Limited,Newington,NSW,Registered,Small,32132321487,,,,,,,http://www.riversedgechurch.com.au/,443479.0,344257.0,Aboriginal and Torres Strait Islander people; Adults - aged 25 to under 65; Adults - aged 65 and over; Children - aged 6 to under 15; Early childhood - aged under 6; Families; Females; Financially disadvantaged people; General community in Australia; Males; People at risk of homelessness/ people experiencing homelessness; People from a culturally and linguistically diverse background; People with chronic illness (including terminal illness); People with disabilities; Pre/post release offenders and/or their families; Unemployed persons; Veterans and/or their families; Victims of crime (including family violence); Victims of disaster; Youth - 15 to under 25,31 Oct 2022,1.0
15247,https://www.acnc.gov.au/charity/charities/e33f7a14-39af-e811-a961-000d3ad24182/profile,Hoa Mai Association In Australia Incorporated,Busby,NSW,Registered,Small,41591426904,,,,,,,,2383.0,2294.0,Adults - aged 65 and over; Financially disadvantaged people; General community in Australia; Other charities; People at risk of homelessness/ people experiencing homelessness; People with chronic illness (including terminal illness); People with disabilities; Veterans and/or their families; Victims of disaster,31 Oct 2022,0.0
15248,https://www.acnc.gov.au/charity/charities/aec79197-69de-e911-a812-000d3ad1f497/profile,Gundaroo Literary Institute Incorporated,Gundaroo,NSW,Registered,Small,86561130962,,,,,,,https://gundaroo.org/community/gundaroo-literary-institute/,250.0,0.0,People in rural/regional/remote communities,31 Oct 2022,0.0
15249,https://www.acnc.gov.au/charity/charities/11e3f131-39af-e811-a960-000d3ad24282/profile,Uca - Logan City Central,Berrinba,QLD,Registered,Small,62229253615,,,,,,,,0.0,0.0,General community in Australia,3 Jun 2022,1.0
15250,https://www.acnc.gov.au/charity/charities/8ddbb26b-38af-e811-a963-000d3ad244fd/profile,Church For Life Inc.,Macclesfield,VIC,Registered,Small,69799664195,,,,,,,,79334.0,56190.0,Adults - aged 25 to under 65; Adults - aged 65 and over; Children - aged 6 to under 15; Early childhood - aged under 6; Families; Females; Financially disadvantaged people; General community in Australia; Males; Overseas communities or charities; People in rural/regional/remote communities; People with chronic illness (including terminal illness); People with disabilities; Unemployed persons; Veterans and/or their families; Victims of crime (including family violence); Youth - 15 to under 25,31 Oct 2022,1.0
15251,https://www.acnc.gov.au/charity/charities/5b62342f-b72a-eb11-bbf3-000d3ad1cd99/profile,THE ELLA FOUNDATION LTD,Unavailable,Unavailable,Registered,Small,33645174661,,,,,,,http://www.ellafoundation.com.au/,28069.0,12119.0,Aboriginal and Torres Strait Islander people; Children - aged 6 to under 15; Early childhood - aged under 6; People from a culturally and linguistically diverse background; People in rural/regional/remote communities; Youth - 15 to under 25,31 Oct 2022,0.0
15252,https://www.acnc.gov.au/charity/charities/7f725a24-39af-e811-a962-000d3ad24a0d/profile,The General Church Of The New Jerusalem Hurstville Society,Penshurst,NSW,Registered,Small,88884658423,,,,,,,http://www.hurstvillenewchurch.com/,88417.0,93528.0,Adults - aged 25 to under 65; Adults - aged 65 and over; Children - aged 6 to under 15; Early childhood - aged under 6; Families; Females; General community in Australia; Males; Youth - 15 to under 25,11 Sep 2022,1.0
15253,https://www.acnc.gov.au/charity/charities/6a3f80d5-39af-e811-a95e-000d3ad24c60/profile,St Barnabas Anglican Church,Westmead,NSW,Registered,Small,48485137547,,,,,,,https://www.stbarnabaswestmead.com/,0.0,0.0,Adults - aged 65 and over; Children - aged 6 to under 15; Early childhood - aged under 6; Families; General community in Australia; People from a culturally and linguistically diverse background; Youth - 15 to under 25,3 Nov 2022,1.0
15254,https://www.acnc.gov.au/charity/charities/902090d9-38af-e811-a963-000d3ad244fd/profile,Uca - Sydney Korean Church,Strathfield,NSW,Registered,Small,88220890023,,,,,,,http://sydneykoruc.org/w/,0.0,0.0,Adults - aged 25 to under 65; Adults - aged 65 and over; Children - aged 6 to under 15; Early childhood - aged under 6; Families; Youth - 15 to under 25,31 Oct 2022,1.0
15255,https://www.acnc.gov.au/charity/charities/ca328675-fbea-e911-a811-000d3ad1f9f4/profile,The Trustee for The Youngmac Trust,Spring Hill,QLD,Registered,Small,51322676622,,,,,,,,0.0,75.0,Adults - aged 25 to under 65; People with disabilities,31 Oct 2022,0.0
15256,https://www.acnc.gov.au/charity/charities/872a2372-39af-e811-a961-000d3ad24182/profile,Une Foundation Limited,Armidale,NSW,Registered,Small,77094834107,,,,,,,https://www.une.edu.au/alumni/give-to-une/une-foundation,0.0,0.0,Aboriginal and Torres Strait Islander people; Adults - aged 25 to under 65; General community in Australia; People in rural/regional/remote communities; Youth - 15 to under 25,6 Jun 2022,0.0
15257,https://www.acnc.gov.au/charity/charities/0a1e7ab2-39af-e811-a963-000d3ad24077/profile,Gippsland Christian Broadcasters Inc,Sale,VIC,Registered,Small,81696303972,,,,,,,http://www.lifefm.com.au/,109218.0,151304.0,People in rural/regional/remote communities,31 Oct 2022,1.0
15258,https://www.acnc.gov.au/charity/charities/088879c5-38af-e811-a95e-000d3ad24c60/profile,Applied Neuroscience Society Of Australasia Incorporated,Unavailable,Unavailable,Registered,Small,22896855463,,,,,,,,161046.0,185562.0,General community in Australia,27 Feb 2019,0.0
15259,https://www.acnc.gov.au/charity/charities/041db230-39af-e811-a963-000d3ad24077/profile,Uca-Morningside Congregation,Morningside,QLD,Registered,Small,62265283673,,,,,,,,0.0,0.0,General community in Australia,15 Jun 2022,1.0
