,Index_Link,Legal_Name,Town/Suburb,State,Status,Size,ABN,Website,Revenue,Expenses,Cause/s,Last_report_date,ref_religion,website,revenue,expenses,causes,lastreport,religious_ref
511,https://www.acnc.gov.au/charity/charities/ef1fff57-38af-e811-a961-000d3ad24182/profile,St Martin Of Tours Parish,Rosanna,VIC,Registered,Medium,21504260106,,,,,,,http://www.smot.org.au/,0.0,0.0,"Aboriginal and Torres Strait Islander people; Adults - aged 25 to under 65; Adults - aged 65 and over; Children - aged 6 to under 15; Early childhood - aged under 6; Families; Females; Financially disadvantaged people; Gay, lesbian, bisexual, transgender or intersex persons; Males; Migrants, refugees or asylum seekers; Other charities; Overseas communities or charities; People at risk of homelessness/ people experiencing homelessness; People from a culturally and linguistically diverse background; People in rural/regional/remote communities; People with chronic illness (including terminal illness); People with disabilities; Pre/post release offenders and/or their families; Unemployed persons; Veterans and/or their families; Victims of crime (including family violence); Victims of disaster; Youth - 15 to under 25",15 Jun 2022,1.0
512,https://www.acnc.gov.au/charity/charities/0d18ff57-38af-e811-a961-000d3ad24182/profile,Sydenham Baptist Church,Sydenham,VIC,Registered,Medium,86943475197,,,,,,,http://www.sydenhambaptist.com.au/,,,,,1.0
513,https://www.acnc.gov.au/charity/charities/ebab674b-38af-e811-a961-000d3ad24182/profile,Home Economics Victoria,Docklands,VIC,Registered,Medium,55005333835,,,,,,,https://www.homeeconomics.com.au/,384758.0,380102.0,Adults - aged 25 to under 65; Children - aged 6 to under 15; General community in Australia; Youth - 15 to under 25,7 Jun 2022,0.0
514,https://www.acnc.gov.au/charity/charities/76a5674b-38af-e811-a961-000d3ad24182/profile,Liberty Family Church Inc,Gosford,NSW,Registered,Medium,98581934057,,,,,,,http://www.libertyfamilychurch.org/,716609.0,503884.0,Adults - aged 25 to under 65; Adults - aged 65 and over; Children - aged 6 to under 15; Early childhood - aged under 6; Families; Females; Financially disadvantaged people; Males; People at risk of homelessness/ people experiencing homelessness; Unemployed persons; Youth - 15 to under 25,28 Dec 2021,1.0
515,https://www.acnc.gov.au/charity/charities/adda2c33-38af-e811-a961-000d3ad24182/profile,Canterbury Meals On Wheels Inc,Campsie,NSW,Registered,Medium,86781006396,,,,,,,http://www.canterburymealsonwheels.org.au/,,,,,0.0
516,https://www.acnc.gov.au/charity/charities/3ef2d851-38af-e811-a961-000d3ad24182/profile,Rawcus Theatre Company Inc,St Kilda,VIC,Registered,Medium,59905293064,,,,,,,http://www.rawcus.org.au/,430373.0,430153.0,Adults - aged 25 to under 65; Families; People with disabilities; Youth - 15 to under 25,13 May 2022,0.0
517,https://www.acnc.gov.au/charity/charities/7e21ff57-38af-e811-a961-000d3ad24182/profile,Youth Affairs Council Of South Australia,Adelaide,SA,Registered,Medium,21294698466,,,,,,,http://www.yacsa.com.au/,682417.0,533765.0,Other; Youth - 15 to under 25,31 Jan 2022,0.0
518,https://www.acnc.gov.au/charity/charities/e6a4674b-38af-e811-a961-000d3ad24182/profile,RETURNED & SERVICES LEAGUE OF AUSTRALIA (QUEENSLAND BRANCH) INNISFAIL SUB-BRANCH INC.,Innisfail,QLD,Registered,Medium,98580482893,,,,,,,http://www.innisfailrsl.com.au/,,,,,0.0
519,https://www.acnc.gov.au/charity/charities/1717ff57-38af-e811-a961-000d3ad24182/profile,Eden Killer Whale Museum Management Committee Incorporated,Eden,NSW,Registered,Medium,33407012099,,,,,,,http://www.killerwhalemuseum.com.au/,460338.0,419638.0,Adults - aged 25 to under 65; Adults - aged 65 and over; Children - aged 6 to under 15; Families; Females; General community in Australia; Males; Youth - 15 to under 25,31 Mar 2021,0.0
520,https://www.acnc.gov.au/charity/charities/1d18ff57-38af-e811-a961-000d3ad24182/profile,Student Care Inc,University Of Adelaide,SA,Registered,Medium,87052407647,,,,,,,http://www.auu.org.au/,806914.0,888261.0,Aboriginal and Torres Strait Islander people; Adults - aged 25 to under 65; Adults - aged 65 and over; Females; Financially disadvantaged people; Males; People at risk of homelessness/ people experiencing homelessness; People from a culturally and linguistically diverse background; People in rural/regional/remote communities; People with chronic illness (including terminal illness); People with disabilities; Unemployed persons; Victims of crime (including family violence); Victims of disaster; Youth - 15 to under 25,28 Jun 2022,0.0
521,https://www.acnc.gov.au/charity/charities/f5a4674b-38af-e811-a961-000d3ad24182/profile,Friends Of The Koala Inc,East Lismore,NSW,Registered,Medium,69322819171,,,,,,,http://friendsofthekoala.org/,,,,,0.0
522,https://www.acnc.gov.au/charity/charities/b5f3d851-38af-e811-a961-000d3ad24182/profile,The Trustee For Dalara Foundation,Coolum Beach,QLD,Registered,Medium,82943013280,,,,,,,,414165.0,417040.0,General community in Australia,31 Jan 2022,0.0
523,https://www.acnc.gov.au/charity/charities/abe62739-38af-e811-a961-000d3ad24182/profile,Maleny Neighbourhood Centre Assoc Inc,Maleny,QLD,Registered,Medium,33095644692,,,,,,,http://www.malenync.org.au/,377475.0,384047.0,"Aboriginal and Torres Strait Islander people; Adults - aged 25 to under 65; Adults - aged 65 and over; Children - aged 6 to under 15; Early childhood - aged under 6; Families; Females; Financially disadvantaged people; Gay, lesbian, bisexual, transgender or intersex persons; Males; People at risk of homelessness/ people experiencing homelessness; Victims of crime (including family violence); Youth - 15 to under 25",21 Dec 2021,0.0
524,https://www.acnc.gov.au/charity/charities/224c6f45-38af-e811-a961-000d3ad24182/profile,Unavailable,Unavailable,Unavailable,Registered,Medium,Unavailable,,,,,,,,,,,,0.0
525,https://www.acnc.gov.au/charity/charities/4ea4674b-38af-e811-a961-000d3ad24182/profile,Australian Print Workshop Inc,Collingwood,VIC,Registered,Medium,98451398479,,,,,,,http://www.australianprintworkshop.com/,641127.0,681696.0,Adults - aged 25 to under 65; Adults - aged 65 and over; General community in Australia; Youth - 15 to under 25,21 Jun 2022,0.0
526,https://www.acnc.gov.au/charity/charities/f3e32739-38af-e811-a961-000d3ad24182/profile,The Trustee For The Rotary Club Of Melbourne Community Foundation Extension Fund,Melbourne,VIC,Registered,Medium,94559478544,,,,,,,http://www.rotaryclubofmelbourne.org.au/,327677.0,312439.0,Children - aged 6 to under 15; Families; Females; Financially disadvantaged people; Males; People at risk of homelessness/ people experiencing homelessness; People in rural/regional/remote communities; Victims of disaster,8 Feb 2022,0.0
527,https://www.acnc.gov.au/charity/charities/6ef02739-38af-e811-a961-000d3ad24182/profile,Australasian Foundation For Plastic Surgery Limited,St Leonards,NSW,Registered,Medium,74091976046,,,,,,,http://www.plasticsurgeryfoundation.org.au/,,,,,0.0
528,https://www.acnc.gov.au/charity/charities/17e02c33-38af-e811-a961-000d3ad24182/profile,The Geelong College Foundation Limited,Newtown,VIC,Registered,Medium,27006718458,,,,,,,http://www.geelongcollege.vic.edu.au/,745525.0,419716.0,Aboriginal and Torres Strait Islander people; Children - aged 6 to under 15; Financially disadvantaged people; Youth - 15 to under 25,8 Jul 2022,0.0
529,https://www.acnc.gov.au/charity/charities/b0ec2739-38af-e811-a961-000d3ad24182/profile,Moreton Bay Regional Community Legal Service Inc,Caboolture,QLD,Registered,Medium,74034461607,,,,,,,http://mbrcls.org.au/,359374.0,324207.0,Aboriginal and Torres Strait Islander people; Adults - aged 25 to under 65; Adults - aged 65 and over; Families; Females; Financially disadvantaged people; Males; Other charities; People at risk of homelessness/ people experiencing homelessness; People from a culturally and linguistically diverse background; People in rural/regional/remote communities; People with disabilities; Unemployed persons; Veterans and/or their families; Victims of crime (including family violence); Youth - 15 to under 25,28 Jan 2022,0.0
530,https://www.acnc.gov.au/charity/charities/54f6d851-38af-e811-a961-000d3ad24182/profile,Meadowbrook Christian Church LTD,Meadowbrook,QLD,Registered,Medium,33241878549,,,,,,,http://authenticchurch.com.au/,,,,,1.0
531,https://www.acnc.gov.au/charity/charities/9019ff57-38af-e811-a961-000d3ad24182/profile,Christian Life Centre Mona Vale,Mona Vale,NSW,Registered,Medium,86835220393,,,,,,,http://www.mvclc.org.au/,0.0,0.0,Adults - aged 25 to under 65; Adults - aged 65 and over; Children - aged 6 to under 15; Early childhood - aged under 6; Families; Females; Financially disadvantaged people; General community in Australia; Males; Overseas communities or charities; People at risk of homelessness/ people experiencing homelessness; People from a culturally and linguistically diverse background; People in rural/regional/remote communities; People with chronic illness (including terminal illness); Unemployed persons; Youth - 15 to under 25,1 Dec 2021,1.0
532,https://www.acnc.gov.au/charity/charities/2c1dff57-38af-e811-a961-000d3ad24182/profile,Ingham Family Centre Inc,Ingham,QLD,Registered,Medium,49842660865,,,,,,,http://www.inghamearlylearning.com.au/,737259.0,692261.0,Aboriginal and Torres Strait Islander people; Children - aged 6 to under 15; Early childhood - aged under 6; Females; Financially disadvantaged people; General community in Australia; Males; People from a culturally and linguistically diverse background; People in rural/regional/remote communities; People with disabilities; Unemployed persons; Veterans and/or their families; Victims of crime (including family violence); Victims of disaster,7 Feb 2022,0.0
533,https://www.acnc.gov.au/charity/charities/16e22c33-38af-e811-a961-000d3ad24182/profile,Arrow Leadership Australia Limited,Loganholme,QLD,Registered,Medium,39003199488,,,,,,,http://arrowleadership.org.au/,,,,,0.0
534,https://www.acnc.gov.au/charity/charities/101eff57-38af-e811-a961-000d3ad24182/profile,The Trustee For National Jockeys Trust,Baulkham Hills,NSW,Registered,Medium,21495206153,,,,,,,http://www.njt.org.au/,860029.0,838410.0,Families; Females; Financially disadvantaged people; Males; People with chronic illness (including terminal illness); People with disabilities,31 Jan 2022,0.0
535,https://www.acnc.gov.au/charity/charities/8219ff57-38af-e811-a961-000d3ad24182/profile,Timespan Incorporated,Mountain Gate,VIC,Registered,Medium,86945730529,,,,,,,,360272.0,200664.0,General community in Australia,28 Dec 2021,1.0
536,https://www.acnc.gov.au/charity/charities/51a4674b-38af-e811-a961-000d3ad24182/profile,Jumbunna Childrens Centre Ltd,Nowra,NSW,Registered,Medium,64955031984,,,,,,,http://www.jumbunna.org.au/,,,,,0.0
537,https://www.acnc.gov.au/charity/charities/2e1dff57-38af-e811-a961-000d3ad24182/profile,SpringDale Neighbourhood Centre Inc,Drysdale,VIC,Registered,Medium,21404220267,,,,,,,http://www.springdale.org.au/,441340.0,440520.0,Aboriginal and Torres Strait Islander people; Adults - aged 25 to under 65; Adults - aged 65 and over; Children - aged 6 to under 15; Early childhood - aged under 6; Environment; Families; Females; Financially disadvantaged people; General community in Australia; Males; Other charities; People at risk of homelessness/ people experiencing homelessness; People from a culturally and linguistically diverse background; People in rural/regional/remote communities; People with chronic illness (including terminal illness); People with disabilities; Pre/post release offenders and/or their families; Unemployed persons; Veterans and/or their families; Victims of crime (including family violence); Victims of disaster; Youth - 15 to under 25,21 Jan 2022,0.0
538,https://www.acnc.gov.au/charity/charities/810de970-38af-e811-a961-000d3ad24182/profile,The Corporation Of The Synod Of The Diocese Of Brisbane,Brisbane City,QLD,Registered,Medium,39533759463,,,,,,,,0.0,0.0,General community in Australia,27 May 2022,1.0
539,https://www.acnc.gov.au/charity/charities/a6a9674b-38af-e811-a961-000d3ad24182/profile,Oaktree Anglican,Caulfield North,VIC,Registered,Medium,69545469881,,,,,,,http://oaktreeanglican.org.au/,,,,,0.0
540,https://www.acnc.gov.au/charity/charities/d7a3674b-38af-e811-a961-000d3ad24182/profile,Catholic Parish Of Our Lady Of The Angels Rouse Hill,North Kellyville,NSW,Registered,Medium,14943654246,,,,,,,,0.0,0.0,General community in Australia,27 Jan 2022,1.0
541,https://www.acnc.gov.au/charity/charities/4aebd851-38af-e811-a961-000d3ad24182/profile,Catholic Parish Of Holy Cross Woollahra,Bondi Junction,NSW,Registered,Medium,27366741378,,,,,,,,0.0,0.0,General community in Australia,27 Jan 2022,1.0
542,https://www.acnc.gov.au/charity/charities/c24c6f45-38af-e811-a961-000d3ad24182/profile,Sikh Mission Centre Sydney Inc,Austral,NSW,Registered,Medium,14847378288,,,,,,,,,,,,0.0
543,https://www.acnc.gov.au/charity/charities/45af763f-38af-e811-a961-000d3ad24182/profile,Helen Paul Kindergarten,Hampton,VIC,Registered,Medium,21043895509,,,,,,,https://www.helenpaulkindergarten.org.au/,384297.0,370945.0,Early childhood - aged under 6,30 Sep 2020,0.0
544,https://www.acnc.gov.au/charity/charities/e6a5674b-38af-e811-a961-000d3ad24182/profile,Uca - Gerringong,Gerringong,NSW,Registered,Medium,69326712517,,,,,,,http://gerringongunitingchurch.webpress.com/,0.0,0.0,Adults - aged 25 to under 65; Adults - aged 65 and over; Children - aged 6 to under 15; Early childhood - aged under 6; Families; Other charities; Overseas communities or charities; Youth - 15 to under 25,18 Jan 2022,1.0
545,https://www.acnc.gov.au/charity/charities/b7af763f-38af-e811-a961-000d3ad24182/profile,Riding For The Disabled Assoc Of Western Australia - Carine Group Incorporated,Warwick,WA,Registered,Medium,90911921368,,,,,,,https://rdacarine.org.au/,,,,,0.0
546,https://www.acnc.gov.au/charity/charities/ecead851-38af-e811-a961-000d3ad24182/profile,Engadine Community Services Inc,Engadine,NSW,Registered,Medium,39108386726,,,,,,,http://www.ecs.org.au/,420445.0,345330.0,Adults - aged 25 to under 65; Adults - aged 65 and over; Children - aged 6 to under 15; Families; Females; Males; People with disabilities; Youth - 15 to under 25,1 Dec 2021,0.0
547,https://www.acnc.gov.au/charity/charities/259f674b-38af-e811-a961-000d3ad24182/profile,The Trustee For Birchall Family Foundation Trust,Narre Warren East,VIC,Registered,Medium,64939210190,,,,,,,,369829.0,461451.0,Children - aged 6 to under 15; Early childhood - aged under 6; Families; Financially disadvantaged people; Other charities; Overseas communities or charities; People at risk of homelessness/ people experiencing homelessness; People with disabilities; Victims of disaster,29 Jan 2022,0.0
548,https://www.acnc.gov.au/charity/charities/f3a3674b-38af-e811-a961-000d3ad24182/profile,Returned & Services League of Australia (Queensland Branch) Mackay Sub Branch Inc,Mackay,QLD,Registered,Medium,98527172911,,,,,,,,,,,,0.0
549,https://www.acnc.gov.au/charity/charities/07ead851-38af-e811-a961-000d3ad24182/profile,Transplant Australia Limited,Sydney Olympic Park,NSW,Registered,Medium,39107428615,,,,,,,http://www.transplant.org.au/,826269.0,750530.0,Adults - aged 25 to under 65; Adults - aged 65 and over; Children - aged 6 to under 15; Families; Other; Youth - 15 to under 25,28 Mar 2022,0.0
550,https://www.acnc.gov.au/charity/charities/95ead851-38af-e811-a961-000d3ad24182/profile,Om Overseas Aid Fund,Kerrimuir,VIC,Registered,Medium,27182395136,,,,,,,,517113.0,516913.0,"All ages; Females; Males; Migrants, refugees or asylum seekers; Overseas communities or charities; People at risk of homelessness/ people experiencing homelessness; People from a culturally and linguistically diverse background; People with chronic illness (including terminal illness); People with disabilities; Unemployed persons; Victims of disaster",30 Jun 2016,0.0
551,https://www.acnc.gov.au/charity/charities/eca6674b-38af-e811-a961-000d3ad24182/profile,Katia Project Inc,Byron Bay,NSW,Registered,Medium,69379739388,,,,,,,http://www.byronherbs.com.au/,,,,,0.0
552,https://www.acnc.gov.au/charity/charities/2f22ff57-38af-e811-a961-000d3ad24182/profile,Quercus Beechworth Inc,Beechworth,VIC,Registered,Medium,21468159356,,,,,,,http://www.quercusbeechworth.com.au/,458571.0,360716.0,"Adults - aged 25 to under 65; Adults - aged 65 and over; Children - aged 6 to under 15; Early childhood - aged under 6; Families; Financially disadvantaged people; General community in Australia; Migrants, refugees or asylum seekers; People from a culturally and linguistically diverse background; People in rural/regional/remote communities; People with chronic illness (including terminal illness); People with disabilities; Unemployed persons; Youth - 15 to under 25",29 Jun 2022,0.0
553,https://www.acnc.gov.au/charity/charities/ff1fff57-38af-e811-a961-000d3ad24182/profile,Unavailable,Unavailable,Unavailable,Registered,Medium,Unavailable,,,,,,,,515190.0,304645.0,General community in Australia,25 Jan 2022,0.0
554,https://www.acnc.gov.au/charity/charities/cab0763f-38af-e811-a961-000d3ad24182/profile,Midwest Disaster Relief,Webberton,WA,Registered,Medium,21077227431,,,,,,,,,,,,0.0
555,https://www.acnc.gov.au/charity/charities/63c4d964-38af-e811-a961-000d3ad24182/profile,Southside Christian Fellowship Incorporated,Miranda,NSW,Registered,Medium,74213001721,,,,,,,http://southside.org.au/,527260.0,438184.0,Adults - aged 25 to under 65; Adults - aged 65 and over; Children - aged 6 to under 15; Early childhood - aged under 6; Families; Females; Financially disadvantaged people; General community in Australia; Males; Other charities; Overseas communities or charities; People at risk of homelessness/ people experiencing homelessness; People from a culturally and linguistically diverse background; People in rural/regional/remote communities; People with chronic illness (including terminal illness); People with disabilities; Unemployed persons; Victims of crime (including family violence); Victims of disaster; Youth - 15 to under 25,8 Nov 2021,1.0
556,https://www.acnc.gov.au/charity/charities/4af8d851-38af-e811-a961-000d3ad24182/profile,Epping West P&C Association,Epping,NSW,Registered,Medium,33236960278,,,,,,,,490002.0,512955.0,Children - aged 6 to under 15,18 Aug 2022,0.0
557,https://www.acnc.gov.au/charity/charities/98c6d964-38af-e811-a961-000d3ad24182/profile,The Greek Orthodox War Memorial Southside Parish,Mount Gravatt East,QLD,Registered,Medium,94876250709,,,,,,,,,,,,1.0
558,https://www.acnc.gov.au/charity/charities/68b0f55d-38af-e811-a961-000d3ad24182/profile,Ithaca Presbyterian Church,Milton,QLD,Registered,Medium,44964298570,,,,,,,http://www.pcq.org.au/,0.0,0.0,Females; General community in Australia; Males,8 Jun 2022,1.0
559,https://www.acnc.gov.au/charity/charities/17b4e46a-38af-e811-a961-000d3ad24182/profile,Craigieburn Education & Community Centre Incorporated,Craigieburn,VIC,Registered,Medium,69830510679,,,,,,,http://www.craigieburn.org.au/,281507.0,250931.0,Aboriginal and Torres Strait Islander people; Adults - aged 25 to under 65; Adults - aged 65 and over; Families; Females; Financially disadvantaged people; Males; People from a culturally and linguistically diverse background; People with disabilities; Unemployed persons; Youth - 15 to under 25,9 May 2022,0.0
560,https://www.acnc.gov.au/charity/charities/75b5e46a-38af-e811-a961-000d3ad24182/profile,Parkinsons Queensland Inc,Eight Mile Plains,QLD,Registered,Medium,69838771233,,,,,,,http://www.parkinsonsqld.org.au/,,,,,0.0
561,https://www.acnc.gov.au/charity/charities/2b0be970-38af-e811-a961-000d3ad24182/profile,We Care Community Services Inc,Unavailable,Unavailable,Registered,Medium,55046401818,,,,,,,http://wecare.services/,557054.0,343304.0,Early childhood - aged under 6; Youth - 15 to under 25,30 Nov 2021,0.0
562,https://www.acnc.gov.au/charity/charities/64f4d851-38af-e811-a961-000d3ad24182/profile,Queer Screen Limited,Ultimo,NSW,Registered,Medium,60059963110,,,,,,,https://queerscreen.org.au/,819174.0,705078.0,"Aboriginal and Torres Strait Islander people; Adults - aged 25 to under 65; Adults - aged 65 and over; Children - aged 6 to under 15; Families; Females; Financially disadvantaged people; Gay, lesbian, bisexual, transgender or intersex persons; General community in Australia; Males; Other charities; Overseas communities or charities; People at risk of homelessness/ people experiencing homelessness; People from a culturally and linguistically diverse background; People in rural/regional/remote communities; People with disabilities; Unemployed persons; Victims of crime (including family violence); Youth - 15 to under 25",12 Feb 2022,0.0
563,https://www.acnc.gov.au/charity/charities/fd18ff57-38af-e811-a961-000d3ad24182/profile,Visioncare NSW,Punchbowl,NSW,Registered,Medium,87056029460,,,,,,,,,,,,0.0
564,https://www.acnc.gov.au/charity/charities/3c3995a0-3aaf-e811-a963-000d3ad24077/profile,St Kilda Memorial Hall Trust,St Kilda,VIC,Registered,Medium,73191974548,,,,,,,,302982.0,333181.0,Veterans and/or their families,29 Jun 2022,0.0
565,https://www.acnc.gov.au/charity/charities/22609bad-3aaf-e811-a963-000d3ad24077/profile,Australian Universities International Directors Forum,Redhead,NSW,Registered,Medium,84837792037,,,,,,,http://www.auidf.org/,301258.0,218928.0,Other,18 Aug 2022,0.0
566,https://www.acnc.gov.au/charity/charities/567792b3-3aaf-e811-a963-000d3ad24077/profile,THE GREEK ORTHODOX PARISH AND COMMUNITY OF KOGARAH AND DISTRICT RESURRECTION OF CHRIST LTD,Unavailable,Unavailable,Registered,Medium,79296025674,,,,,,,http://www.kogarahgreekorthodox.org.au/,,,,,1.0
567,https://www.acnc.gov.au/charity/charities/d45b4fba-3aaf-e811-a963-000d3ad24077/profile,Brothers Care Fund Limited,Mangrove Creek,NSW,Registered,Medium,15626275287,,,,,,,http://healthcarestore.com.au/,733738.0,38228.0,Other,29 Apr 2022,1.0
568,https://www.acnc.gov.au/charity/charities/965d4fba-3aaf-e811-a963-000d3ad24077/profile,Macarthur Centre for Sustainable Living,Mount Annan,NSW,Registered,Medium,25112067848,,,,,,,http://www.mcsl.org.au/,563389.0,277716.0,Adults - aged 25 to under 65; Adults - aged 65 and over; Children - aged 6 to under 15; Early childhood - aged under 6; Environment; Families; Females; Males; Youth - 15 to under 25,29 Nov 2021,0.0
569,https://www.acnc.gov.au/charity/charities/b4726e09-2caf-e811-a961-000d3ad24182/profile,Uca - Terrigal,Terrigal,NSW,Registered,Medium,59008027346,,,,,,,http://www.terrigalunitingchurch.com/,,,,,0.0
570,https://www.acnc.gov.au/charity/charities/d5726e09-2caf-e811-a961-000d3ad24182/profile,Anglican Parish Of St John The Baptist Canberra,Canberra,ACT,Registered,Medium,58859057978,,,,,,,,0.0,0.0,General community in Australia,30 Jun 2022,1.0
571,https://www.acnc.gov.au/charity/charities/ec36b10f-2caf-e811-a961-000d3ad24182/profile,St Albans Frenchs Forest,Frenchs Forest,NSW,Registered,Medium,37996967437,,,,,,,,0.0,0.0,Adults - aged 25 to under 65; Adults - aged 65 and over; Children - aged 6 to under 15; Early childhood - aged under 6; Families; Youth - 15 to under 25,12 Jun 2022,1.0
572,https://www.acnc.gov.au/charity/charities/417b6e09-2caf-e811-a961-000d3ad24182/profile,St Aidan's Anglican Church Hurstville Grove,Hurstville Grove,NSW,Registered,Medium,77676658112,,,,,,,http://grovechurch.org.au/,,,,,1.0
573,https://www.acnc.gov.au/charity/charities/0a45b10f-2caf-e811-a961-000d3ad24182/profile,St Clements Anglican Church Mosman,Mosman,NSW,Registered,Medium,13567272378,,,,,,,http://www.stclementsmosman.org.au/,0.0,0.0,Adults - aged 25 to under 65; Adults - aged 65 and over; Children - aged 6 to under 15; Early childhood - aged under 6; Families; Females; Males; People in rural/regional/remote communities; Youth - 15 to under 25,19 May 2022,1.0
574,https://www.acnc.gov.au/charity/charities/79cab315-2caf-e811-a961-000d3ad24182/profile,Trustees Of The Catholic Women's League Archdiocese Of Sydney,Strathfield,NSW,Registered,Medium,32045057892,,,,,,,,480407.0,567798.0,Adults - aged 65 and over; General community in Australia,25 May 2020,0.0
575,https://www.acnc.gov.au/charity/charities/fcc6b315-2caf-e811-a961-000d3ad24182/profile,Mollymook Surf Life Saving Club Incorporated,Ulladulla,NSW,Registered,Medium,26143432047,,,,,,,http://www.mollymooksurf.com.au/,,,,,0.0
576,https://www.acnc.gov.au/charity/charities/3a3bb10f-2caf-e811-a961-000d3ad24182/profile,Sydney Life Church,Neutral Bay,NSW,Registered,Medium,38142206042,,,,,,,,367814.0,384134.0,Aboriginal and Torres Strait Islander people; Adults - aged 65 and over; Early childhood - aged under 6; Families; Females; General community in Australia; Males; People from a culturally and linguistically diverse background; People with chronic illness (including terminal illness); Pre/post release offenders and/or their families; Youth - 15 to under 25,28 Jan 2022,1.0
577,https://www.acnc.gov.au/charity/charities/1fc2b315-2caf-e811-a961-000d3ad24182/profile,Perth Chinese Christian Church,Doubleview,WA,Registered,Medium,68685229874,,,,,,,http://www.pccc.org.au/,672688.0,640261.0,General community in Australia; People from a culturally and linguistically diverse background,20 Dec 2021,1.0
578,https://www.acnc.gov.au/charity/charities/9bcbb315-2caf-e811-a961-000d3ad24182/profile,Museum And Gallery Services Queensland Limited,Hendra,QLD,Registered,Medium,32109874811,,,,,,,http://www.magsq.com.au/,,,,,0.0
