,Index_Link,Legal_Name,Town/Suburb,State,Status,Size,ABN,Website,Revenue,Expenses,Cause/s,Last_report_date,ref_religion,website,revenue,expenses,causes,lastreport,religious_ref
439,https://www.acnc.gov.au/charity/charities/d1ac9ca4-39af-e811-a963-000d3ad24077/profile,Monash City Church Of Christ,Glen Waverley,VIC,Registered,Medium,53283981478,,,,,,,http://www.mccoc.org.au/,292600.0,289735.0,Adults - aged 25 to under 65; Adults - aged 65 and over; Children - aged 6 to under 15; Early childhood - aged under 6; Families; Females; Financially disadvantaged people; General community in Australia; Males; Overseas communities or charities; People at risk of homelessness/ people experiencing homelessness; People from a culturally and linguistically diverse background; People in rural/regional/remote communities; People with chronic illness (including terminal illness); People with disabilities; Unemployed persons; Veterans and/or their families; Victims of crime (including family violence); Youth - 15 to under 25,31 Jan 2022,1.0
440,https://www.acnc.gov.au/charity/charities/85ac9ca4-39af-e811-a963-000d3ad24077/profile,Northern Illawarra Neighbour Aid Incorporated,Helensburgh,NSW,Registered,Medium,53458312762,,,,,,,https://www.nina.org.au/,,,,,0.0
441,https://www.acnc.gov.au/charity/charities/9c4ebad9-39af-e811-a963-000d3ad24077/profile,Tuntable Falls Community School Incorperated,Nimbin,NSW,Registered,Medium,19471108136,,,,,,,http://www.tuntablefallsschool.net.edu.au/,0.0,0.0,Children - aged 6 to under 15; Early childhood - aged under 6; People in rural/regional/remote communities,11 Jul 2022,0.0
442,https://www.acnc.gov.au/charity/charities/4310b7df-39af-e811-a963-000d3ad24077/profile,Cradle Coast Innovation Inc.,Ulverstone,TAS,Registered,Medium,30413968436,,,,,,,http://www.switchtasmania.com.au/,663307.0,944964.0,Adults - aged 25 to under 65; Adults - aged 65 and over; General community in Australia,13 Jan 2022,0.0
443,https://www.acnc.gov.au/charity/charities/e7491eec-39af-e811-a963-000d3ad24077/profile,Bodhisaddha Forest Monastery Property Limited,Wilton,NSW,Registered,Medium,40164146445,,,,,,,https://www.bodhisaddha.org/wat/en/,,,,,0.0
444,https://www.acnc.gov.au/charity/charities/db0815f2-39af-e811-a963-000d3ad24077/profile,THE TRUSTEE FOR ADA BOOTH TRUST FUND,Waverley Gardens,VIC,Registered,Medium,47950172081,,,,,,,,549883.0,423988.0,Adults - aged 25 to under 65; Adults - aged 65 and over; Youth - 15 to under 25,27 Jan 2022,0.0
445,https://www.acnc.gov.au/charity/charities/180a15f2-39af-e811-a963-000d3ad24077/profile,New Vine Lakes Baptist Church,Eleebana,NSW,Registered,Medium,42510941393,,,,,,,http://www.newvinelakes.com.au/,0.0,0.0,Adults - aged 25 to under 65; Adults - aged 65 and over; Children - aged 6 to under 15; Early childhood - aged under 6; Families; Females; Financially disadvantaged people; Males; Other charities; Overseas communities or charities; People with chronic illness (including terminal illness); Unemployed persons; Youth - 15 to under 25,14 Sep 2021,1.0
446,https://www.acnc.gov.au/charity/charities/1dad8a04-3aaf-e811-a963-000d3ad24077/profile,CASSE AUSTRALIA LIMITED,Alice Springs,NT,Registered,Medium,17811536315,,,,,,,http://www.casse.org.au/,,,,,0.0
447,https://www.acnc.gov.au/charity/charities/98722937-39af-e811-a963-000d3ad24077/profile,Thurgoona Preschool Inc,Unavailable,NSW,Registered,Medium,30385937517,,,,,,,http://www.thurgoonapreschool.com.au/,820877.0,921647.0,Aboriginal and Torres Strait Islander people; Early childhood - aged under 6; Families; Financially disadvantaged people; People from a culturally and linguistically diverse background; People in rural/regional/remote communities,17 Mar 2022,0.0
448,https://www.acnc.gov.au/charity/charities/451957fe-39af-e811-a963-000d3ad24077/profile,Surfers Paradise Assembly of God Property Holdings Ltd,Surfers Paradise,QLD,Registered,Medium,82010869566,,,,,,,http://www.presence.org.au/,865145.0,595597.0,Aboriginal and Torres Strait Islander people; Adults - aged 25 to under 65; Adults - aged 65 and over; Children - aged 6 to under 15; Early childhood - aged under 6; Families; Females; Financially disadvantaged people; General community in Australia; Males; People at risk of homelessness/ people experiencing homelessness; People from a culturally and linguistically diverse background; People in rural/regional/remote communities; People with chronic illness (including terminal illness); People with disabilities; Pre/post release offenders and/or their families; Unemployed persons; Veterans and/or their families; Victims of crime (including family violence); Victims of disaster; Youth - 15 to under 25,9 May 2022,1.0
449,https://www.acnc.gov.au/charity/charities/551c57fe-39af-e811-a963-000d3ad24077/profile,Greek Orthodox Community Box Hill & Districts Inc,Richmond North,VIC,Registered,Medium,17363433510,,,,,,,,,,,,0.0
450,https://www.acnc.gov.au/charity/charities/0d3d1eec-39af-e811-a963-000d3ad24077/profile,Nature Conservation Margaret River Region Inc.,Margaret River,WA,Registered,Medium,20103363831,,,,,,,http://www.natureconservation.org.au/,966007.0,966007.0,Adults - aged 25 to under 65; Adults - aged 65 and over; Children - aged 6 to under 15; Environment; Families,16 Dec 2021,0.0
451,https://www.acnc.gov.au/charity/charities/d01c57fe-39af-e811-a963-000d3ad24077/profile,The Tall Foundation,Kingston,ACT,Registered,Medium,76646905220,,,,,,,,602756.0,429777.0,Other charities,24 Jan 2022,0.0
452,https://www.acnc.gov.au/charity/charities/0e411eec-39af-e811-a963-000d3ad24077/profile,Knox Baptist Community Chyrch,Boronia,VIC,Registered,Medium,35129739982,,,,,,,http://www.kcbc.org.au/,,,,,0.0
453,https://www.acnc.gov.au/charity/charities/031215f2-39af-e811-a963-000d3ad24077/profile,Bayview Heights Community Kindergarten Association Incorporated,Bayview Heights,QLD,Registered,Medium,61520941102,,,,,,,http://www.bayviewheightskindy.com.au/,414242.0,373983.0,Early childhood - aged under 6,14 Mar 2022,0.0
454,https://www.acnc.gov.au/charity/charities/53dc11f8-39af-e811-a963-000d3ad24077/profile,SMBC FOUNDATION LIMITED,Croydon,NSW,Registered,Medium,42059502117,,,,,,,http://www.smbc.edu.au/,725326.0,648418.0,Adults - aged 25 to under 65; Overseas communities or charities; People from a culturally and linguistically diverse background,27 Jan 2022,1.0
455,https://www.acnc.gov.au/charity/charities/02497a44-3aaf-e811-a963-000d3ad24077/profile,Lutheran Church of Australia Queensland District trading as Faith Lutheran College Outside School Hours Care,Thornlands,QLD,Registered,Medium,51759252610,,,,,,,,,,,,1.0
456,https://www.acnc.gov.au/charity/charities/6d447a44-3aaf-e811-a963-000d3ad24077/profile,The Freedom Hub Ltd,Waterloo,NSW,Registered,Medium,18168758530,,,,,,,http://www.thefreedomhub.org/,783742.0,832628.0,Financially disadvantaged people; People from a culturally and linguistically diverse background; Victims of crime (including family violence),27 Jun 2022,0.0
457,https://www.acnc.gov.au/charity/charities/ba9b1137-3aaf-e811-a963-000d3ad24077/profile,Toormina Community Preschool Inc,Toormina,NSW,Registered,Medium,43742231412,,,,,,,http://www.toorminapreschool.com.au/,716536.0,668167.0,Aboriginal and Torres Strait Islander people; Early childhood - aged under 6; General community in Australia; People from a culturally and linguistically diverse background; People in rural/regional/remote communities; People with disabilities,20 May 2022,0.0
458,https://www.acnc.gov.au/charity/charities/214fbad9-39af-e811-a963-000d3ad24077/profile,Prince Henry Hospital Trained Nurses Association Inc,Little Bay,NSW,Registered,Medium,19429143343,,,,,,,http://princehenryhospitalmuseum.org/,,,,,0.0
459,https://www.acnc.gov.au/charity/charities/6fb3a898-39af-e811-a963-000d3ad24077/profile,Dampier Seafarers Centre Incorporated,Dampier,WA,Registered,Medium,37385069261,,,,,,,http://www.dampierseafarers.org/,768639.0,728513.0,Adults - aged 25 to under 65; People from a culturally and linguistically diverse background,30 May 2022,1.0
460,https://www.acnc.gov.au/charity/charities/adbea898-39af-e811-a963-000d3ad24077/profile,Injune Kindergarten Association Inc,Injune,QLD,Registered,Medium,77228002399,,,,,,,https://injuneearlylearning.com.au/,540423.0,475759.0,Early childhood - aged under 6,9 Jun 2022,0.0
461,https://www.acnc.gov.au/charity/charities/cc58bad9-39af-e811-a963-000d3ad24077/profile,Murray Adult Community Education-Swan Hill Inc,Swan Hill,VIC,Registered,Medium,48439003506,,,,,,,http://www.macesh.vic.edu.au/,,,,,0.0
462,https://www.acnc.gov.au/charity/charities/830cb7df-39af-e811-a963-000d3ad24077/profile,Kenmore District Kindergarten & Preschool Assoc Inc,Kenmore,QLD,Registered,Medium,13373295187,,,,,,,http://www.kdkindy.com.au/,681299.0,752664.0,Early childhood - aged under 6,22 Mar 2022,0.0
463,https://www.acnc.gov.au/charity/charities/ec0cb7df-39af-e811-a963-000d3ad24077/profile,Maroochy Neighbourhood Centre Inc,Cotton Tree,QLD,Registered,Medium,43384302100,,,,,,,http://www.maroochync.org.au/,501996.0,444524.0,Aboriginal and Torres Strait Islander people; Adults - aged 25 to under 65; Adults - aged 65 and over; Children - aged 6 to under 15; Early childhood - aged under 6; Environment; Families; Females; Financially disadvantaged people; General community in Australia; Males; People at risk of homelessness/ people experiencing homelessness; People from a culturally and linguistically diverse background; People in rural/regional/remote communities; People with chronic illness (including terminal illness); People with disabilities; Pre/post release offenders and/or their families; Unemployed persons; Veterans and/or their families; Victims of crime (including family violence); Victims of disaster; Youth - 15 to under 25,19 Jan 2022,0.0
464,https://www.acnc.gov.au/charity/charities/8f14b7df-39af-e811-a963-000d3ad24077/profile,Collective Shout Limited,Sydney,NSW,Registered,Medium,30162159097,,,,,,,http://collectiveshout.org/,,,,,0.0
465,https://www.acnc.gov.au/charity/charities/5a3c1eec-39af-e811-a963-000d3ad24077/profile,National Indigenous Culinary Institute Ltd,Surry Hills,NSW,Registered,Medium,91159273720,,,,,,,https://www.nici.org.au/,425831.0,179805.0,Aboriginal and Torres Strait Islander people; Adults - aged 25 to under 65; Youth - 15 to under 25,31 Jan 2022,0.0
466,https://www.acnc.gov.au/charity/charities/df0cb7df-39af-e811-a963-000d3ad24077/profile,Alt Association Inc,Renmark,Unavailable,Registered,Medium,13373732474,,,,,,,http://www.alt.org.au/,790409.0,785908.0,Aboriginal and Torres Strait Islander people; Environment,11 Nov 2021,0.0
467,https://www.acnc.gov.au/charity/charities/003d1eec-39af-e811-a963-000d3ad24077/profile,MUMUS Inc.,Monash University,VIC,Registered,Medium,89612334553,,,,,,,http://mumus.org/,,,,,0.0
468,https://www.acnc.gov.au/charity/charities/7a487a44-3aaf-e811-a963-000d3ad24077/profile,Lutheran Church of Australia Queensland District trading as Good Shepherd Lutheran College Outside School Hours Care,Noosaville,QLD,Registered,Medium,90511398001,,,,,,,,264154.0,274477.0,Children - aged 6 to under 15; Early childhood - aged under 6,11 Jul 2022,1.0
469,https://www.acnc.gov.au/charity/charities/85b08ce0-2daf-e811-a961-000d3ad24182/profile,Balnarring & District Pre School Assoc,Balnarring,VIC,Registered,Medium,78005683329,,,,,,,http://www.balnarringpreschool.org.au/,531895.0,530970.0,Early childhood - aged under 6,6 Feb 2022,0.0
470,https://www.acnc.gov.au/charity/charities/45a5171b-38af-e811-a961-000d3ad24182/profile,Newington College Parents & Friends Association,Stanmore,NSW,Registered,Medium,82410756825,,,,,,,https://www.newington.nsw.edu.au/community/parents-and-friends/,,,,,0.0
471,https://www.acnc.gov.au/charity/charities/2fbe8ce0-2daf-e811-a961-000d3ad24182/profile,All Saints Anglican Church Ainslie,Canberra,ACT,Registered,Medium,49051759978,,,,,,,,0.0,0.0,General community in Australia,30 Jun 2022,1.0
472,https://www.acnc.gov.au/charity/charities/38a3171b-38af-e811-a961-000d3ad24182/profile,San Remo Pre School Centre Inc,San Remo,VIC,Registered,Medium,20469162288,,,,,,,,489965.0,477713.0,Early childhood - aged under 6,30 Mar 2022,0.0
473,https://www.acnc.gov.au/charity/charities/d26a84e6-2daf-e811-a961-000d3ad24182/profile,The Camberwell Grammar School Foundation Limited,Canterbury,VIC,Registered,Medium,69006703171,,,,,,,http://www.cgs.vic.edu.au/,,,,,0.0
474,https://www.acnc.gov.au/charity/charities/3a6c84e6-2daf-e811-a961-000d3ad24182/profile,Coonabarabran Local Aboriginal Land Council,Coonabarabran,NSW,Registered,Medium,86363652050,,,,,,,,745403.0,367425.0,Aboriginal and Torres Strait Islander people; Adults - aged 25 to under 65; Adults - aged 65 and over; Children - aged 6 to under 15; Early childhood - aged under 6; Families; Financially disadvantaged people; People at risk of homelessness/ people experiencing homelessness; Youth - 15 to under 25,6 Dec 2021,0.0
475,https://www.acnc.gov.au/charity/charities/80ab171b-38af-e811-a961-000d3ad24182/profile,Riviera Christian Centre Inc,Bairnsdale,VIC,Registered,Medium,20589475752,,,,,,,http://www.rivieracc.org.au/,884974.0,815961.0,Adults - aged 25 to under 65; Adults - aged 65 and over; Children - aged 6 to under 15; Early childhood - aged under 6; Families; Other; Overseas communities or charities; Youth - 15 to under 25,30 Jun 2022,1.0
476,https://www.acnc.gov.au/charity/charities/8c6884e6-2daf-e811-a961-000d3ad24182/profile,Greek Orthodox Community And Parish Of Saint George The Barton And Western Suburbs Incorporated,Mile End,SA,Registered,Medium,69045286748,,,,,,,http://www.stgeorgethebarton.org/,,,,,1.0
477,https://www.acnc.gov.au/charity/charities/8dc28ce0-2daf-e811-a961-000d3ad24182/profile,Adelong Pre School Inc,Adelong,NSW,Registered,Medium,32593552002,,,,,,,http://www.adelongpreschool.com/,476169.0,415091.0,Aboriginal and Torres Strait Islander people; Early childhood - aged under 6; Families; Females; Financially disadvantaged people; General community in Australia; Males; People at risk of homelessness/ people experiencing homelessness; People from a culturally and linguistically diverse background; People in rural/regional/remote communities; People with disabilities; Victims of disaster,19 Jul 2022,0.0
478,https://www.acnc.gov.au/charity/charities/12fe94da-2daf-e811-a961-000d3ad24182/profile,Mosman Public School P&C Association,Mosman,NSW,Registered,Medium,77906990219,,,,,,,,376593.0,312834.0,Children - aged 6 to under 15,29 Jun 2022,0.0
479,https://www.acnc.gov.au/charity/charities/42ae171b-38af-e811-a961-000d3ad24182/profile,Anglican Parish Of Shepparton,Shepparton,VIC,Registered,Medium,59559844318,,,,,,,http://www.sheppartonanglican.com/,,,,,1.0
480,https://www.acnc.gov.au/charity/charities/b6be8ce0-2daf-e811-a961-000d3ad24182/profile,Paws Hoofs And Claws,Mount Isa Dc,QLD,Registered,Medium,32509879546,,,,,,,http://www.pawshoofsandclaws.com/,307653.0,167537.0,General community in Australia,7 Dec 2021,0.0
481,https://www.acnc.gov.au/charity/charities/65d90f21-38af-e811-a961-000d3ad24182/profile,St Jude's Anglican Parish Dural,Dural,NSW,Registered,Medium,94363747660,,,,,,,http://www.ddac.org.au/,0.0,0.0,Adults - aged 25 to under 65; Adults - aged 65 and over; Children - aged 6 to under 15; Early childhood - aged under 6; Families; General community in Australia; Youth - 15 to under 25,10 Apr 2022,1.0
482,https://www.acnc.gov.au/charity/charities/1ba4171b-38af-e811-a961-000d3ad24182/profile,Winmalee Neighbourhood Centre Inc,Winmalee,NSW,Registered,Medium,82441986299,,,,,,,http://www.winmaleeneighbourhoodcentre.com.au/,,,,,0.0
483,https://www.acnc.gov.au/charity/charities/c1af171b-38af-e811-a961-000d3ad24182/profile,Clancy Terrace,Unavailable,Unavailable,Registered,Medium,14137512972,,,,,,,,540909.0,530956.0,General community in Australia,20 Dec 2021,1.0
484,https://www.acnc.gov.au/charity/charities/d2a7171b-38af-e811-a961-000d3ad24182/profile,Volunteer Marine Rescue Mackay Inc,Mackay Marina,QLD,Registered,Medium,20572944700,,,,,,,https://www.vmrmackay.org.au/,491141.0,181313.0,Adults - aged 25 to under 65; Adults - aged 65 and over; Families; Males; Other; Youth - 15 to under 25,20 Dec 2021,0.0
485,https://www.acnc.gov.au/charity/charities/a6ae171b-38af-e811-a961-000d3ad24182/profile,Potters House Christian Centre Trust,Wanguri,NT,Registered,Medium,14303857326,,,,,,,http://www.pottershousedarwin.com.au/,,,,,1.0
486,https://www.acnc.gov.au/charity/charities/69be8ce0-2daf-e811-a961-000d3ad24182/profile,St John's Anglican Church Toorak,Toorak,VIC,Registered,Medium,32359171071,,,,,,,http://www.saintjohnstoorak.org/,0.0,0.0,Adults - aged 25 to under 65; Adults - aged 65 and over; Animals; Children - aged 6 to under 15; Families; Females; Financially disadvantaged people; General community in Australia; Males; People with chronic illness (including terminal illness); People with disabilities; Unemployed persons; Veterans and/or their families; Victims of crime (including family violence); Victims of disaster; Youth - 15 to under 25,2 Mar 2022,1.0
487,https://www.acnc.gov.au/charity/charities/786b84e6-2daf-e811-a961-000d3ad24182/profile,The Trustee For The LBW Trust,Unavailable,Unavailable,Registered,Medium,86357910732,,,,,,,http://www.lbwtrust.com.au/,875601.0,789794.0,Females; Financially disadvantaged people; Males; Overseas communities or charities; Youth - 15 to under 25,31 Jan 2022,0.0
488,https://www.acnc.gov.au/charity/charities/6e7592b3-3aaf-e811-a963-000d3ad24077/profile,North Home Textiles Ltd,Darwin,NT,Registered,Medium,48619385581,,,,,,,http://www.northhome.org/,,,,,0.0
489,https://www.acnc.gov.au/charity/charities/c324e793-3aaf-e811-a963-000d3ad24077/profile,Fitra Community School,Noble Park,VIC,Registered,Medium,67616832967,,,,,,,http://www.fitra.vic.edu.au/,680476.0,556860.0,Children - aged 6 to under 15,28 Jun 2022,0.0
490,https://www.acnc.gov.au/charity/charities/8b3e95a0-3aaf-e811-a963-000d3ad24077/profile,Australian Friends of Tel Aviv University,Toorak,VIC,Registered,Medium,66309569145,,,,,,,http://www.aftau.asn.au/,304426.0,602800.0,Adults - aged 25 to under 65; Overseas communities or charities; Youth - 15 to under 25,24 Feb 2022,0.0
491,https://www.acnc.gov.au/charity/charities/734f91a6-3aaf-e811-a963-000d3ad24077/profile,Spiritgrow Wellness Institute Limited,Caulfield North,VIC,Registered,Medium,23619857715,,,,,,,https://www.spiritgrowjosefkrysscenter.org/,,,,,0.0
492,https://www.acnc.gov.au/charity/charities/6e5c9bad-3aaf-e811-a963-000d3ad24077/profile,Science Teachers' Association of Western Australia Inc,Karawara,WA,Registered,Medium,65971045197,,,,,,,http://www.stawa.net/,481541.0,495624.0,Children - aged 6 to under 15; Early childhood - aged under 6; Youth - 15 to under 25,6 Dec 2021,0.0
493,https://www.acnc.gov.au/charity/charities/d28292b3-3aaf-e811-a963-000d3ad24077/profile,The Dodge Family Foundation,South Yarra,VIC,Registered,Medium,11285076458,,,,,,,,584249.0,164948.0,Families; Financially disadvantaged people; General community in Australia; Other charities,28 Jan 2022,0.0
494,https://www.acnc.gov.au/charity/charities/fb4c329a-3aaf-e811-a963-000d3ad24077/profile,Cairns TAFE Community Child Care Centre Association Inc,Manunda,QLD,Registered,Medium,66271488372,,,,,,,http://www.ctcccc.com.au/,,,,,0.0
495,https://www.acnc.gov.au/charity/charities/db1d8dd4-2daf-e811-a961-000d3ad24182/profile,Twin City Christian Centre Limited,Albury,NSW,Registered,Medium,90266556552,,,,,,,http://www.citycentral.com.au/,662948.0,443568.0,Adults - aged 25 to under 65; Adults - aged 65 and over; Children - aged 6 to under 15; Early childhood - aged under 6; Families; Youth - 15 to under 25,31 Jan 2022,1.0
496,https://www.acnc.gov.au/charity/charities/ba0095da-2daf-e811-a961-000d3ad24182/profile,Anglican Parish Of Banyule,Heidelberg,VIC,Registered,Medium,73239812506,,,,,,,http://www.banyuleparish.org.au/,0.0,0.0,General community in Australia; Overseas communities or charities,22 Mar 2022,1.0
497,https://www.acnc.gov.au/charity/charities/f7fe94da-2daf-e811-a961-000d3ad24182/profile,St Josephs Catholic Primary School Balranald,Forbes,NSW,Registered,Medium,77910361568,,,,,,,http://www.wf.catholic.edu.au/,,,,,0.0
498,https://www.acnc.gov.au/charity/charities/89fe94da-2daf-e811-a961-000d3ad24182/profile,Bairnsdale Neighbourhood House Inc,Bairnsdale,VIC,Registered,Medium,77908530391,,,,,,,,429053.0,290456.0,Aboriginal and Torres Strait Islander people; Adults - aged 25 to under 65; Adults - aged 65 and over; Animals; Children - aged 6 to under 15; Early childhood - aged under 6; Environment; Families; Females; Financially disadvantaged people; General community in Australia; Males; Other charities; People at risk of homelessness/ people experiencing homelessness; People from a culturally and linguistically diverse background; People in rural/regional/remote communities; People with chronic illness (including terminal illness); People with disabilities; Pre/post release offenders and/or their families; Unemployed persons; Veterans and/or their families; Victims of crime (including family violence); Victims of disaster; Youth - 15 to under 25,3 Nov 2021,0.0
499,https://www.acnc.gov.au/charity/charities/9f188dd4-2daf-e811-a961-000d3ad24182/profile,Stuarts Point Pre School Association Incorporated,Stuarts Point,NSW,Registered,Medium,94124916017,,,,,,,,293880.0,304395.0,Aboriginal and Torres Strait Islander people; Early childhood - aged under 6; Families; Financially disadvantaged people; People in rural/regional/remote communities,29 Jun 2022,0.0
500,https://www.acnc.gov.au/charity/charities/fd168dd4-2daf-e811-a961-000d3ad24182/profile,Engadine Pre School Kindergarten Inc,Engadine,NSW,Registered,Medium,94122115906,,,,,,,http://www.engadinepreschool.org.au/,,,,,0.0
501,https://www.acnc.gov.au/charity/charities/d8e00f21-38af-e811-a961-000d3ad24182/profile,BETHEL PRESBYTERIAN CHURCH INC.,Brisbane,QLD,Registered,Medium,78291468340,,,,,,,http://www.bethelpc.org/,432115.0,366634.0,Adults - aged 25 to under 65; Adults - aged 65 and over; Children - aged 6 to under 15; Early childhood - aged under 6; Families; People from a culturally and linguistically diverse background; Youth - 15 to under 25,29 Jun 2022,1.0
502,https://www.acnc.gov.au/charity/charities/fbaa171b-38af-e811-a961-000d3ad24182/profile,Grace Outside School Hours Care Centre,Clontarf,QLD,Registered,Medium,20587405662,,,,,,,,602443.0,494808.0,Children - aged 6 to under 15,22 Jun 2022,0.0
503,https://www.acnc.gov.au/charity/charities/0ed90f21-38af-e811-a961-000d3ad24182/profile,Pilgrim Foundation Incorporated,Adelaide,SA,Registered,Medium,94352256492,,,,,,,http://www.pilgrim.org.au/,,,,,0.0
504,https://www.acnc.gov.au/charity/charities/09c38ce0-2daf-e811-a961-000d3ad24182/profile,Launceston V F C Services Inc,Launceston,TAS,Registered,Medium,32593612573,,,,,,,https://launcestonvolunteersforcommunity.com.au/,480956.0,493970.0,Adults - aged 25 to under 65; Adults - aged 65 and over; Financially disadvantaged people; People with disabilities,31 Jan 2022,0.0
505,https://www.acnc.gov.au/charity/charities/56f2d851-38af-e811-a961-000d3ad24182/profile,Lifepointe Baptist Church,Buderim,QLD,Registered,Medium,82873150224,,,,,,,http://www.lifepointe.org.au/,0.0,0.0,Adults - aged 25 to under 65; Adults - aged 65 and over; Children - aged 6 to under 15; Early childhood - aged under 6; Families; Females; Financially disadvantaged people; General community in Australia; Males; People at risk of homelessness/ people experiencing homelessness; Unemployed persons; Youth - 15 to under 25,23 May 2022,1.0
506,https://www.acnc.gov.au/charity/charities/4bebd851-38af-e811-a961-000d3ad24182/profile,Mackay Coloured Co-Operative Society Ltd,Mackay,QLD,Registered,Medium,39108869141,,,,,,,,,,,,0.0
507,https://www.acnc.gov.au/charity/charities/d8496f45-38af-e811-a961-000d3ad24182/profile,Bundaberg A P And I Society Inc,Bundaberg,QLD,Registered,Medium,21134402026,,,,,,,http://www.bundabergshow.com.au/,376080.0,195459.0,Aboriginal and Torres Strait Islander people; Adults - aged 25 to under 65; Adults - aged 65 and over; Animals; Children - aged 6 to under 15; Early childhood - aged under 6; Environment; Families; Females; Financially disadvantaged people; General community in Australia; Males; People from a culturally and linguistically diverse background; People in rural/regional/remote communities; People with disabilities; Unemployed persons; Veterans and/or their families; Youth - 15 to under 25,14 Jan 2022,0.0
508,https://www.acnc.gov.au/charity/charities/66f2d851-38af-e811-a961-000d3ad24182/profile,High Wycombe Out Of School Care Centre Incorporated,High Wycombe,WA,Registered,Medium,59970837508,,,,,,,http://www.hwosc.org/,309020.0,255432.0,Children - aged 6 to under 15; Families,28 Jun 2022,0.0
509,https://www.acnc.gov.au/charity/charities/dbef2739-38af-e811-a961-000d3ad24182/profile,Quang Minh Temple,Braybrook,VIC,Registered,Medium,74089754227,,,,,,,http://www.quangminh.org.au/,,,,,0.0
510,https://www.acnc.gov.au/charity/charities/79a9674b-38af-e811-a961-000d3ad24182/profile,Liberty For The Nations Incorporated,Unavailable,Unavailable,Registered,Medium,69544907649,,,,,,,http://www.libertypeople.com.au/,726197.0,700831.0,Children - aged 6 to under 15; Early childhood - aged under 6; Families; Financially disadvantaged people; Overseas communities or charities; People at risk of homelessness/ people experiencing homelessness; People in rural/regional/remote communities; People with disabilities; Unemployed persons; Victims of disaster; Youth - 15 to under 25,20 Jan 2022,1.0
